,message,Direct Harassment,Hate Speech,Sexual Harassment,Trolling,Others,Toxic,cleaned_message,POS,tagCounts,preprocessed_1,POS-SEQ,None,words,uppercase_word_count,punctuation_count,not_in_vocab_words
441,CULT45 SQUARELY BEHIND THE 🎱 ON THE U.S. ELECTIONS......HES DONE,0.0,0.0,0.0,0.0,0.0,0.0,CULT45 SQUARELY BEHIND THE 🎱 ON THE you.S. ELECTIONS......HES DONE,"[('cult45', 'X'), ('SQUARELY', 'PROPN'), ('behind', 'ADP'), ('the', 'DET'), ('🎱', 'EMOJI'), ('on', 'ADP'), ('the', 'DET'), ('you', 'PRON'), ('.', 'PUNCT'), ('S.', 'PROPN'), ('ELECTIONS', 'PROPN'), ('......', 'PUNCT'), ('HES', 'PROPN'), ('do', 'VERB')]","{'X': 1, 'PROPN': 4, 'ADP': 2, 'DET': 2, 'EMOJI': 1, 'PRON': 1, 'PUNCT': 2, 'VERB': 1}",cult45 squarely 🎱 u.s. elections ...... hes do,X PROPN ADP EMOJI PROPN PROPN PROPN,1.0,cult45 SQUARELY behind S. ELECTIONS ...... HES,11,8,cult45
442,Busted!,0.0,0.0,0.0,0.0,0.0,0.0,Busted!,"[('bust', 'VERB'), ('!', 'PUNCT')]","{'VERB': 1, 'PUNCT': 1}",bust,VERB,1.0,bust,0,1,
443,🤟BYE👋DON👍 2020..ish,0.0,0.0,0.0,0.0,0.0,0.0,🤟BYE👋DON👍 2020..ish,"[('🤟', 'EMOJI'), ('BYE', 'PROPN'), ('👋', 'EMOJI'), ('DON', 'PROPN'), ('👍', 'EMOJI'), ('2020', 'NUM'), ('..', 'PUNCT'), ('ish', 'VERB')]","{'EMOJI': 3, 'PROPN': 2, 'NUM': 1, 'PUNCT': 1, 'VERB': 1}",🤟 bye 👋 don 👍 2020 .. ish,EMOJI PROPN EMOJI PROPN EMOJI NUM VERB,1.0,BYE 2020 .. ish,2,2,
444,TURKEY WITH CRANBERRY SAUCD,0.0,0.0,0.0,0.0,0.0,0.0,TURKEY WITH CRANBERRY SAUCD,"[('TURKEY', 'PROPN'), ('with', 'ADP'), ('CRANBERRY', 'PROPN'), ('saucd', 'NOUN')]","{'PROPN': 2, 'ADP': 1, 'NOUN': 1}",turkey cranberry saucd,PROPN PROPN NOUN,1.0,TURKEY CRANBERRY saucd,4,0,cranberry saucd
445,Maga Trump 2020 Faux News Suck,1.0,0.0,0.0,0.0,0.0,0.0,Maga Trump 2020 Faux News Suck,"[('Maga', 'PROPN'), ('Trump', 'PROPN'), ('2020', 'NUM'), ('Faux', 'PROPN'), ('News', 'PROPN'), ('Suck', 'PROPN')]","{'PROPN': 5, 'NUM': 1}",maga trump 2020 faux news suck,PROPN PROPN NUM PROPN PROPN PROPN,0.0,Maga Trump 2020 Faux News Suck,0,0,maga
446,Mike Haley🙋🏼‍♂️👌🏻👌🏻,0.0,0.0,0.0,0.0,0.0,0.0,Mike Haley🙋🏼‍♂️👌🏻👌🏻,"[('Mike', 'PROPN'), ('Haley', 'PROPN'), ('🙋🏼\u200d♂️', 'EMOJI'), ('👌🏻', 'EMOJI'), ('👌🏻', 'EMOJI')]","{'PROPN': 2, 'EMOJI': 3}",mike haley 🏼‍ ♂ ️ 🏻 👌 🏻,PROPN PROPN EMOJI EMOJI EMOJI,1.0,Mike Haley,0,0,haley
447,even dead people voted for the Big guy...,0.0,0.0,0.0,1.0,0.0,0.0,even dead people voted for the Big guy...,"[('even', 'ADV'), ('dead', 'ADJ'), ('people', 'NOUN'), ('vote', 'VERB'), ('for', 'ADP'), ('the', 'DET'), ('big', 'ADJ'), ('guy', 'NOUN'), ('...', 'PUNCT')]","{'ADV': 1, 'ADJ': 2, 'NOUN': 2, 'VERB': 1, 'ADP': 1, 'DET': 1, 'PUNCT': 1}",even dead people vote big guy ...,ADV ADJ NOUN VERB ADJ NOUN,0.0,even dead people vote big guy ...,0,3,
448,Mike please tell me why,0.0,0.0,0.0,0.0,0.0,0.0,Mike please tell me why,"[('Mike', 'PROPN'), ('please', 'INTJ'), ('tell', 'VERB'), ('I', 'PRON'), ('why', 'ADV')]","{'PROPN': 1, 'INTJ': 1, 'VERB': 1, 'PRON': 1, 'ADV': 1}",mike please tell why,PROPN INTJ VERB PRON,1.0,Mike please tell,0,0,
449,c'mon do lund trump,1.0,0.0,0.0,0.0,0.0,0.0,c'mon do lund trump,"[(""c'm"", 'VERB'), ('on', 'ADP'), ('do', 'VERB'), ('lund', 'NOUN'), ('trump', 'NOUN')]","{'VERB': 2, 'ADP': 1, 'NOUN': 2}",cmon do lund trump,VERB NOUN NOUN,0.0,c'm lund trump,0,0,cmon
450,why is my last 2 comments in pale grey now? almost faded out. am I muted? I didn't say anything wrong or rude.,0.0,0.0,0.0,0.0,0.0,0.0,why is my last 2 comments in pale grey now? almost faded out. am I muted? I did not say anything wrong or rude.,"[('why', 'ADV'), ('be', 'AUX'), ('my', 'PRON'), ('last', 'ADJ'), ('2', 'NUM'), ('comment', 'NOUN'), ('in', 'ADP'), ('pale', 'ADJ'), ('grey', 'NOUN'), ('now', 'ADV'), ('?', 'PUNCT'), ('almost', 'ADV'), ('fade', 'VERB'), ('out', 'ADP'), ('.', 'PUNCT'), ('be', 'AUX'), ('I', 'PRON'), ('mute', 'VERB'), ('?', 'PUNCT'), ('I', 'PRON'), ('do', 'AUX'), ('not', 'PART'), ('say', 'VERB'), ('anything', 'PRON'), ('wrong', 'ADJ'), ('or', 'CCONJ'), ('rude', 'ADJ'), ('.', 'PUNCT')]","{'ADV': 3, 'AUX': 3, 'PRON': 4, 'ADJ': 4, 'NUM': 1, 'NOUN': 2, 'ADP': 2, 'PUNCT': 4, 'VERB': 3, 'PART': 1, 'CCONJ': 1}",why last 2 comment pale grey now almost fade mute not say wrong rude,ADJ NUM NOUN ADJ NOUN ADV VERB PRON VERB PRON VERB PRON ADJ ADJ,1.0,last 2 comment pale grey almost fade mute say anything wrong rude,2,4,
451,Jesus Christ is coming soon to rapture his people repent and accept him as Lord and savior 🙏🙌🕊️✝️🛐❤️,0.0,0.0,0.0,0.0,0.0,0.0,Jesus Christ is coming soon to rapture his people repent and accept him as Lord and savior 🙏🙌🕊️✝️🛐❤️,"[('Jesus', 'PROPN'), ('Christ', 'PROPN'), ('be', 'AUX'), ('come', 'VERB'), ('soon', 'ADV'), ('to', 'PART'), ('rapture', 'VERB'), ('his', 'PRON'), ('people', 'NOUN'), ('repent', 'VERB'), ('and', 'CCONJ'), ('accept', 'VERB'), ('he', 'PRON'), ('as', 'ADP'), ('Lord', 'PROPN'), ('and', 'CCONJ'), ('savior', 'ADJ'), ('🙏', 'EMOJI'), ('🙌', 'EMOJI'), ('🕊️', 'EMOJI'), ('✝️', 'EMOJI'), ('🛐', 'EMOJI'), ('❤️', 'EMOJI')]","{'PROPN': 3, 'AUX': 1, 'VERB': 4, 'ADV': 1, 'PART': 1, 'PRON': 2, 'NOUN': 1, 'CCONJ': 2, 'ADP': 1, 'ADJ': 1, 'EMOJI': 6}",jesus christ come soon to rapture people repent accept lord savior 🙏 🙌 🕊 ️ ✝ ️ 🛐 ❤ ️,PROPN PROPN VERB ADV VERB NOUN VERB VERB PROPN ADJ EMOJI EMOJI EMOJI EMOJI EMOJI EMOJI,1.0,Jesus Christ come soon rapture people repent accept Lord savior,0,0,
452,the turkey pardons the turkey,0.0,0.0,0.0,0.0,0.0,0.0,the turkey pardons the turkey,"[('the', 'DET'), ('turkey', 'PROPN'), ('pardon', 'VERB'), ('the', 'DET'), ('turkey', 'NOUN')]","{'DET': 2, 'PROPN': 1, 'VERB': 1, 'NOUN': 1}",turkey pardon turkey,PROPN VERB NOUN,1.0,turkey pardon turkey,0,0,
453,Sammy you are limited,0.0,0.0,0.0,0.0,0.0,0.0,Sammy you are limited,"[('sammy', 'ADJ'), ('you', 'PRON'), ('be', 'AUX'), ('limited', 'ADJ')]","{'ADJ': 2, 'PRON': 1, 'AUX': 1}",sammy limited,ADJ ADJ,1.0,sammy limited,0,0,
454,China Virus. It came from China,0.0,1.0,0.0,0.0,0.0,0.0,China Virus. It came from China,"[('China', 'PROPN'), ('Virus', 'PROPN'), ('.', 'PUNCT'), ('it', 'PRON'), ('come', 'VERB'), ('from', 'ADP'), ('China', 'PROPN')]","{'PROPN': 3, 'PUNCT': 1, 'PRON': 1, 'VERB': 1, 'ADP': 1}",china virus come china,PROPN PROPN VERB PROPN,0.0,China Virus come China,0,1,
455,"Why isn't the ""president-elect"" trying to pardon this turkey with his transition team? Outrageous!",1.0,0.0,0.0,0.0,0.0,0.0,"Why is not the ""president-elect"" trying to pardon this turkey with his transition team? Outrageous!","[('why', 'ADV'), ('be', 'AUX'), ('not', 'PART'), ('the', 'DET'), ('""', 'PUNCT'), ('president', 'PROPN'), ('-', 'PUNCT'), ('elect', 'PROPN'), ('""', 'PUNCT'), ('try', 'VERB'), ('to', 'PART'), ('pardon', 'VERB'), ('this', 'DET'), ('turkey', 'NOUN'), ('with', 'ADP'), ('his', 'PRON'), ('transition', 'NOUN'), ('team', 'NOUN'), ('?', 'PUNCT'), ('outrageous', 'ADJ'), ('!', 'PUNCT')]","{'ADV': 1, 'AUX': 1, 'PART': 2, 'DET': 2, 'PUNCT': 5, 'PROPN': 2, 'VERB': 2, 'NOUN': 3, 'ADP': 1, 'PRON': 1, 'ADJ': 1}",why not president elect try to pardon turkey transition team outrageous,PROPN PROPN VERB VERB NOUN NOUN NOUN ADJ,0.0,president elect try pardon turkey transition team outrageous,0,5,
456,Last thanksgiving for you trump in White House,0.0,0.0,0.0,0.0,0.0,0.0,Last thanksgiving for you trump in White House,"[('last', 'ADJ'), ('thanksgiving', 'NOUN'), ('for', 'ADP'), ('you', 'PRON'), ('trump', 'VERB'), ('in', 'ADP'), ('White', 'PROPN'), ('House', 'PROPN')]","{'ADJ': 1, 'NOUN': 1, 'ADP': 2, 'PRON': 1, 'VERB': 1, 'PROPN': 2}",last thanksgiving trump white house,ADJ NOUN VERB PROPN PROPN,1.0,last thanksgiving trump White House,0,0,
457,Were is daddy Trump,0.0,0.0,0.0,0.0,0.0,0.0,Were is daddy Trump,"[('be', 'AUX'), ('be', 'AUX'), ('daddy', 'ADJ'), ('Trump', 'PROPN')]","{'AUX': 2, 'ADJ': 1, 'PROPN': 1}",daddy trump,ADJ PROPN,1.0,daddy Trump,0,0,
458,"TRUMP was not ""Fired"" come 2024 when he rerun and I believe he will 2024 he wins why because he connected with many people of all ethnic backgrounds NO PANDEMIC=NO BIDEN believe it or not TRUMP WINS!",0.0,0.0,0.0,1.0,0.0,0.0,"TRUMP was not ""Fired"" come 2024 when he rerun and I believe he will 2024 he wins why because he connected with many people of all ethnic backgrounds NO PANDEMIC=NO BIDEN believe it or not TRUMP WINS!","[('TRUMP', 'PROPN'), ('be', 'AUX'), ('not', 'PART'), ('""', 'PUNCT'), ('fire', 'VERB'), ('""', 'PUNCT'), ('come', 'VERB'), ('2024', 'NUM'), ('when', 'ADV'), ('he', 'PRON'), ('rerun', 'VERB'), ('and', 'CCONJ'), ('I', 'PRON'), ('believe', 'VERB'), ('he', 'PRON'), ('will', 'AUX'), ('2024', 'NUM'), ('he', 'PRON'), ('win', 'VERB'), ('why', 'ADV'), ('because', 'SCONJ'), ('he', 'PRON'), ('connect', 'VERB'), ('with', 'ADP'), ('many', 'ADJ'), ('people', 'NOUN'), ('of', 'ADP'), ('all', 'DET'), ('ethnic', 'ADJ'), ('background', 'NOUN'), ('no', 'DET'), ('PANDEMIC', 'PROPN'), ('=', 'PUNCT'), ('no', 'DET'), ('BIDEN', 'NOUN'), ('believe', 'VERB'), ('it', 'PRON'), ('or', 'CCONJ'), ('not', 'PART'), ('TRUMP', 'PROPN'), ('WINS', 'PROPN'), ('!', 'PUNCT')]","{'PROPN': 4, 'AUX': 2, 'PART': 2, 'PUNCT': 4, 'VERB': 7, 'NUM': 2, 'ADV': 2, 'PRON': 6, 'CCONJ': 2, 'SCONJ': 1, 'ADP': 2, 'ADJ': 2, 'NOUN': 3, 'DET': 3}",trump not fire come 2024 when rerun believe 2024 win why connect many people ethnic background pandemic biden believe not trump wins,PROPN VERB VERB NUM VERB PRON VERB NUM VERB VERB ADJ NOUN ADJ NOUN PROPN NOUN VERB PROPN PROPN,0.0,TRUMP fire come 2024 rerun believe 2024 win connect many people ethnic background PANDEMIC BIDEN believe TRUMP WINS,8,4,2024 2024
459,Best President ever! God Bless America !,0.0,0.0,0.0,0.0,0.0,0.0,Best President ever! God Bless America !,"[('good', 'ADJ'), ('President', 'PROPN'), ('ever', 'ADV'), ('!', 'PUNCT'), ('God', 'PROPN'), ('Bless', 'PROPN'), ('America', 'PROPN'), ('!', 'PUNCT')]","{'ADJ': 1, 'PROPN': 4, 'ADV': 1, 'PUNCT': 2}",good president ever god bless america,ADJ PROPN ADV PROPN PROPN PROPN,1.0,good President ever God Bless America,0,2,
460,It’s in slow mode @Sammy Oliver. You have to wait about a minute between post when it’s in slow mode,0.0,0.0,0.0,0.0,0.0,0.0,it is in slow mode @Sammy Oliver. You have to wait about a minute between post when it is in slow mode,"[('it', 'PRON'), ('be', 'AUX'), ('in', 'ADP'), ('slow', 'ADJ'), ('mode', 'NOUN'), ('@Sammy', 'PROPN'), ('Oliver', 'PROPN'), ('.', 'PUNCT'), ('you', 'PRON'), ('have', 'VERB'), ('to', 'PART'), ('wait', 'VERB'), ('about', 'ADV'), ('a', 'DET'), ('minute', 'NOUN'), ('between', 'ADP'), ('post', 'NOUN'), ('when', 'ADV'), ('it', 'PRON'), ('be', 'VERB'), ('in', 'ADP'), ('slow', 'ADJ'), ('mode', 'NOUN')]","{'PRON': 3, 'AUX': 1, 'ADP': 3, 'ADJ': 2, 'NOUN': 4, 'PROPN': 2, 'PUNCT': 1, 'VERB': 3, 'PART': 1, 'ADV': 2, 'DET': 1}",’s slow mode @sammy oliver have to wait about minute post when ’s slow mode,ADJ NOUN PROPN PROPN VERB NOUN NOUN ADJ NOUN,1.0,slow mode @Sammy Oliver wait minute post slow mode,0,2,@sammy
461,We Will Win,0.0,0.0,0.0,0.0,0.0,0.0,We Will Win,"[('we', 'PRON'), ('will', 'AUX'), ('win', 'VERB')]","{'PRON': 1, 'AUX': 1, 'VERB': 1}",win,VERB,1.0,win,0,0,
462,If there is no path forward for Trump... he should release all prisonsers... everywhere... good luck Biden,0.0,0.0,0.0,0.0,0.0,0.0,If there is no path forward for Trump... he should release all prisonsers... everywhere... good luck Biden,"[('if', 'SCONJ'), ('there', 'PRON'), ('be', 'VERB'), ('no', 'DET'), ('path', 'NOUN'), ('forward', 'ADV'), ('for', 'ADP'), ('Trump', 'PROPN'), ('...', 'PUNCT'), ('he', 'PRON'), ('should', 'AUX'), ('release', 'VERB'), ('all', 'DET'), ('prisonser', 'NOUN'), ('...', 'PUNCT'), ('everywhere', 'ADV'), ('...', 'PUNCT'), ('good', 'ADJ'), ('luck', 'NOUN'), ('Biden', 'PROPN')]","{'SCONJ': 1, 'PRON': 2, 'VERB': 2, 'DET': 2, 'NOUN': 3, 'ADV': 2, 'ADP': 1, 'PROPN': 2, 'PUNCT': 3, 'AUX': 1, 'ADJ': 1}",be path forward trump ... release prisonser ... everywhere ... good luck biden,NOUN ADV PROPN VERB NOUN ADV ADJ NOUN PROPN,1.0,path forward Trump ... release prisonser ... everywhere ... good luck Biden,0,9,prisonser
463,"CORN and COB - Anyone think Trump is TROLLING Biden's ""CORN POP"" story ???",0.0,0.0,0.0,0.0,0.0,0.0,"CORN and COB - Anyone think Trump is TROLLING Biden's ""CORN POP"" story ???","[('CORN', 'PROPN'), ('and', 'CCONJ'), ('COB', 'PROPN'), ('-', 'PUNCT'), ('anyone', 'PRON'), ('think', 'VERB'), ('Trump', 'PROPN'), ('be', 'AUX'), ('TROLLING', 'PROPN'), ('Biden', 'PROPN'), (""'s"", 'PART'), ('""', 'PUNCT'), ('CORN', 'PROPN'), ('POP', 'PROPN'), ('""', 'PUNCT'), ('story', 'NOUN'), ('?', 'PUNCT'), ('?', 'PUNCT'), ('?', 'PUNCT')]","{'PROPN': 7, 'CCONJ': 1, 'PUNCT': 6, 'PRON': 1, 'VERB': 1, 'AUX': 1, 'PART': 1, 'NOUN': 1}",corn cob think trump troll bidens corn pop story,PROPN PROPN PRON VERB PROPN PROPN PROPN PART PROPN PROPN NOUN,1.0,CORN COB anyone think Trump TROLLING Biden 's CORN POP story,5,6,bidens
464,Q was wrong 😑,0.0,0.0,0.0,0.0,0.0,0.0,Q was wrong 😑,"[('Q', 'PROPN'), ('be', 'AUX'), ('wrong', 'ADJ'), ('😑', 'EMOJI')]","{'PROPN': 1, 'AUX': 1, 'ADJ': 1, 'EMOJI': 1}",q wrong 😑,PROPN ADJ EMOJI,1.0,Q wrong,1,0,
465,Hopefully the reporters will let them do this without issue,0.0,0.0,0.0,0.0,0.0,0.0,Hopefully the reporters will let them do this without issue,"[('hopefully', 'ADV'), ('the', 'DET'), ('reporter', 'NOUN'), ('will', 'AUX'), ('let', 'VERB'), ('they', 'PRON'), ('do', 'VERB'), ('this', 'DET'), ('without', 'ADP'), ('issue', 'NOUN')]","{'ADV': 1, 'DET': 2, 'NOUN': 2, 'AUX': 1, 'VERB': 2, 'PRON': 1, 'ADP': 1}",hopefully reporter let do issue,ADV NOUN VERB ADP NOUN,1.0,hopefully reporter let without issue,0,0,
466,BIDEN 2024,0.0,0.0,0.0,0.0,0.0,0.0,BIDEN 2024,"[('BIDEN', 'NOUN'), ('2024', 'NUM')]","{'NOUN': 1, 'NUM': 1}",biden 2024,NOUN NUM,1.0,BIDEN 2024,1,0,2024
467,"What, is, this,? A real, President, is, speaking,.! Hallelujah.! Hallelujah,. ! Hallelujah..,! Thunderous!!! Speech. A true Commander-in-Cheif. Donald Trump, take notes... No more, reality TV",0.0,0.0,0.0,0.0,0.0,0.0,"What, is, this,? A real, President, is, speaking,.! Hallelujah.! Hallelujah,. ! Hallelujah..,! Thunderous!!! Speech. A true Commander-in-Cheif. Donald Trump, take notes... No more, reality TV","[('what', 'PRON'), (',', 'PUNCT'), ('be', 'AUX'), (',', 'PUNCT'), ('this', 'DET'), (',', 'PUNCT'), ('?', 'PUNCT'), ('a', 'DET'), ('real', 'ADJ'), (',', 'PUNCT'), ('President', 'PROPN'), (',', 'PUNCT'), ('be', 'AUX'), (',', 'PUNCT'), ('speak', 'VERB'), (',', 'PUNCT'), ('.', 'PUNCT'), ('!', 'PUNCT'), ('Hallelujah', 'PROPN'), ('.', 'PUNCT'), ('!', 'PUNCT'), ('Hallelujah', 'PROPN'), (',', 'PUNCT'), ('.', 'PUNCT'), ('!', 'PUNCT'), ('Hallelujah', 'PROPN'), ('..', 'PUNCT'), (',', 'PUNCT'), ('!', 'PUNCT'), ('thunderous', 'ADJ'), ('!', 'PUNCT'), ('!', 'PUNCT'), ('!', 'PUNCT'), ('speech', 'NOUN'), ('.', 'PUNCT'), ('a', 'DET'), ('true', 'ADJ'), ('Commander', 'PROPN'), ('-', 'PUNCT'), ('in', 'ADP'), ('-', 'PUNCT'), ('cheif', 'NOUN'), ('.', 'PUNCT'), ('Donald', 'PROPN'), ('Trump', 'PROPN'), (',', 'PUNCT'), ('take', 'VERB'), ('note', 'NOUN'), ('...', 'PUNCT'), ('no', 'INTJ'), ('more', 'ADV'), (',', 'PUNCT'), ('reality', 'NOUN'), ('tv', 'NOUN')]","{'PRON': 1, 'PUNCT': 28, 'AUX': 2, 'DET': 3, 'ADJ': 3, 'PROPN': 7, 'VERB': 2, 'NOUN': 5, 'ADP': 1, 'INTJ': 1, 'ADV': 1}",real president speak hallelujah hallelujah hallelujah .. thunderous speech true commander cheif donald trump take note ... no more reality tv,ADJ PROPN VERB PROPN PROPN PROPN ADJ NOUN ADJ PROPN NOUN PROPN PROPN VERB NOUN NOUN NOUN,1.0,real President speak Hallelujah Hallelujah Hallelujah .. thunderous speech true Commander cheif Donald Trump take note ... reality tv,3,31,hallelujah hallelujah hallelujah
468,this turkey 🦃 is smarter that Joe Frauden Biden. 👍,1.0,0.0,0.0,0.0,0.0,0.0,this turkey 🦃 is smarter that Joe Frauden Biden. 👍,"[('this', 'DET'), ('turkey', 'PROPN'), ('🦃', 'EMOJI'), ('be', 'AUX'), ('smart', 'ADJ'), ('that', 'SCONJ'), ('Joe', 'PROPN'), ('Frauden', 'PROPN'), ('Biden', 'PROPN'), ('.', 'PUNCT'), ('👍', 'EMOJI')]","{'DET': 1, 'PROPN': 4, 'EMOJI': 2, 'AUX': 1, 'ADJ': 1, 'SCONJ': 1, 'PUNCT': 1}",turkey 🦃 smart joe frauden biden 👍,PROPN EMOJI ADJ PROPN PROPN PROPN EMOJI,0.0,turkey smart Joe Frauden Biden,0,1,frauden
469,Its going down...,0.0,0.0,0.0,0.0,0.0,0.0,Its going down...,"[('its', 'PRON'), ('go', 'VERB'), ('down', 'ADV'), ('...', 'PUNCT')]","{'PRON': 1, 'VERB': 1, 'ADV': 1, 'PUNCT': 1}",go down ...,VERB,1.0,go ...,0,3,
470,TRUMP HAS A BUSINESS IN TURKEY,0.0,0.0,0.0,0.0,0.0,0.0,TRUMP HAS A BUSINESS IN TURKEY,"[('TRUMP', 'PROPN'), ('have', 'VERB'), ('a', 'DET'), ('business', 'NOUN'), ('in', 'ADP'), ('TURKEY', 'PROPN')]","{'PROPN': 2, 'VERB': 1, 'DET': 1, 'NOUN': 1, 'ADP': 1}",trump have business turkey,PROPN NOUN PROPN,1.0,TRUMP business TURKEY,6,0,
471,It’s not over.,0.0,0.0,0.0,0.0,0.0,0.0,it is not over.,"[('it', 'PRON'), ('be', 'AUX'), ('not', 'PART'), ('over', 'ADV'), ('.', 'PUNCT')]","{'PRON': 1, 'AUX': 1, 'PART': 1, 'ADV': 1, 'PUNCT': 1}",’s not over,,1.0,,0,1,
472,"Benjamin Franklin once said: ""Those who would give up essential Liberty, to purchase a little temporary Safety, deserve neitherLiberty nor Safety.""",0.0,0.0,0.0,0.0,0.0,0.0,"Benjamin Franklin once said: ""Those who would give up essential Liberty, to purchase a little temporary Safety, deserve neitherLiberty nor Safety.""","[('Benjamin', 'PROPN'), ('Franklin', 'PROPN'), ('once', 'ADV'), ('say', 'VERB'), (':', 'PUNCT'), ('""', 'PUNCT'), ('those', 'DET'), ('who', 'PRON'), ('would', 'AUX'), ('give', 'VERB'), ('up', 'ADP'), ('essential', 'ADJ'), ('Liberty', 'PROPN'), (',', 'PUNCT'), ('to', 'PART'), ('purchase', 'VERB'), ('a', 'DET'), ('little', 'ADJ'), ('temporary', 'ADJ'), ('safety', 'NOUN'), (',', 'PUNCT'), ('deserve', 'VERB'), ('neitherliberty', 'NOUN'), ('nor', 'CCONJ'), ('Safety', 'PROPN'), ('.', 'PUNCT'), ('""', 'PUNCT')]","{'PROPN': 4, 'ADV': 1, 'VERB': 4, 'PUNCT': 6, 'DET': 2, 'PRON': 1, 'AUX': 1, 'ADP': 1, 'ADJ': 3, 'PART': 1, 'NOUN': 2, 'CCONJ': 1}",benjamin franklin once say give essential liberty to purchase little temporary safety deserve neitherliberty safety,PROPN PROPN VERB VERB ADJ PROPN VERB ADJ ADJ NOUN VERB NOUN PROPN,1.0,Benjamin Franklin say would give essential Liberty purchase little temporary safety deserve neitherliberty Safety,0,6,neitherliberty
473,Dark coven... most ridiculous thing I’ve ever heard,0.0,0.0,0.0,0.0,0.0,0.0,Dark coven... most ridiculous thing I have ever heard,"[('dark', 'ADJ'), ('coven', 'NOUN'), ('...', 'PUNCT'), ('most', 'ADV'), ('ridiculous', 'ADJ'), ('thing', 'NOUN'), ('I', 'PRON'), ('have', 'AUX'), ('ever', 'ADV'), ('hear', 'VERB')]","{'ADJ': 2, 'NOUN': 2, 'PUNCT': 1, 'ADV': 2, 'PRON': 1, 'AUX': 1, 'VERB': 1}",dark coven ... most ridiculous thing ever hear,ADJ NOUN ADJ NOUN PRON ADV VERB,1.0,dark coven ... ridiculous thing ever hear,1,3,
474,Wow such a beautiful turkey,1.0,0.0,0.0,0.0,0.0,0.0,Wow such a beautiful turkey,"[('wow', 'INTJ'), ('such', 'DET'), ('a', 'DET'), ('beautiful', 'ADJ'), ('turkey', 'NOUN')]","{'INTJ': 1, 'DET': 2, 'ADJ': 1, 'NOUN': 1}",wow beautiful turkey,INTJ ADJ NOUN,0.0,wow beautiful turkey,0,0,
475,You want Trump dead so that he can vote for Biden? 😆,1.0,0.0,0.0,0.0,0.0,0.0,You want Trump dead so that he can vote for Biden? 😆,"[('you', 'PRON'), ('want', 'VERB'), ('Trump', 'PROPN'), ('dead', 'ADJ'), ('so', 'SCONJ'), ('that', 'SCONJ'), ('he', 'PRON'), ('can', 'AUX'), ('vote', 'VERB'), ('for', 'ADP'), ('Biden', 'PROPN'), ('?', 'PUNCT'), ('😆', 'EMOJI')]","{'PRON': 2, 'VERB': 2, 'PROPN': 2, 'ADJ': 1, 'SCONJ': 2, 'AUX': 1, 'ADP': 1, 'PUNCT': 1, 'EMOJI': 1}",want trump dead vote biden 😆,VERB PROPN ADJ VERB PROPN EMOJI,0.0,want Trump dead vote Biden,0,1,
476,Beat President From the Rep Party EVERER,0.0,0.0,0.0,0.0,0.0,0.0,Beat President From the Rep Party EVERER,"[('beat', 'VERB'), ('President', 'PROPN'), ('from', 'ADP'), ('the', 'DET'), ('Rep', 'PROPN'), ('Party', 'PROPN'), ('EVERER', 'PROPN')]","{'VERB': 1, 'PROPN': 4, 'ADP': 1, 'DET': 1}",beat president rep party everer,VERB PROPN PROPN PROPN PROPN,1.0,beat President Rep Party EVERER,1,0,everer
477,Trump 2020/24,0.0,0.0,0.0,0.0,0.0,0.0,Trump 2020/24,"[('Trump', 'PROPN'), ('2020/24', 'NUM')]","{'PROPN': 1, 'NUM': 1}",trump 2020/24,PROPN NUM,1.0,Trump 2020/24,0,1,2020/24
478,:thanksdoc::thanksdoc::thanksdoc:,0.0,0.0,0.0,0.0,0.0,0.0,:thanksdoc::thanksdoc::thanksdoc:,"[(':', 'PUNCT'), ('thanksdoc::thanksdoc::thanksdoc', 'NOUN'), (':', 'PUNCT')]","{'PUNCT': 2, 'NOUN': 1}",thanksdoc::thanksdoc::thanksdoc,NOUN,1.0,thanksdoc::thanksdoc::thanksdoc,0,6,thanksdoc::thanksdoc::thanksdoc
479,Bedin ❤️,0.0,0.0,0.0,0.0,0.0,0.0,Bedin ❤️,"[('Bedin', 'PROPN'), ('❤️', 'EMOJI')]","{'PROPN': 1, 'EMOJI': 1}",bedin ❤ ️,PROPN EMOJI,1.0,Bedin,0,0,bedin
480,LOL they are wearing masks. LOL,0.0,0.0,0.0,0.0,0.0,0.0,LOL they are wearing masks. LOL,"[('lol', 'INTJ'), ('they', 'PRON'), ('be', 'AUX'), ('wear', 'VERB'), ('mask', 'NOUN'), ('.', 'PUNCT'), ('lol', 'NOUN')]","{'INTJ': 1, 'PRON': 1, 'AUX': 1, 'VERB': 1, 'NOUN': 2, 'PUNCT': 1}",lol wear mask lol,INTJ VERB NOUN NOUN,1.0,lol wear mask lol,2,1,
481,Biden4Prison2020 !,0.0,0.0,0.0,0.0,0.0,0.0,Biden4Prison2020 !,"[('Biden4Prison2020', 'PROPN'), ('!', 'PUNCT')]","{'PROPN': 1, 'PUNCT': 1}",biden4prison2020,PROPN,1.0,Biden4Prison2020,0,1,biden4prison2020
482,the 10 pct of the Usa annual budget will go to the Bidens,0.0,0.0,0.0,0.0,0.0,0.0,the 10 pct of the Usa annual budget will go to the Bidens,"[('the', 'DET'), ('10', 'NUM'), ('pct', 'NOUN'), ('of', 'ADP'), ('the', 'DET'), ('Usa', 'PROPN'), ('annual', 'ADJ'), ('budget', 'NOUN'), ('will', 'AUX'), ('go', 'VERB'), ('to', 'ADP'), ('the', 'DET'), ('Bidens', 'PROPN')]","{'DET': 3, 'NUM': 1, 'NOUN': 2, 'ADP': 2, 'PROPN': 2, 'ADJ': 1, 'AUX': 1, 'VERB': 1}",10 pct usa annual budget go bidens,NUM NOUN PROPN ADJ NOUN VERB PROPN,1.0,10 pct Usa annual budget go Bidens,0,0,pct bidens
483,Trump is awesome. Best president of my lifetime,0.0,0.0,0.0,0.0,0.0,0.0,Trump is awesome. Best president of my lifetime,"[('Trump', 'PROPN'), ('be', 'AUX'), ('awesome', 'ADJ'), ('.', 'PUNCT'), ('good', 'ADJ'), ('president', 'NOUN'), ('of', 'ADP'), ('my', 'PRON'), ('lifetime', 'NOUN')]","{'PROPN': 1, 'AUX': 1, 'ADJ': 2, 'PUNCT': 1, 'NOUN': 2, 'ADP': 1, 'PRON': 1}",trump awesome good president lifetime,PROPN ADJ ADJ NOUN NOUN,1.0,Trump awesome good president lifetime,0,1,
484,trump 2024,0.0,0.0,0.0,0.0,0.0,0.0,trump 2024,"[('trump', 'VERB'), ('2024', 'NUM')]","{'VERB': 1, 'NUM': 1}",trump 2024,VERB NUM,1.0,trump 2024,0,0,2024
485,BIDEN 2020,0.0,0.0,0.0,0.0,0.0,0.0,BIDEN 2020,"[('BIDEN', 'NOUN'), ('2020', 'NUM')]","{'NOUN': 1, 'NUM': 1}",biden 2020,NOUN NUM,1.0,BIDEN 2020,1,0,
486,what turkey,0.0,0.0,0.0,0.0,0.0,0.0,what turkey,"[('what', 'PRON'), ('turkey', 'PROPN')]","{'PRON': 1, 'PROPN': 1}",turkey,PROPN,1.0,turkey,0,0,
487,Finally wearing masks 😷!!,0.0,0.0,0.0,0.0,0.0,0.0,Finally wearing masks 😷!!,"[('finally', 'ADV'), ('wear', 'VERB'), ('mask', 'NOUN'), ('😷', 'EMOJI'), ('!', 'PUNCT'), ('!', 'PUNCT')]","{'ADV': 1, 'VERB': 1, 'NOUN': 1, 'EMOJI': 1, 'PUNCT': 2}",finally wear mask 😷,ADV VERB NOUN EMOJI,1.0,finally wear mask,0,2,
488,thanks @jungleforeva,0.0,0.0,0.0,0.0,0.0,0.0,thanks @jungleforeva,"[('thank', 'NOUN'), ('@jungleforeva', 'PROPN')]","{'NOUN': 1, 'PROPN': 1}",thank @jungleforeva,NOUN PROPN,1.0,thank @jungleforeva,0,1,@jungleforeva
489,Q is misinfo that's why,0.0,0.0,0.0,0.0,0.0,0.0,Q is misinfo that is why,"[('q', 'NOUN'), ('be', 'AUX'), ('misinfo', 'NOUN'), ('that', 'DET'), ('be', 'AUX'), ('why', 'ADV')]","{'NOUN': 2, 'AUX': 2, 'DET': 1, 'ADV': 1}",q misinfo why,NOUN NOUN,1.0,q misinfo,1,0,misinfo
490,TRUMP WON,0.0,0.0,0.0,0.0,0.0,0.0,TRUMP WON,"[('TRUMP', 'PROPN'), ('WON', 'PROPN')]",{'PROPN': 2},trump won,PROPN PROPN,1.0,TRUMP,2,0,
491,Trump!❤️❤️,0.0,0.0,0.0,0.0,0.0,0.0,Trump!❤️❤️,"[('trump!', 'X'), ('❤️', 'EMOJI'), ('❤️', 'EMOJI')]","{'X': 1, 'EMOJI': 2}",trump! ❤ ️ ❤ ️,X EMOJI EMOJI,1.0,trump!,0,1,trump!
492,"Q just had you all sitting on your hands, ""trusting the plan"" instead of actually doing something. Q handed you complacency and yoy said ""ThankQ""",0.0,0.0,0.0,0.0,0.0,0.0,"Q just had you all sitting on your hands, ""trusting the plan"" instead of actually doing something. Q handed you complacency and yoy said ""ThankQ""","[('Q', 'PROPN'), ('just', 'ADV'), ('have', 'VERB'), ('you', 'PRON'), ('all', 'DET'), ('sit', 'VERB'), ('on', 'ADP'), ('your', 'PRON'), ('hand', 'NOUN'), (',', 'PUNCT'), ('""', 'PUNCT'), ('trust', 'VERB'), ('the', 'DET'), ('plan', 'NOUN'), ('""', 'PUNCT'), ('instead', 'ADV'), ('of', 'ADP'), ('actually', 'ADV'), ('do', 'VERB'), ('something', 'PRON'), ('.', 'PUNCT'), ('Q', 'PROPN'), ('hand', 'VERB'), ('you', 'PRON'), ('complacency', 'NOUN'), ('and', 'CCONJ'), ('yoy', 'PROPN'), ('say', 'VERB'), ('""', 'PUNCT'), ('ThankQ', 'PUNCT'), ('""', 'PUNCT')]","{'PROPN': 3, 'ADV': 3, 'VERB': 6, 'PRON': 4, 'DET': 2, 'ADP': 2, 'NOUN': 3, 'PUNCT': 7, 'CCONJ': 1}",q just have sit hand trust plan instead actually do q hand complacency yoy say thankq,PROPN VERB NOUN VERB NOUN ADV ADV PRON PROPN VERB NOUN PROPN VERB,1.0,Q sit hand trust plan instead actually something Q hand complacency yoy say ThankQ,2,6,yoy thankq
493,TRUMP WON,0.0,0.0,0.0,0.0,0.0,0.0,TRUMP WON,"[('TRUMP', 'PROPN'), ('WON', 'PROPN')]",{'PROPN': 2},trump won,PROPN PROPN,1.0,TRUMP,2,0,
494,Trump should resign so that Pence can pardon him.,1.0,0.0,0.0,0.0,0.0,1.0,Trump should resign so that Pence can pardon him.,"[('Trump', 'PROPN'), ('should', 'AUX'), ('resign', 'VERB'), ('so', 'SCONJ'), ('that', 'SCONJ'), ('Pence', 'PROPN'), ('can', 'AUX'), ('pardon', 'VERB'), ('he', 'PRON'), ('.', 'PUNCT')]","{'PROPN': 2, 'AUX': 2, 'VERB': 2, 'SCONJ': 2, 'PRON': 1, 'PUNCT': 1}",trump resign pence pardon,PROPN VERB PROPN VERB,0.0,Trump resign Pence pardon,0,1,
