,message,Direct Harassment,Hate Speech,Sexual Harassment,Trolling,Others,Toxic,cleaned_message,POS,tagCounts,preprocessed_1,POS-SEQ,None,words,uppercase_word_count,punctuation_count,not_in_vocab_words
722,GOD BLESS DONALD TRUMP!!! THE BEST PRESIDENT EVER.,0.0,0.0,0.0,0.0,0.0,0.0,GOD BLESS DONALD TRUMP!!! THE BEST PRESIDENT EVER.,"[('GOD', 'PROPN'), ('BLESS', 'PROPN'), ('DONALD', 'PROPN'), ('TRUMP', 'PROPN'), ('!', 'PUNCT'), ('!', 'PUNCT'), ('!', 'PUNCT'), ('the', 'DET'), ('BEST', 'PROPN'), ('PRESIDENT', 'PROPN'), ('EVER', 'PROPN'), ('.', 'PUNCT')]","{'PROPN': 7, 'PUNCT': 4, 'DET': 1}",god bless donald trump best president ever,PROPN PROPN PROPN PROPN PROPN PROPN PROPN,1.0,GOD BLESS DONALD TRUMP BEST PRESIDENT EVER,8,4,
723,We love you.Mr.President!!! Lets make TRUMP PARTY !!!!,0.0,0.0,0.0,0.0,0.0,0.0,We love you.Mr.President!!! let us make TRUMP PARTY !!!!,"[('we', 'PRON'), ('love', 'VERB'), ('you', 'PRON'), ('.', 'PUNCT'), ('Mr.', 'PROPN'), ('President', 'PROPN'), ('!', 'PUNCT'), ('!', 'PUNCT'), ('!', 'PUNCT'), ('let', 'VERB'), ('we', 'PRON'), ('make', 'VERB'), ('TRUMP', 'PROPN'), ('PARTY', 'PROPN'), ('!', 'PUNCT'), ('!', 'PUNCT'), ('!', 'PUNCT'), ('!', 'PUNCT')]","{'PRON': 3, 'VERB': 3, 'PUNCT': 8, 'PROPN': 4}",love mr. president let make trump party,VERB PROPN PROPN VERB VERB PROPN PROPN,1.0,love Mr. President let make TRUMP PARTY,2,9,
724,This guy sucks!,1.0,0.0,0.0,0.0,0.0,0.0,This guy sucks!,"[('this', 'DET'), ('guy', 'NOUN'), ('suck', 'VERB'), ('!', 'PUNCT')]","{'DET': 1, 'NOUN': 1, 'VERB': 1, 'PUNCT': 1}",guy suck,NOUN VERB,0.0,guy suck,0,1,
725,❤❤❤German patriots for Trump❤❤❤ Happy holidays,0.0,0.0,0.0,0.0,0.0,0.0,❤❤❤German patriots for Trump❤❤❤ Happy holidays,"[('❤', 'EMOJI'), ('❤', 'EMOJI'), ('❤', 'EMOJI'), ('german', 'ADJ'), ('patriot', 'NOUN'), ('for', 'ADP'), ('Trump', 'PROPN'), ('❤', 'EMOJI'), ('❤', 'EMOJI'), ('❤', 'EMOJI'), ('happy', 'ADJ'), ('holiday', 'NOUN')]","{'EMOJI': 6, 'ADJ': 2, 'NOUN': 2, 'ADP': 1, 'PROPN': 1}",❤ ❤ ❤ german patriot trump ❤ ❤ ❤ happy holiday,EMOJI EMOJI EMOJI ADJ NOUN PROPN EMOJI EMOJI EMOJI ADJ NOUN,1.0,german patriot Trump happy holiday,0,0,
726,Corn and Cob aren't the only ones retireing.,0.0,0.0,0.0,0.0,0.0,0.0,Corn and Cob are not the only ones retireing.,"[('Corn', 'PROPN'), ('and', 'CCONJ'), ('Cob', 'PROPN'), ('be', 'AUX'), ('not', 'PART'), ('the', 'DET'), ('only', 'ADJ'), ('one', 'NOUN'), ('retire', 'VERB'), ('.', 'PUNCT')]","{'PROPN': 2, 'CCONJ': 1, 'AUX': 1, 'PART': 1, 'DET': 1, 'ADJ': 1, 'NOUN': 1, 'VERB': 1, 'PUNCT': 1}",corn cob not only one retire,PROPN PROPN NOUN VERB,1.0,Corn Cob one retire,0,1,
727,He is reading fast 😂,0.0,0.0,0.0,0.0,0.0,0.0,He is reading fast 😂,"[('he', 'PRON'), ('be', 'AUX'), ('read', 'VERB'), ('fast', 'ADJ'), ('😂', 'EMOJI')]","{'PRON': 1, 'AUX': 1, 'VERB': 1, 'ADJ': 1, 'EMOJI': 1}",read fast 😂,VERB ADJ EMOJI,1.0,read fast,0,0,
728,WWG1WGA,0.0,0.0,0.0,0.0,0.0,0.0,WWG1WGA,"[('WWG1WGA', 'NOUN')]",{'NOUN': 1},wwg1wga,NOUN,1.0,WWG1WGA,2,0,wwg1wga
729,Biden is a Cenile old man,1.0,0.0,0.0,0.0,0.0,0.0,Biden is a Cenile old man,"[('Biden', 'PROPN'), ('be', 'AUX'), ('a', 'DET'), ('cenile', 'ADJ'), ('old', 'ADJ'), ('man', 'NOUN')]","{'PROPN': 1, 'AUX': 1, 'DET': 1, 'ADJ': 2, 'NOUN': 1}",biden cenile old man,PROPN ADJ ADJ NOUN,0.0,Biden cenile old man,0,0,cenile
730,bizimi söyluyorlar,0.0,0.0,0.0,0.0,0.0,0.0,bizimi söyluyorlar,"[('bizimi', 'NOUN'), ('söyluyorlar', 'PROPN')]","{'NOUN': 1, 'PROPN': 1}",bizimi söyluyorlar,NOUN PROPN,1.0,bizimi söyluyorlar,0,0,bizimi söyluyorlar
731,TRUMP🙌🙌🙌,0.0,0.0,0.0,0.0,0.0,0.0,TRUMP🙌🙌🙌,"[('TRUMP', 'PROPN'), ('🙌', 'EMOJI'), ('🙌', 'EMOJI'), ('🙌', 'EMOJI')]","{'PROPN': 1, 'EMOJI': 3}",trump 🙌 🙌 🙌,PROPN EMOJI EMOJI EMOJI,1.0,TRUMP,1,0,
732,Most of America is starving right now cause of you .,0.0,0.0,0.0,1.0,0.0,0.0,Most of America is starving right now because of you .,"[('Most', 'ADJ'), ('of', 'ADP'), ('America', 'PROPN'), ('be', 'AUX'), ('starve', 'VERB'), ('right', 'ADV'), ('now', 'ADV'), ('because', 'SCONJ'), ('of', 'ADP'), ('you', 'PRON'), ('.', 'PUNCT')]","{'ADJ': 1, 'ADP': 2, 'PROPN': 1, 'AUX': 1, 'VERB': 1, 'ADV': 2, 'SCONJ': 1, 'PRON': 1, 'PUNCT': 1}",most america starve right now cause,ADJ PROPN VERB ADV,0.0,America starve right,0,1,
733,I feel bad for him he look sick😔,0.0,0.0,0.0,0.0,0.0,0.0,I feel bad for him he look sick😔,"[('I', 'PRON'), ('feel', 'VERB'), ('bad', 'ADJ'), ('for', 'ADP'), ('he', 'PRON'), ('he', 'PRON'), ('look', 'VERB'), ('sick', 'ADJ'), ('😔', 'EMOJI')]","{'PRON': 3, 'VERB': 2, 'ADJ': 2, 'ADP': 1, 'EMOJI': 1}",feel bad look sick 😔,PRON VERB ADJ VERB ADJ EMOJI,1.0,feel bad look sick,1,0,
734,Trump won,0.0,0.0,0.0,0.0,0.0,0.0,Trump won,"[('Trump', 'PROPN'), ('win', 'VERB')]","{'PROPN': 1, 'VERB': 1}",trump win,PROPN VERB,1.0,Trump win,0,0,
735,Thencs mai veri President,0.0,0.0,0.0,0.0,0.0,0.0,Thencs mai veri President,"[('Thencs', 'PROPN'), ('mai', 'PROPN'), ('veri', 'PROPN'), ('President', 'PROPN')]",{'PROPN': 4},thencs mai veri president,PROPN PROPN PROPN PROPN,1.0,Thencs mai veri President,0,0,thencs veri
736,"CORN and COB - Anyone think Trump is TROLLING Biden's ""CORN POP"" story ??? 🤔😋",0.0,0.0,0.0,0.0,0.0,0.0,"CORN and COB - Anyone think Trump is TROLLING Biden's ""CORN POP"" story ??? 🤔😋","[('CORN', 'PROPN'), ('and', 'CCONJ'), ('COB', 'PROPN'), ('-', 'PUNCT'), ('anyone', 'PRON'), ('think', 'VERB'), ('Trump', 'PROPN'), ('be', 'AUX'), ('TROLLING', 'PROPN'), ('Biden', 'PROPN'), (""'s"", 'PART'), ('""', 'PUNCT'), ('CORN', 'PROPN'), ('POP', 'PROPN'), ('""', 'PUNCT'), ('story', 'NOUN'), ('?', 'PUNCT'), ('?', 'PUNCT'), ('?', 'PUNCT'), ('🤔', 'EMOJI'), ('😋', 'EMOJI')]","{'PROPN': 7, 'CCONJ': 1, 'PUNCT': 6, 'PRON': 1, 'VERB': 1, 'AUX': 1, 'PART': 1, 'NOUN': 1, 'EMOJI': 2}",corn cob think trump troll bidens corn pop story 🤔 😋,PROPN PROPN PRON VERB PROPN PROPN PROPN PART PROPN PROPN NOUN EMOJI EMOJI,1.0,CORN COB anyone think Trump TROLLING Biden 's CORN POP story,5,6,bidens
737,Lol you city slickers they don’t feed on your grocery shelf like you think they do! Corn pop!,1.0,1.0,0.0,0.0,0.0,0.0,Lol you city slickers they do not feed on your grocery shelf like you think they do! Corn pop!,"[('Lol', 'PROPN'), ('you', 'PRON'), ('city', 'NOUN'), ('slicker', 'NOUN'), ('they', 'PRON'), ('do', 'AUX'), ('not', 'PART'), ('feed', 'VERB'), ('on', 'ADP'), ('your', 'PRON'), ('grocery', 'NOUN'), ('shelf', 'NOUN'), ('like', 'ADP'), ('you', 'PRON'), ('think', 'VERB'), ('they', 'PRON'), ('do', 'VERB'), ('!', 'PUNCT'), ('corn', 'NOUN'), ('pop', 'NOUN'), ('!', 'PUNCT')]","{'PROPN': 1, 'PRON': 5, 'NOUN': 6, 'AUX': 1, 'PART': 1, 'VERB': 3, 'ADP': 2, 'PUNCT': 2}",lol city slicker n’t feed grocery shelf think do corn pop,PROPN NOUN NOUN VERB NOUN NOUN ADP VERB NOUN NOUN,0.0,Lol city slicker feed grocery shelf like think corn pop,0,2,
738,someone fire the volume guy. it's either to low or making my ears bleed,0.0,0.0,0.0,0.0,0.0,0.0,someone fire the volume guy. it is either to low or making my ears bleed,"[('someone', 'PRON'), ('fire', 'VERB'), ('the', 'DET'), ('volume', 'NOUN'), ('guy', 'NOUN'), ('.', 'PUNCT'), ('it', 'PRON'), ('be', 'AUX'), ('either', 'ADV'), ('to', 'PART'), ('low', 'VERB'), ('or', 'CCONJ'), ('make', 'VERB'), ('my', 'PRON'), ('ear', 'NOUN'), ('bleed', 'VERB')]","{'PRON': 3, 'VERB': 4, 'DET': 1, 'NOUN': 3, 'PUNCT': 1, 'AUX': 1, 'ADV': 1, 'PART': 1, 'CCONJ': 1}",fire volume guy either to low make ear bleed,PRON VERB NOUN NOUN ADV VERB VERB NOUN VERB,1.0,someone fire volume guy either low make ear bleed,0,1,
739,I too wonder why he is talking so quickly...,0.0,0.0,0.0,0.0,0.0,0.0,I too wonder why he is talking so quickly...,"[('I', 'PRON'), ('too', 'ADV'), ('wonder', 'VERB'), ('why', 'ADV'), ('he', 'PRON'), ('be', 'AUX'), ('talk', 'VERB'), ('so', 'ADV'), ('quickly', 'ADV'), ('...', 'PUNCT')]","{'PRON': 2, 'ADV': 4, 'VERB': 2, 'AUX': 1, 'PUNCT': 1}",too wonder why talk so quickly ...,PRON VERB VERB ADV,1.0,wonder talk quickly ...,1,3,
740,TRUMP,0.0,0.0,0.0,0.0,0.0,0.0,TRUMP,"[('TRUMP', 'PROPN')]",{'PROPN': 1},trump,PROPN,1.0,TRUMP,1,0,
741,Joe the liar Trump the triumph.,0.0,0.0,0.0,0.0,0.0,0.0,Joe the liar Trump the triumph.,"[('Joe', 'PROPN'), ('the', 'DET'), ('liar', 'NOUN'), ('Trump', 'PROPN'), ('the', 'DET'), ('triumph', 'NOUN'), ('.', 'PUNCT')]","{'PROPN': 2, 'DET': 2, 'NOUN': 2, 'PUNCT': 1}",joe liar trump triumph,PROPN NOUN PROPN NOUN,1.0,Joe liar Trump triumph,0,1,
742,4 More Years,0.0,0.0,0.0,0.0,0.0,0.0,4 More Years,"[('4', 'NUM'), ('More', 'ADJ'), ('year', 'NOUN')]","{'NUM': 1, 'ADJ': 1, 'NOUN': 1}",4 more year,NUM ADJ NOUN,1.0,4 year,0,0,
743,"BIDEN WIN is WIN for CHINA. Congrats everyone, YOU GOT WHAT YOU WANTED!!! Let's see how long he lasts...I give him 4 months before pushed aside!",0.0,0.0,0.0,1.0,0.0,0.0,"BIDEN WIN is WIN for CHINA. Congrats everyone, YOU GOT WHAT YOU WANTED!!! let us see how long he lasts...I give him 4 months before pushed aside!","[('BIDEN', 'VERB'), ('WIN', 'PROPN'), ('be', 'AUX'), ('WIN', 'PROPN'), ('for', 'ADP'), ('CHINA', 'PROPN'), ('.', 'PUNCT'), ('congrat', 'NOUN'), ('everyone', 'PRON'), (',', 'PUNCT'), ('you', 'PRON'), ('get', 'VERB'), ('what', 'PRON'), ('you', 'PRON'), ('want', 'VERB'), ('!', 'PUNCT'), ('!', 'PUNCT'), ('!', 'PUNCT'), ('let', 'VERB'), ('we', 'PRON'), ('see', 'VERB'), ('how', 'ADV'), ('long', 'ADV'), ('he', 'PRON'), ('last', 'VERB'), ('...', 'PUNCT'), ('I', 'PRON'), ('give', 'VERB'), ('he', 'PRON'), ('4', 'NUM'), ('month', 'NOUN'), ('before', 'ADP'), ('push', 'VERB'), ('aside', 'ADV'), ('!', 'PUNCT')]","{'VERB': 8, 'PROPN': 3, 'AUX': 1, 'ADP': 2, 'PUNCT': 7, 'NOUN': 2, 'PRON': 8, 'ADV': 3, 'NUM': 1}",biden win win china congrat get want let see how long last ... give 4 month push aside,VERB PROPN PROPN PROPN NOUN PRON VERB VERB VERB VERB ADV VERB PRON VERB NUM NOUN VERB ADV,0.0,BIDEN WIN WIN CHINA congrat everyone get want let see long last ... give 4 month push aside,10,9,congrat
744,gonna miss him. not looking forward to Bidet...,0.0,0.0,0.0,0.0,0.0,1.0,going to miss him. not looking forward to Bidet...,"[('go', 'VERB'), ('to', 'PART'), ('miss', 'VERB'), ('he', 'PRON'), ('.', 'PUNCT'), ('not', 'PART'), ('look', 'VERB'), ('forward', 'ADV'), ('to', 'ADP'), ('Bidet', 'PROPN'), ('...', 'PUNCT')]","{'VERB': 3, 'PART': 2, 'PRON': 1, 'PUNCT': 2, 'ADV': 1, 'ADP': 1, 'PROPN': 1}",gon na miss not look forward bidet ...,VERB VERB VERB ADV PROPN,0.0,go miss look forward Bidet ...,0,4,bidet
745,TRUMP 2020,0.0,0.0,0.0,0.0,0.0,0.0,TRUMP 2020,"[('TRUMP', 'PROPN'), ('2020', 'NUM')]","{'PROPN': 1, 'NUM': 1}",trump 2020,PROPN NUM,1.0,TRUMP 2020,1,0,
746,Thankfully God heard our prayers BIDEN🥶🥶,0.0,0.0,0.0,0.0,0.0,0.0,Thankfully God heard our prayers BIDEN🥶🥶,"[('thankfully', 'ADV'), ('God', 'PROPN'), ('hear', 'VERB'), ('our', 'PRON'), ('prayer', 'NOUN'), ('BIDEN', 'NOUN'), ('🥶', 'EMOJI'), ('🥶', 'EMOJI')]","{'ADV': 1, 'PROPN': 1, 'VERB': 1, 'PRON': 1, 'NOUN': 2, 'EMOJI': 2}",thankfully god hear prayer biden 🥶 🥶,ADV PROPN VERB NOUN NOUN EMOJI EMOJI,1.0,thankfully God hear prayer BIDEN,1,0,
747,IMPEACH BIDEN,0.0,0.0,0.0,0.0,0.0,0.0,IMPEACH BIDEN,"[('impeach', 'NOUN'), ('BIDEN', 'VERB')]","{'NOUN': 1, 'VERB': 1}",impeach biden,NOUN VERB,1.0,impeach BIDEN,2,0,impeach
748,Did the Turkey have a postal vote for Biden?,0.0,0.0,0.0,0.0,0.0,0.0,Did the Turkey have a postal vote for Biden?,"[('do', 'AUX'), ('the', 'DET'), ('Turkey', 'PROPN'), ('have', 'VERB'), ('a', 'DET'), ('postal', 'ADJ'), ('vote', 'NOUN'), ('for', 'ADP'), ('Biden', 'PROPN'), ('?', 'PUNCT')]","{'AUX': 1, 'DET': 2, 'PROPN': 2, 'VERB': 1, 'ADJ': 1, 'NOUN': 1, 'ADP': 1, 'PUNCT': 1}",turkey have postal vote biden,PROPN ADJ NOUN PROPN,1.0,Turkey postal vote Biden,0,1,
749,TRUMP!,0.0,0.0,0.0,0.0,0.0,0.0,TRUMP!,"[('TRUMP', 'PROPN'), ('!', 'PUNCT')]","{'PROPN': 1, 'PUNCT': 1}",trump,PROPN,1.0,TRUMP,1,1,
750,"Benjamin Franklin once said: ""Those who would give up essential Liberty, to purchase a little temporary Safety, deserve neitherLiberty nor Safety.""",0.0,0.0,0.0,0.0,0.0,0.0,"Benjamin Franklin once said: ""Those who would give up essential Liberty, to purchase a little temporary Safety, deserve neitherLiberty nor Safety.""","[('Benjamin', 'PROPN'), ('Franklin', 'PROPN'), ('once', 'ADV'), ('say', 'VERB'), (':', 'PUNCT'), ('""', 'PUNCT'), ('those', 'DET'), ('who', 'PRON'), ('would', 'AUX'), ('give', 'VERB'), ('up', 'ADP'), ('essential', 'ADJ'), ('Liberty', 'PROPN'), (',', 'PUNCT'), ('to', 'PART'), ('purchase', 'VERB'), ('a', 'DET'), ('little', 'ADJ'), ('temporary', 'ADJ'), ('safety', 'NOUN'), (',', 'PUNCT'), ('deserve', 'VERB'), ('neitherliberty', 'NOUN'), ('nor', 'CCONJ'), ('Safety', 'PROPN'), ('.', 'PUNCT'), ('""', 'PUNCT')]","{'PROPN': 4, 'ADV': 1, 'VERB': 4, 'PUNCT': 6, 'DET': 2, 'PRON': 1, 'AUX': 1, 'ADP': 1, 'ADJ': 3, 'PART': 1, 'NOUN': 2, 'CCONJ': 1}",benjamin franklin once say give essential liberty to purchase little temporary safety deserve neitherliberty safety,PROPN PROPN VERB VERB ADJ PROPN VERB ADJ ADJ NOUN VERB NOUN PROPN,1.0,Benjamin Franklin say would give essential Liberty purchase little temporary safety deserve neitherliberty Safety,0,6,neitherliberty
751,"You are our duly elected , President. We love you, Mr. President and your love for our nation and her people!",0.0,0.0,0.0,0.0,0.0,0.0,"You are our duly elected , President. We love you, Mr. President and your love for our nation and her people!","[('you', 'PRON'), ('be', 'AUX'), ('our', 'PRON'), ('duly', 'ADV'), ('elect', 'VERB'), (',', 'PUNCT'), ('President', 'PROPN'), ('.', 'PUNCT'), ('we', 'PRON'), ('love', 'VERB'), ('you', 'PRON'), (',', 'PUNCT'), ('Mr.', 'PROPN'), ('President', 'PROPN'), ('and', 'CCONJ'), ('your', 'PRON'), ('love', 'NOUN'), ('for', 'ADP'), ('our', 'PRON'), ('nation', 'NOUN'), ('and', 'CCONJ'), ('her', 'PRON'), ('people', 'NOUN'), ('!', 'PUNCT')]","{'PRON': 7, 'AUX': 1, 'ADV': 1, 'VERB': 2, 'PUNCT': 4, 'PROPN': 3, 'CCONJ': 2, 'NOUN': 3, 'ADP': 1}",duly elect president love mr. president love nation people,ADV VERB PROPN VERB PROPN PROPN NOUN NOUN NOUN,1.0,duly elect President love Mr. President love nation people,0,5,
752,I can’t watch because I might cry like a lil b,1.0,0.0,0.0,0.0,0.0,0.0,I can not watch because I might cry like a lil b,"[('I', 'PRON'), ('can', 'AUX'), ('not', 'PART'), ('watch', 'VERB'), ('because', 'SCONJ'), ('I', 'PRON'), ('might', 'AUX'), ('cry', 'VERB'), ('like', 'ADP'), ('a', 'DET'), ('lil', 'NOUN'), ('b', 'NOUN')]","{'PRON': 2, 'AUX': 2, 'PART': 1, 'VERB': 2, 'SCONJ': 1, 'ADP': 1, 'DET': 1, 'NOUN': 2}",n’t watch cry lil b,PRON VERB PRON VERB ADP NOUN NOUN,0.0,watch might cry like lil b,2,0,
753,Get ready for round up!!!,0.0,0.0,0.0,0.0,0.0,0.0,Get ready for round up!!!,"[('get', 'VERB'), ('ready', 'ADJ'), ('for', 'ADP'), ('round', 'NOUN'), ('up', 'ADP'), ('!', 'PUNCT'), ('!', 'PUNCT'), ('!', 'PUNCT')]","{'VERB': 1, 'ADJ': 1, 'ADP': 2, 'NOUN': 1, 'PUNCT': 3}",get ready round,VERB ADJ NOUN,1.0,get ready round,0,3,
754,war,0.0,0.0,0.0,0.0,0.0,0.0,war,"[('war', 'NOUN')]",{'NOUN': 1},war,NOUN,1.0,war,0,0,
755,Sweet MAGA tears,0.0,0.0,0.0,0.0,0.0,0.0,Sweet MAGA tears,"[('Sweet', 'PROPN'), ('MAGA', 'PROPN'), ('tear', 'NOUN')]","{'PROPN': 2, 'NOUN': 1}",sweet maga tear,PROPN PROPN NOUN,1.0,Sweet MAGA tear,1,0,maga
756,You are the best President in many years. You exposed the swamp. COME BACK,0.0,0.0,0.0,0.0,0.0,0.0,You are the best President in many years. You exposed the swamp. COME BACK,"[('you', 'PRON'), ('be', 'AUX'), ('the', 'DET'), ('good', 'ADJ'), ('President', 'PROPN'), ('in', 'ADP'), ('many', 'ADJ'), ('year', 'NOUN'), ('.', 'PUNCT'), ('you', 'PRON'), ('expose', 'VERB'), ('the', 'DET'), ('swamp', 'NOUN'), ('.', 'PUNCT'), ('come', 'VERB'), ('back', 'ADV')]","{'PRON': 2, 'AUX': 1, 'DET': 2, 'ADJ': 2, 'PROPN': 1, 'ADP': 1, 'NOUN': 2, 'PUNCT': 2, 'VERB': 2, 'ADV': 1}",good president many year expose swamp come back,ADJ PROPN ADJ NOUN VERB NOUN VERB ADV,1.0,good President many year expose swamp come back,2,2,
757,Biden will wreck USA!! Hahahahahahaa All you Biden voters y'all be crushed!!,0.0,0.0,0.0,1.0,0.0,0.0,Biden will wreck USA!! Hahahahahahaa All you Biden voters you all be crushed!!,"[('Biden', 'PROPN'), ('will', 'AUX'), ('wreck', 'VERB'), ('USA', 'PROPN'), ('!', 'PUNCT'), ('!', 'PUNCT'), ('hahahahahahaa', 'NOUN'), ('all', 'DET'), ('you', 'PRON'), ('Biden', 'PROPN'), ('voter', 'NOUN'), ('you', 'PRON'), ('all', 'DET'), ('be', 'AUX'), ('crush', 'VERB'), ('!', 'PUNCT'), ('!', 'PUNCT')]","{'PROPN': 3, 'AUX': 2, 'VERB': 2, 'PUNCT': 4, 'NOUN': 2, 'DET': 2, 'PRON': 2}",biden wreck usa hahahahahahaa biden voter crush,PROPN VERB PROPN NOUN PROPN NOUN VERB,0.0,Biden wreck USA hahahahahahaa Biden voter crush,1,4,hahahahahahaa
758,WE LOVE YOU BIDEN,0.0,0.0,0.0,0.0,0.0,0.0,WE LOVE YOU BIDEN,"[('we', 'PRON'), ('love', 'VERB'), ('you', 'PRON'), ('BIDEN', 'VERB')]","{'PRON': 2, 'VERB': 2}",love biden,VERB VERB,1.0,love BIDEN,4,0,
759,GOD BLESS THE USA!!!!,0.0,0.0,0.0,0.0,0.0,0.0,GOD BLESS THE USA!!!!,"[('GOD', 'PROPN'), ('BLESS', 'PROPN'), ('THE', 'PROPN'), ('USA', 'PROPN'), ('!', 'PUNCT'), ('!', 'PUNCT'), ('!', 'PUNCT'), ('!', 'PUNCT')]","{'PROPN': 4, 'PUNCT': 4}",god bless the usa,PROPN PROPN PROPN PROPN,1.0,GOD BLESS USA,4,4,
760,Did he also pardon himself?,0.0,0.0,0.0,0.0,0.0,0.0,Did he also pardon himself?,"[('do', 'AUX'), ('he', 'PRON'), ('also', 'ADV'), ('pardon', 'VERB'), ('himself', 'PRON'), ('?', 'PUNCT')]","{'AUX': 1, 'PRON': 2, 'ADV': 1, 'VERB': 1, 'PUNCT': 1}",also pardon,ADV VERB,1.0,also pardon,0,1,
761,Trump2020,0.0,0.0,0.0,0.0,0.0,0.0,Trump2020,"[('Trump2020', 'PROPN')]",{'PROPN': 1},trump2020,PROPN,1.0,Trump2020,0,0,trump2020
762,Trump out of breath. RIP. BIDEN WINS,0.0,0.0,0.0,0.0,0.0,0.0,Trump out of breath. RIP. BIDEN WINS,"[('trump', 'VERB'), ('out', 'SCONJ'), ('of', 'ADP'), ('breath', 'NOUN'), ('.', 'PUNCT'), ('rip', 'NOUN'), ('.', 'PUNCT'), ('BIDEN', 'PROPN'), ('WINS', 'PROPN')]","{'VERB': 1, 'SCONJ': 1, 'ADP': 1, 'NOUN': 2, 'PUNCT': 2, 'PROPN': 2}",trump breath rip biden wins,VERB NOUN NOUN PROPN PROPN,1.0,trump breath rip BIDEN WINS,3,2,
763,plz stay in office for 4 more years we love u!,0.0,0.0,0.0,0.0,0.0,0.0,plz stay in office for 4 more years we love you!,"[('plz', 'INTJ'), ('stay', 'VERB'), ('in', 'ADP'), ('office', 'NOUN'), ('for', 'ADP'), ('4', 'NUM'), ('more', 'ADJ'), ('year', 'NOUN'), ('we', 'PRON'), ('love', 'VERB'), ('you', 'PRON'), ('!', 'PUNCT')]","{'INTJ': 1, 'VERB': 2, 'ADP': 2, 'NOUN': 2, 'NUM': 1, 'ADJ': 1, 'PRON': 2, 'PUNCT': 1}",plz stay office 4 more year love u,INTJ VERB NOUN NUM NOUN VERB,1.0,plz stay office 4 year love,0,1,plz
764,Best President ever! U.K loves you,0.0,0.0,0.0,0.0,0.0,0.0,Best President ever! you.K loves you,"[('good', 'ADJ'), ('President', 'PROPN'), ('ever', 'ADV'), ('!', 'PUNCT'), ('you', 'PRON'), ('.', 'PUNCT'), ('K', 'PROPN'), ('love', 'VERB'), ('you', 'PRON')]","{'ADJ': 1, 'PROPN': 2, 'ADV': 1, 'PUNCT': 2, 'PRON': 2, 'VERB': 1}",good president ever u.k love,ADJ PROPN ADV PROPN VERB,1.0,good President ever K love,2,2,
765,Trump will be a Winner Forever. The Last American President.,0.0,0.0,0.0,0.0,0.0,0.0,Trump will be a Winner Forever. The Last American President.,"[('Trump', 'PROPN'), ('will', 'AUX'), ('be', 'VERB'), ('a', 'DET'), ('Winner', 'PROPN'), ('forever', 'ADV'), ('.', 'PUNCT'), ('the', 'DET'), ('last', 'ADJ'), ('american', 'ADJ'), ('President', 'PROPN'), ('.', 'PUNCT')]","{'PROPN': 3, 'AUX': 1, 'VERB': 1, 'DET': 2, 'ADV': 1, 'PUNCT': 2, 'ADJ': 2}",trump be winner forever last american president,PROPN PROPN ADV ADJ ADJ PROPN,1.0,Trump Winner forever last american President,0,2,
766,love you Mr Trump!,0.0,0.0,0.0,0.0,0.0,0.0,love you Mr Trump!,"[('love', 'VERB'), ('you', 'PRON'), ('Mr', 'PROPN'), ('Trump', 'PROPN'), ('!', 'PUNCT')]","{'VERB': 1, 'PRON': 1, 'PROPN': 2, 'PUNCT': 1}",love mr trump,VERB PROPN PROPN,1.0,love Mr Trump,0,1,
767,BOOOOOOOOO PIECE OF CRAP fox news!!!! carrie this live but not a news conference,0.0,0.0,0.0,0.0,0.0,0.0,BOOOOOOOOO PIECE OF CRAP fox news!!!! carrie this live but not a news conference,"[('booooooooo', 'ADJ'), ('PIECE', 'PROPN'), ('of', 'ADP'), ('CRAP', 'PROPN'), ('fox', 'PROPN'), ('news', 'PROPN'), ('!', 'PUNCT'), ('!', 'PUNCT'), ('!', 'PUNCT'), ('!', 'PUNCT'), ('carrie', 'NOUN'), ('this', 'DET'), ('live', 'ADV'), ('but', 'CCONJ'), ('not', 'PART'), ('a', 'DET'), ('news', 'NOUN'), ('conference', 'NOUN')]","{'ADJ': 1, 'PROPN': 4, 'ADP': 1, 'PUNCT': 4, 'NOUN': 3, 'DET': 2, 'ADV': 1, 'CCONJ': 1, 'PART': 1}",booooooooo piece crap fox news carrie live not news conference,ADJ PROPN PROPN PROPN PROPN NOUN ADV NOUN NOUN,1.0,booooooooo PIECE CRAP fox news carrie live news conference,4,4,booooooooo
768,Real Americas love you Mr. President!! you are annointed by God! do not give up,0.0,0.0,0.0,0.0,0.0,0.0,Real Americas love you Mr. President!! you are annointed by God! do not give up,"[('real', 'ADJ'), ('Americas', 'PROPN'), ('love', 'VERB'), ('you', 'PRON'), ('Mr.', 'PROPN'), ('President', 'PROPN'), ('!', 'PUNCT'), ('!', 'PUNCT'), ('you', 'PRON'), ('be', 'AUX'), ('annointe', 'VERB'), ('by', 'ADP'), ('God', 'PROPN'), ('!', 'PUNCT'), ('do', 'AUX'), ('not', 'PART'), ('give', 'VERB'), ('up', 'ADP')]","{'ADJ': 1, 'PROPN': 4, 'VERB': 3, 'PRON': 2, 'PUNCT': 3, 'AUX': 2, 'ADP': 2, 'PART': 1}",real americas love mr. president annointe god not give,ADJ PROPN VERB PROPN PROPN VERB PROPN VERB,1.0,real Americas love Mr. President annointe God give,0,4,annointe
769,May God bless us with 4 more years of Trump administration,0.0,0.0,0.0,0.0,0.0,0.0,May God bless us with 4 more years of Trump administration,"[('may', 'AUX'), ('God', 'PROPN'), ('bless', 'VERB'), ('we', 'PRON'), ('with', 'ADP'), ('4', 'NUM'), ('more', 'ADJ'), ('year', 'NOUN'), ('of', 'ADP'), ('Trump', 'PROPN'), ('administration', 'NOUN')]","{'AUX': 1, 'PROPN': 2, 'VERB': 1, 'PRON': 1, 'ADP': 2, 'NUM': 1, 'ADJ': 1, 'NOUN': 2}",god bless 4 more year trump administration,PROPN VERB NUM NOUN PROPN NOUN,1.0,may God bless 4 year Trump administration,0,0,
770,Four more years,0.0,0.0,0.0,0.0,0.0,0.0,Four more years,"[('four', 'NUM'), ('more', 'ADJ'), ('year', 'NOUN')]","{'NUM': 1, 'ADJ': 1, 'NOUN': 1}",four more year,NUM NOUN,1.0,four year,0,0,
771,trumps win for putin russia,0.0,0.0,0.0,0.0,0.0,0.0,trumps win for putin russia,"[('trump', 'NOUN'), ('win', 'VERB'), ('for', 'ADP'), ('putin', 'PROPN'), ('russia', 'PROPN')]","{'NOUN': 1, 'VERB': 1, 'ADP': 1, 'PROPN': 2}",trump win putin russia,NOUN VERB PROPN PROPN,1.0,trump win putin russia,0,0,
772,TRUST TRUMP,0.0,0.0,0.0,0.0,0.0,0.0,TRUST TRUMP,"[('TRUST', 'PROPN'), ('TRUMP', 'PROPN')]",{'PROPN': 2},trust trump,PROPN PROPN,1.0,TRUST TRUMP,2,0,
773,TRUMP WON,0.0,0.0,0.0,0.0,0.0,0.0,TRUMP WON,"[('TRUMP', 'PROPN'), ('WON', 'PROPN')]",{'PROPN': 2},trump won,PROPN PROPN,1.0,TRUMP,2,0,
774,Canada loves you T dog,0.0,0.0,0.0,0.0,0.0,0.0,Canada loves you T dog,"[('Canada', 'PROPN'), ('love', 'VERB'), ('you', 'PRON'), ('t', 'NOUN'), ('dog', 'NOUN')]","{'PROPN': 1, 'VERB': 1, 'PRON': 1, 'NOUN': 2}",canada love t dog,PROPN VERB NOUN,1.0,Canada love dog,1,0,
775,"What about the Native people?? ""Thanksgiving"" is the day of mourning!",0.0,0.0,0.0,0.0,0.0,0.0,"What about the Native people?? ""Thanksgiving"" is the day of mourning!","[('what', 'PRON'), ('about', 'ADP'), ('the', 'DET'), ('native', 'ADJ'), ('people', 'NOUN'), ('?', 'PUNCT'), ('?', 'PUNCT'), ('""', 'PUNCT'), ('Thanksgiving', 'PROPN'), ('""', 'PUNCT'), ('be', 'AUX'), ('the', 'DET'), ('day', 'NOUN'), ('of', 'ADP'), ('mourning', 'NOUN'), ('!', 'PUNCT')]","{'PRON': 1, 'ADP': 2, 'DET': 2, 'ADJ': 1, 'NOUN': 3, 'PUNCT': 5, 'PROPN': 1, 'AUX': 1}",native people thanksgiving day mourning,ADJ NOUN PROPN NOUN NOUN,1.0,native people Thanksgiving day mourning,0,5,
776,Biden 2020,0.0,0.0,0.0,0.0,0.0,0.0,Biden 2020,"[('Biden', 'PROPN'), ('2020', 'NUM')]","{'PROPN': 1, 'NUM': 1}",biden 2020,PROPN NUM,1.0,Biden 2020,0,0,
777,Biden will bee impeached BEFORE They take office LOVE'S!!!,0.0,0.0,0.0,0.0,0.0,0.0,Biden will bee impeached BEFORE They take office LOVE'S!!!,"[('Biden', 'PROPN'), ('will', 'AUX'), ('bee', 'NOUN'), ('impeach', 'VERB'), ('before', 'ADP'), ('they', 'PRON'), ('take', 'VERB'), ('office', 'NOUN'), ('LOVE', 'PROPN'), (""'S"", 'PROPN'), ('!', 'PUNCT'), ('!', 'PUNCT'), ('!', 'PUNCT')]","{'PROPN': 3, 'AUX': 1, 'NOUN': 2, 'VERB': 2, 'ADP': 1, 'PRON': 1, 'PUNCT': 3}",biden bee impeach take office loves,PROPN NOUN VERB VERB NOUN PROPN PROPN,1.0,Biden bee impeach take office LOVE 'S,2,3,impeach
778,my body my choice,0.0,0.0,0.0,0.0,0.0,0.0,my body my choice,"[('my', 'PRON'), ('body', 'NOUN'), ('my', 'PRON'), ('choice', 'NOUN')]","{'PRON': 2, 'NOUN': 2}",body choice,NOUN NOUN,1.0,body choice,0,0,
779,🦃🦃🦃🦃🦃🦃🦃🦃,0.0,0.0,0.0,0.0,0.0,0.0,🦃🦃🦃🦃🦃🦃🦃🦃,"[('🦃', 'EMOJI'), ('🦃', 'EMOJI'), ('🦃', 'EMOJI'), ('🦃', 'EMOJI'), ('🦃', 'EMOJI'), ('🦃', 'EMOJI'), ('🦃', 'EMOJI'), ('🦃', 'EMOJI')]",{'EMOJI': 8},🦃 🦃 🦃 🦃 🦃 🦃 🦃 🦃,EMOJI EMOJI EMOJI EMOJI EMOJI EMOJI EMOJI EMOJI,1.0,,0,0,
780,go away Trump! 😝😝😝😝😝😝😝,0.0,0.0,0.0,0.0,0.0,0.0,go away Trump! 😝😝😝😝😝😝😝,"[('go', 'VERB'), ('away', 'ADV'), ('Trump', 'PROPN'), ('!', 'PUNCT'), ('😝', 'EMOJI'), ('😝', 'EMOJI'), ('😝', 'EMOJI'), ('😝', 'EMOJI'), ('😝', 'EMOJI'), ('😝', 'EMOJI'), ('😝', 'EMOJI')]","{'VERB': 1, 'ADV': 1, 'PROPN': 1, 'PUNCT': 1, 'EMOJI': 7}",go away trump 😝 😝 😝 😝 😝 😝 😝,VERB ADV PROPN EMOJI EMOJI EMOJI EMOJI EMOJI EMOJI EMOJI,1.0,go away Trump,0,1,
781,Only president who has a heart since jfk,0.0,0.0,0.0,0.0,0.0,0.0,Only president who has a heart since jfk,"[('only', 'ADV'), ('president', 'NOUN'), ('who', 'PRON'), ('have', 'VERB'), ('a', 'DET'), ('heart', 'NOUN'), ('since', 'SCONJ'), ('jfk', 'PROPN')]","{'ADV': 1, 'NOUN': 2, 'PRON': 1, 'VERB': 1, 'DET': 1, 'SCONJ': 1, 'PROPN': 1}",only president have heart jfk,NOUN NOUN PROPN,1.0,president heart since jfk,0,0,
