,message,Direct Harassment,Hate Speech,Sexual Harassment,Trolling,Others,Toxic,cleaned_message,POS,tagCounts,preprocessed_1,POS-SEQ,None,words,uppercase_word_count,punctuation_count,not_in_vocab_words
232,BIDEN = Big Irregularities During Elections Night,0.0,0.0,0.0,1.0,0.0,0.0,BIDEN = Big Irregularities During Elections Night,"[('BIDEN', 'NOUN'), ('=', 'PUNCT'), ('big', 'ADJ'), ('irregularity', 'NOUN'), ('during', 'ADP'), ('Elections', 'PROPN'), ('Night', 'PROPN')]","{'NOUN': 2, 'PUNCT': 1, 'ADJ': 1, 'ADP': 1, 'PROPN': 2}",biden big irregularity elections night,NOUN ADJ NOUN PROPN PROPN,0.0,BIDEN big irregularity Elections Night,1,1,irregularity
233,VOTE FOR TRUMP IN GEORGIA SENATE RUN OFF 2020,0.0,0.0,0.0,0.0,0.0,0.0,VOTE FOR TRUMP IN GEORGIA SENATE RUN OFF 2020,"[('vote', 'NOUN'), ('for', 'ADP'), ('TRUMP', 'PROPN'), ('in', 'ADP'), ('GEORGIA', 'PROPN'), ('SENATE', 'PROPN'), ('RUN', 'PROPN'), ('OFF', 'PROPN'), ('2020', 'NUM')]","{'NOUN': 1, 'ADP': 2, 'PROPN': 5, 'NUM': 1}",vote trump georgia senate run off 2020,NOUN PROPN PROPN PROPN PROPN PROPN NUM,1.0,vote TRUMP GEORGIA SENATE RUN 2020,8,0,
234,COUNT EVERY ILLEGAL VOTE!!!,0.0,0.0,0.0,0.0,0.0,0.0,COUNT EVERY ILLEGAL VOTE!!!,"[('COUNT', 'PROPN'), ('every', 'DET'), ('ILLEGAL', 'PROPN'), ('VOTE', 'PROPN'), ('!', 'PUNCT'), ('!', 'PUNCT'), ('!', 'PUNCT')]","{'PROPN': 3, 'DET': 1, 'PUNCT': 3}",count illegal vote,PROPN PROPN PROPN,1.0,COUNT every ILLEGAL VOTE,4,3,
235,look at this dude,0.0,0.0,0.0,0.0,0.0,0.0,look at this dude,"[('look', 'VERB'), ('at', 'ADP'), ('this', 'DET'), ('dude', 'NOUN')]","{'VERB': 1, 'ADP': 1, 'DET': 1, 'NOUN': 1}",look dude,VERB NOUN,1.0,look dude,0,0,
236,dont get heart attacks Trump fanboys :),1.0,0.0,0.0,0.0,0.0,0.0,do not get heart attacks Trump fanboys :),"[('do', 'AUX'), ('not', 'PART'), ('get', 'VERB'), ('heart', 'NOUN'), ('attack', 'NOUN'), ('Trump', 'PROPN'), ('fanboy', 'NOUN'), (':)', 'PUNCT')]","{'AUX': 1, 'PART': 1, 'VERB': 1, 'NOUN': 3, 'PROPN': 1, 'PUNCT': 1}",nt get heart attack trump fanboy :),VERB NOUN NOUN PROPN NOUN,0.0,get heart attack Trump fanboy :),0,2,fanboy
237,"I can’t take these Librals, we won",1.0,0.0,0.0,0.0,0.0,0.0,"I can not take these Librals, we won","[('I', 'PRON'), ('can', 'AUX'), ('not', 'PART'), ('take', 'VERB'), ('these', 'DET'), ('Librals', 'PROPN'), (',', 'PUNCT'), ('we', 'PRON'), ('win', 'VERB')]","{'PRON': 2, 'AUX': 1, 'PART': 1, 'VERB': 2, 'DET': 1, 'PROPN': 1, 'PUNCT': 1}",n’t take librals win,PRON VERB PROPN VERB,0.0,take Librals win,1,1,librals
238,"not the same hearing on ntd channel, Guiuliani is speaking...",0.0,0.0,0.0,0.0,0.0,0.0,"not the same hearing on ntd channel, Guiuliani is speaking...","[('not', 'PART'), ('the', 'DET'), ('same', 'ADJ'), ('hearing', 'NOUN'), ('on', 'ADP'), ('ntd', 'ADJ'), ('channel', 'NOUN'), (',', 'PUNCT'), ('Guiuliani', 'PROPN'), ('be', 'AUX'), ('speak', 'VERB'), ('...', 'PUNCT')]","{'PART': 1, 'DET': 1, 'ADJ': 2, 'NOUN': 2, 'ADP': 1, 'PUNCT': 2, 'PROPN': 1, 'AUX': 1, 'VERB': 1}",not same hearing ntd channel guiuliani speak ...,NOUN ADJ NOUN PROPN VERB,1.0,hearing ntd channel Guiuliani speak ...,0,4,guiuliani
239,"I thought FOX NEWS was totally out it, ohh let me guess I believe they now realize that things are turning quickly we will never forgive what you guys did on election night",0.0,0.0,0.0,0.0,0.0,0.0,"I thought FOX NEWS was totally out it, ohh let me guess I believe they now realize that things are turning quickly we will never forgive what you guys did on election night","[('I', 'PRON'), ('think', 'VERB'), ('FOX', 'PROPN'), ('NEWS', 'PROPN'), ('be', 'AUX'), ('totally', 'ADV'), ('out', 'SCONJ'), ('it', 'PRON'), (',', 'PUNCT'), ('ohh', 'INTJ'), ('let', 'VERB'), ('I', 'PRON'), ('guess', 'VERB'), ('I', 'PRON'), ('believe', 'VERB'), ('they', 'PRON'), ('now', 'ADV'), ('realize', 'VERB'), ('that', 'SCONJ'), ('thing', 'NOUN'), ('be', 'AUX'), ('turn', 'VERB'), ('quickly', 'ADV'), ('we', 'PRON'), ('will', 'AUX'), ('never', 'ADV'), ('forgive', 'VERB'), ('what', 'PRON'), ('you', 'PRON'), ('guy', 'NOUN'), ('do', 'VERB'), ('on', 'ADP'), ('election', 'NOUN'), ('night', 'NOUN')]","{'PRON': 8, 'VERB': 8, 'PROPN': 2, 'AUX': 3, 'ADV': 4, 'SCONJ': 2, 'PUNCT': 1, 'INTJ': 1, 'NOUN': 4, 'ADP': 1}",think fox news totally ohh let guess believe now realize thing turn quickly never forgive guy do election night,PRON VERB PROPN PROPN ADV INTJ VERB PRON VERB PRON VERB VERB NOUN VERB ADV ADV VERB NOUN NOUN NOUN,1.0,think FOX NEWS totally ohh let guess believe realize thing turn quickly never forgive guy election night,4,1,ohh
240,if people really understood what was going on in the courts right now they would see that this certification is meaningless. the only meaningful certification is when Congress certifies the electors,0.0,0.0,0.0,0.0,0.0,0.0,if people really understood what was going on in the courts right now they would see that this certification is meaningless. the only meaningful certification is when Congress certifies the electors,"[('if', 'SCONJ'), ('people', 'NOUN'), ('really', 'ADV'), ('understand', 'VERB'), ('what', 'PRON'), ('be', 'AUX'), ('go', 'VERB'), ('on', 'ADP'), ('in', 'ADP'), ('the', 'DET'), ('court', 'NOUN'), ('right', 'ADV'), ('now', 'ADV'), ('they', 'PRON'), ('would', 'AUX'), ('see', 'VERB'), ('that', 'SCONJ'), ('this', 'DET'), ('certification', 'NOUN'), ('be', 'AUX'), ('meaningless', 'ADJ'), ('.', 'PUNCT'), ('the', 'DET'), ('only', 'ADJ'), ('meaningful', 'ADJ'), ('certification', 'NOUN'), ('be', 'AUX'), ('when', 'ADV'), ('Congress', 'PROPN'), ('certify', 'VERB'), ('the', 'DET'), ('elector', 'NOUN')]","{'SCONJ': 2, 'NOUN': 5, 'ADV': 4, 'VERB': 4, 'PRON': 2, 'AUX': 4, 'ADP': 2, 'DET': 4, 'ADJ': 3, 'PUNCT': 1, 'PROPN': 1}",people really understand go court right now see certification meaningless only meaningful certification when congress certify elector,NOUN ADV VERB VERB NOUN ADV VERB NOUN ADJ ADJ NOUN PROPN VERB NOUN,1.0,people really understand go court right would see certification meaningless meaningful certification Congress certify elector,0,1,elector
241,Good thing they will overturn it,0.0,0.0,0.0,0.0,0.0,0.0,Good thing they will overturn it,"[('good', 'ADJ'), ('thing', 'NOUN'), ('they', 'PRON'), ('will', 'AUX'), ('overturn', 'VERB'), ('it', 'PRON')]","{'ADJ': 1, 'NOUN': 1, 'PRON': 2, 'AUX': 1, 'VERB': 1}",good thing overturn,ADJ NOUN VERB,1.0,good thing overturn,0,0,
242,"at the ages of 74, Trump lose big, Trump can't turn the clock back.",0.0,0.0,0.0,0.0,0.0,0.0,"at the ages of 74, Trump lose big, Trump can not turn the clock back.","[('at', 'ADP'), ('the', 'DET'), ('age', 'NOUN'), ('of', 'ADP'), ('74', 'NUM'), (',', 'PUNCT'), ('Trump', 'PROPN'), ('lose', 'VERB'), ('big', 'ADJ'), (',', 'PUNCT'), ('Trump', 'PROPN'), ('can', 'AUX'), ('not', 'PART'), ('turn', 'VERB'), ('the', 'DET'), ('clock', 'NOUN'), ('back', 'ADP'), ('.', 'PUNCT')]","{'ADP': 3, 'DET': 2, 'NOUN': 2, 'NUM': 1, 'PUNCT': 3, 'PROPN': 2, 'VERB': 2, 'ADJ': 1, 'AUX': 1, 'PART': 1}",age 74 trump lose big trump not turn clock,NOUN NUM PROPN VERB ADJ PROPN VERB NOUN ADP,1.0,age 74 Trump lose big Trump turn clock back,0,3,
243,BEIJING JOE BIDEN *LOST* THIS ELECTION!!,0.0,0.0,0.0,0.0,0.0,0.0,BEIJING JOE BIDEN *LOST* THIS ELECTION!!,"[('BEIJING', 'PROPN'), ('JOE', 'PROPN'), ('BIDEN', 'NOUN'), ('*', 'PUNCT'), ('lose', 'VERB'), ('*', 'PUNCT'), ('this', 'DET'), ('election', 'NOUN'), ('!', 'PUNCT'), ('!', 'PUNCT')]","{'PROPN': 2, 'NOUN': 2, 'PUNCT': 4, 'VERB': 1, 'DET': 1}",beijing joe biden lose election,PROPN PROPN NOUN VERB NOUN,1.0,BEIJING JOE BIDEN lose election,6,4,
244,✨ 100% Free and Fair election and everyone knows it ✨,0.0,0.0,0.0,0.0,0.0,0.0,✨ 100% Free and Fair election and everyone knows it ✨,"[('✨', 'EMOJI'), ('100', 'NUM'), ('%', 'NOUN'), ('Free', 'PROPN'), ('and', 'CCONJ'), ('Fair', 'PROPN'), ('election', 'NOUN'), ('and', 'CCONJ'), ('everyone', 'PRON'), ('know', 'VERB'), ('it', 'PRON'), ('✨', 'EMOJI')]","{'EMOJI': 2, 'NUM': 1, 'NOUN': 2, 'PROPN': 2, 'CCONJ': 2, 'PRON': 2, 'VERB': 1}",✨ 100 free fair election know,EMOJI NUM NOUN PROPN PROPN NOUN PRON VERB EMOJI,1.0,100 Free Fair election everyone know,0,1,
245,civil war we need to fight for our country or it will become communist 😡😡😡😡,0.0,1.0,0.0,0.0,0.0,0.0,civil war we need to fight for our country or it will become communist 😡😡😡😡,"[('civil', 'ADJ'), ('war', 'NOUN'), ('we', 'PRON'), ('need', 'VERB'), ('to', 'PART'), ('fight', 'VERB'), ('for', 'ADP'), ('our', 'PRON'), ('country', 'NOUN'), ('or', 'CCONJ'), ('it', 'PRON'), ('will', 'AUX'), ('become', 'VERB'), ('communist', 'ADJ'), ('😡', 'EMOJI'), ('😡', 'EMOJI'), ('😡', 'EMOJI'), ('😡', 'EMOJI')]","{'ADJ': 2, 'NOUN': 2, 'PRON': 3, 'VERB': 3, 'PART': 1, 'ADP': 1, 'CCONJ': 1, 'AUX': 1, 'EMOJI': 4}",civil war need to fight country become communist 😡 😡 😡 😡,ADJ NOUN VERB VERB NOUN VERB ADJ EMOJI EMOJI EMOJI EMOJI,0.0,civil war need fight country become communist,0,0,
246,No more freedom after you realize you were never free for decades. All rigged for decades,0.0,0.0,0.0,0.0,0.0,0.0,No more freedom after you realize you were never free for decades. All rigged for decades,"[('no', 'DET'), ('more', 'ADJ'), ('freedom', 'NOUN'), ('after', 'ADP'), ('you', 'PRON'), ('realize', 'VERB'), ('you', 'PRON'), ('be', 'AUX'), ('never', 'ADV'), ('free', 'ADJ'), ('for', 'ADP'), ('decade', 'NOUN'), ('.', 'PUNCT'), ('all', 'DET'), ('rig', 'VERB'), ('for', 'ADP'), ('decade', 'NOUN')]","{'DET': 2, 'ADJ': 2, 'NOUN': 3, 'ADP': 3, 'PRON': 2, 'VERB': 2, 'AUX': 1, 'ADV': 1, 'PUNCT': 1}",more freedom realize never free decade rig decade,NOUN VERB ADV ADJ NOUN VERB NOUN,1.0,freedom realize never free decade rig decade,0,1,
247,✝️TRUMP THE DEVIL INCARNATE IS DONE✝️,1.0,1.0,0.0,0.0,0.0,1.0,✝️TRUMP THE DEVIL INCARNATE IS DONE✝️,"[('✝', 'EMOJI'), ('️TRUMP', 'PROPN'), ('the', 'DET'), ('DEVIL', 'PROPN'), ('incarnate', 'NOUN'), ('be', 'AUX'), ('do', 'VERB'), ('✝️', 'EMOJI')]","{'EMOJI': 2, 'PROPN': 2, 'DET': 1, 'NOUN': 1, 'AUX': 1, 'VERB': 1}",✝ ️trump devil incarnate do ✝ ️,EMOJI PROPN PROPN NOUN EMOJI,0.0,️TRUMP DEVIL incarnate,6,0,️trump
248,I am not hearing they are overturning anything!,0.0,0.0,0.0,0.0,0.0,0.0,I am not hearing they are overturning anything!,"[('I', 'PRON'), ('be', 'AUX'), ('not', 'PART'), ('hear', 'VERB'), ('they', 'PRON'), ('be', 'AUX'), ('overturn', 'VERB'), ('anything', 'PRON'), ('!', 'PUNCT')]","{'PRON': 3, 'AUX': 2, 'PART': 1, 'VERB': 2, 'PUNCT': 1}",not hear overturn,PRON VERB VERB PRON,1.0,hear overturn anything,1,1,
249,AZ Secretary OF State and the Attorney etc . Just committed perjured themselves.,0.0,0.0,0.0,0.0,0.0,0.0,AZ Secretary OF State and the Attorney etc . Just committed perjured themselves.,"[('AZ', 'PROPN'), ('Secretary', 'PROPN'), ('of', 'ADP'), ('State', 'PROPN'), ('and', 'CCONJ'), ('the', 'DET'), ('Attorney', 'PROPN'), ('etc', 'X'), ('.', 'PUNCT'), ('just', 'ADV'), ('commit', 'VERB'), ('perjure', 'VERB'), ('themselves', 'PRON'), ('.', 'PUNCT')]","{'PROPN': 4, 'ADP': 1, 'CCONJ': 1, 'DET': 1, 'X': 1, 'PUNCT': 2, 'ADV': 1, 'VERB': 2, 'PRON': 1}",az secretary state attorney etc just commit perjure,PROPN PROPN PROPN PROPN X VERB VERB,1.0,AZ Secretary State Attorney etc commit perjure,2,2,az perjure
250,Beijing Joe will sell the USA,0.0,0.0,0.0,1.0,0.0,0.0,Beijing Joe will sell the USA,"[('Beijing', 'PROPN'), ('Joe', 'PROPN'), ('will', 'AUX'), ('sell', 'VERB'), ('the', 'DET'), ('USA', 'PROPN')]","{'PROPN': 3, 'AUX': 1, 'VERB': 1, 'DET': 1}",beijing joe sell usa,PROPN PROPN VERB PROPN,0.0,Beijing Joe sell USA,1,0,
251,MAGAT meldown inprogress,1.0,0.0,0.0,0.0,0.0,0.0,MAGAT meldown inprogress,"[('MAGAT', 'PROPN'), ('meldown', 'VERB'), ('inprogress', 'NOUN')]","{'PROPN': 1, 'VERB': 1, 'NOUN': 1}",magat meldown inprogress,PROPN VERB NOUN,0.0,MAGAT meldown inprogress,1,0,magat meldown inprogress
252,pack your bags because you're heading to prison,1.0,0.0,0.0,0.0,0.0,0.0,pack your bags because you are heading to prison,"[('pack', 'VERB'), ('your', 'PRON'), ('bag', 'NOUN'), ('because', 'SCONJ'), ('you', 'PRON'), ('be', 'AUX'), ('head', 'VERB'), ('to', 'ADP'), ('prison', 'NOUN')]","{'VERB': 2, 'PRON': 2, 'NOUN': 2, 'SCONJ': 1, 'AUX': 1, 'ADP': 1}",pack bag head prison,VERB NOUN VERB NOUN,0.0,pack bag head prison,0,0,
253,Look at the traitors.,1.0,0.0,0.0,0.0,0.0,0.0,Look at the traitors.,"[('look', 'VERB'), ('at', 'ADP'), ('the', 'DET'), ('traitor', 'NOUN'), ('.', 'PUNCT')]","{'VERB': 1, 'ADP': 1, 'DET': 1, 'NOUN': 1, 'PUNCT': 1}",look traitor,VERB NOUN,0.0,look traitor,0,1,
254,why do lefties want communism? makes no sense to me🤷‍♂️,0.0,1.0,0.0,0.0,0.0,0.0,why do lefties want communism? makes no sense to me🤷‍♂️,"[('why', 'ADV'), ('do', 'AUX'), ('lefty', 'NOUN'), ('want', 'VERB'), ('communism', 'NOUN'), ('?', 'PUNCT'), ('make', 'VERB'), ('no', 'DET'), ('sense', 'NOUN'), ('to', 'ADP'), ('I', 'PRON'), ('🤷\u200d♂️', 'EMOJI')]","{'ADV': 1, 'AUX': 1, 'NOUN': 3, 'VERB': 2, 'PUNCT': 1, 'DET': 1, 'ADP': 1, 'PRON': 1, 'EMOJI': 1}",why lefty want communism make sense 🤷 ‍ ♂ ️,NOUN VERB NOUN VERB NOUN PRON EMOJI,0.0,lefty want communism make sense,0,1,
255,Treason may you pay dearly,0.0,0.0,0.0,0.0,0.0,0.0,Treason may you pay dearly,"[('treason', 'NOUN'), ('may', 'AUX'), ('you', 'PRON'), ('pay', 'VERB'), ('dearly', 'ADV')]","{'NOUN': 1, 'AUX': 1, 'PRON': 1, 'VERB': 1, 'ADV': 1}",treason pay dearly,NOUN VERB ADV,1.0,treason may pay dearly,0,0,
256,democracy is in progress,0.0,0.0,0.0,0.0,0.0,0.0,democracy is in progress,"[('democracy', 'NOUN'), ('be', 'AUX'), ('in', 'ADP'), ('progress', 'NOUN')]","{'NOUN': 2, 'AUX': 1, 'ADP': 1}",democracy progress,NOUN NOUN,1.0,democracy progress,0,0,
257,TRUMPS CRYING 😭 😭😭,1.0,0.0,0.0,0.0,0.0,0.0,TRUMPS CRYING 😭 😭😭,"[('trumps', 'NOUN'), ('crying', 'NOUN'), ('😭', 'EMOJI'), ('😭', 'EMOJI'), ('😭', 'EMOJI')]","{'NOUN': 2, 'EMOJI': 3}",trump cry 😭 😭 😭,NOUN NOUN EMOJI EMOJI EMOJI,0.0,trump cry,2,0,
258,BIDEN 2020,0.0,0.0,0.0,0.0,0.0,0.0,BIDEN 2020,"[('BIDEN', 'NOUN'), ('2020', 'NUM')]","{'NOUN': 1, 'NUM': 1}",biden 2020,NOUN NUM,1.0,BIDEN 2020,1,0,
259,GA IS BLUEEEEEEEEEEEEE. WE ARE COMING IN RECORD NUMBERS IN THE RUNOFF!!!! PRESIDENT BIDEN WILL HAVE HIS AGENDA MOVED FORWARD WITHOUT OBSTRUCTION!!! DC AND PUERTO RICO STATEHOOD!!!! CRY CHUMPS 😆 😆,1.0,0.0,0.0,1.0,0.0,0.0,GA IS BLUEEEEEEEEEEEEE. WE ARE COMING IN RECORD NUMBERS IN THE RUNOFF!!!! PRESIDENT BIDEN WILL HAVE HIS AGENDA MOVED FORWARD WITHOUT OBSTRUCTION!!! DC AND PUERTO RICO STATEHOOD!!!! CRY CHUMPS 😆 😆,"[('ga', 'NOUN'), ('be', 'AUX'), ('blueeeeeeeeeeeee', 'ADJ'), ('.', 'PUNCT'), ('we', 'PRON'), ('be', 'AUX'), ('come', 'VERB'), ('in', 'ADP'), ('record', 'NOUN'), ('number', 'NOUN'), ('in', 'ADP'), ('the', 'DET'), ('runoff', 'NOUN'), ('!', 'PUNCT'), ('!', 'PUNCT'), ('!', 'PUNCT'), ('!', 'PUNCT'), ('PRESIDENT', 'PROPN'), ('BIDEN', 'PROPN'), ('will', 'AUX'), ('have', 'VERB'), ('his', 'PRON'), ('agenda', 'NOUN'), ('MOVED', 'PROPN'), ('forward', 'ADV'), ('without', 'ADP'), ('obstruction', 'NOUN'), ('!', 'PUNCT'), ('!', 'PUNCT'), ('!', 'PUNCT'), ('DC', 'PROPN'), ('and', 'CCONJ'), ('PUERTO', 'PROPN'), ('RICO', 'PROPN'), ('STATEHOOD', 'PROPN'), ('!', 'PUNCT'), ('!', 'PUNCT'), ('!', 'PUNCT'), ('!', 'PUNCT'), ('CRY', 'PROPN'), ('CHUMPS', 'PROPN'), ('😆', 'EMOJI'), ('😆', 'EMOJI')]","{'NOUN': 6, 'AUX': 3, 'ADJ': 1, 'PUNCT': 12, 'PRON': 2, 'VERB': 2, 'ADP': 3, 'DET': 1, 'PROPN': 9, 'ADV': 1, 'CCONJ': 1, 'EMOJI': 2}",ga blueeeeeeeeeeeee come record number runoff president biden have agenda moved forward obstruction dc puerto rico statehood cry chumps 😆 😆,NOUN ADJ VERB NOUN NOUN NOUN PROPN PROPN NOUN PROPN ADV ADP NOUN PROPN PROPN PROPN PROPN PROPN PROPN EMOJI EMOJI,0.0,ga blueeeeeeeeeeeee come record number runoff PRESIDENT BIDEN agenda MOVED forward without obstruction DC PUERTO RICO STATEHOOD CRY CHUMPS,29,12,blueeeeeeeeeeeee number chumps
260,SMF has it right 👍,0.0,0.0,0.0,0.0,0.0,0.0,SMF has it right 👍,"[('SMF', 'PROPN'), ('have', 'VERB'), ('it', 'PRON'), ('right', 'ADJ'), ('👍', 'EMOJI')]","{'PROPN': 1, 'VERB': 1, 'PRON': 1, 'ADJ': 1, 'EMOJI': 1}",smf have right 👍,PROPN ADJ EMOJI,1.0,SMF right,1,0,smf
261,Lol. Trump supporters do not cry!! We fight;),0.0,0.0,0.0,0.0,0.0,0.0,Lol. Trump supporters do not cry!! We fight;),"[('Lol', 'PROPN'), ('.', 'PUNCT'), ('Trump', 'PROPN'), ('supporter', 'NOUN'), ('do', 'AUX'), ('not', 'PART'), ('cry', 'VERB'), ('!', 'PUNCT'), ('!', 'PUNCT'), ('we', 'PRON'), ('fight', 'VERB'), (';)', 'PUNCT')]","{'PROPN': 2, 'PUNCT': 4, 'NOUN': 1, 'AUX': 1, 'PART': 1, 'VERB': 2, 'PRON': 1}",lol trump supporter not cry fight ;),PROPN PROPN NOUN VERB VERB,1.0,Lol Trump supporter cry fight ;),0,5,
262,💙PIMA COUNTY FOR PRESIDENT BIDEN AND senator Mark Kelly!💙,0.0,0.0,0.0,0.0,0.0,0.0,💙PIMA COUNTY FOR PRESIDENT BIDEN AND senator Mark Kelly!💙,"[('💙', 'EMOJI'), ('PIMA', 'PROPN'), ('county', 'NOUN'), ('for', 'ADP'), ('PRESIDENT', 'PROPN'), ('BIDEN', 'NOUN'), ('and', 'CCONJ'), ('senator', 'NOUN'), ('Mark', 'PROPN'), ('Kelly', 'PROPN'), ('!', 'PUNCT'), ('💙', 'EMOJI')]","{'EMOJI': 2, 'PROPN': 4, 'NOUN': 3, 'ADP': 1, 'CCONJ': 1, 'PUNCT': 1}",💙 pima county president biden senator mark kelly 💙,EMOJI PROPN NOUN PROPN NOUN NOUN PROPN PROPN EMOJI,1.0,PIMA county PRESIDENT BIDEN senator Mark Kelly,6,1,pima mark
263,How do you certify a rigged process?! 😡,0.0,0.0,0.0,0.0,0.0,0.0,How do you certify a rigged process?! 😡,"[('how', 'ADV'), ('do', 'AUX'), ('you', 'PRON'), ('certify', 'VERB'), ('a', 'DET'), ('rigged', 'ADJ'), ('process', 'NOUN'), ('?', 'PUNCT'), ('!', 'PUNCT'), ('😡', 'EMOJI')]","{'ADV': 1, 'AUX': 1, 'PRON': 1, 'VERB': 1, 'DET': 1, 'ADJ': 1, 'NOUN': 1, 'PUNCT': 2, 'EMOJI': 1}",how certify rigged process 😡,VERB ADJ NOUN EMOJI,1.0,certify rigged process,0,2,
264,"The only people that don’t want to disclose the truth, are people with something to hide.”. Barack H Obama",0.0,0.0,0.0,0.0,0.0,0.0,"The only people that do not want to disclose the truth, are people with something to hide.”. Barack H Obama","[('the', 'DET'), ('only', 'ADJ'), ('people', 'NOUN'), ('that', 'DET'), ('do', 'AUX'), ('not', 'PART'), ('want', 'VERB'), ('to', 'PART'), ('disclose', 'VERB'), ('the', 'DET'), ('truth', 'NOUN'), (',', 'PUNCT'), ('be', 'AUX'), ('people', 'NOUN'), ('with', 'ADP'), ('something', 'PRON'), ('to', 'PART'), ('hide', 'VERB'), ('.', 'PUNCT'), ('""', 'PUNCT'), ('.', 'PUNCT'), ('barack', 'ADJ'), ('h', 'NOUN'), ('Obama', 'PROPN')]","{'DET': 3, 'ADJ': 2, 'NOUN': 4, 'AUX': 2, 'PART': 3, 'VERB': 3, 'PUNCT': 4, 'ADP': 1, 'PRON': 1, 'PROPN': 1}",only people n’t want to disclose truth people to hide barack h obama,NOUN VERB VERB NOUN NOUN PRON VERB ADJ NOUN PROPN,1.0,people want disclose truth people something hide barack h Obama,1,3,barack
265,I LOVE MAGA TEARS,1.0,0.0,0.0,0.0,0.0,0.0,I LOVE MAGA TEARS,"[('I', 'PRON'), ('love', 'VERB'), ('MAGA', 'PROPN'), ('tear', 'NOUN')]","{'PRON': 1, 'VERB': 1, 'PROPN': 1, 'NOUN': 1}",love maga tear,PRON VERB PROPN NOUN,0.0,love MAGA tear,4,0,maga
266,Biden won’t spend one day in office!!,0.0,1.0,0.0,1.0,0.0,0.0,Biden will not spend one day in office!!,"[('Biden', 'PROPN'), ('will', 'AUX'), ('not', 'PART'), ('spend', 'VERB'), ('one', 'NUM'), ('day', 'NOUN'), ('in', 'ADP'), ('office', 'NOUN'), ('!', 'PUNCT'), ('!', 'PUNCT')]","{'PROPN': 1, 'AUX': 1, 'PART': 1, 'VERB': 1, 'NUM': 1, 'NOUN': 2, 'ADP': 1, 'PUNCT': 2}",biden n’t spend one day office,PROPN VERB NUM NOUN NOUN,0.0,Biden spend one day office,0,2,
267,president Biden,0.0,0.0,0.0,0.0,0.0,0.0,president Biden,"[('president', 'PROPN'), ('Biden', 'PROPN')]",{'PROPN': 2},president biden,PROPN PROPN,1.0,president Biden,0,0,
268,"once they sign, they become traitors",0.0,1.0,0.0,1.0,0.0,0.0,"once they sign, they become traitors","[('once', 'SCONJ'), ('they', 'PRON'), ('sign', 'VERB'), (',', 'PUNCT'), ('they', 'PRON'), ('become', 'VERB'), ('traitor', 'NOUN')]","{'SCONJ': 1, 'PRON': 2, 'VERB': 2, 'PUNCT': 1, 'NOUN': 1}",sign become traitor,VERB VERB NOUN,0.0,sign become traitor,0,1,
269,Fox showing total BS,1.0,1.0,0.0,0.0,0.0,0.0,Fox showing total BS,"[('Fox', 'PROPN'), ('show', 'VERB'), ('total', 'ADJ'), ('bs', 'NOUN')]","{'PROPN': 1, 'VERB': 1, 'ADJ': 1, 'NOUN': 1}",fox show total b,PROPN VERB ADJ NOUN,0.0,Fox show total b,1,0,
270,Yeah sign your life away traitors,1.0,0.0,0.0,0.0,0.0,0.0,Yeah sign your life away traitors,"[('yeah', 'INTJ'), ('sign', 'VERB'), ('your', 'PRON'), ('life', 'NOUN'), ('away', 'ADV'), ('traitor', 'NOUN')]","{'INTJ': 1, 'VERB': 1, 'PRON': 1, 'NOUN': 2, 'ADV': 1}",yeah sign life away traitor,INTJ VERB NOUN ADV NOUN,0.0,yeah sign life away traitor,0,0,
271,"we need another civil war, NOW!!!!!!!!!!",0.0,0.0,0.0,0.0,1.0,0.0,"we need another civil war, NOW!!!!!!!!!!","[('we', 'PRON'), ('need', 'VERB'), ('another', 'DET'), ('civil', 'ADJ'), ('war', 'NOUN'), (',', 'PUNCT'), ('now', 'ADV'), ('!', 'PUNCT'), ('!', 'PUNCT'), ('!', 'PUNCT'), ('!', 'PUNCT'), ('!', 'PUNCT'), ('!', 'PUNCT'), ('!', 'PUNCT'), ('!', 'PUNCT'), ('!', 'PUNCT'), ('!', 'PUNCT')]","{'PRON': 1, 'VERB': 1, 'DET': 1, 'ADJ': 1, 'NOUN': 1, 'PUNCT': 11, 'ADV': 1}",need civil war now,VERB ADJ NOUN,0.0,need another civil war,1,11,
272,perjury with a touch of treason,0.0,0.0,0.0,0.0,0.0,0.0,perjury with a touch of treason,"[('perjury', 'NOUN'), ('with', 'ADP'), ('a', 'DET'), ('touch', 'NOUN'), ('of', 'ADP'), ('treason', 'NOUN')]","{'NOUN': 3, 'ADP': 2, 'DET': 1}",perjury touch treason,NOUN NOUN NOUN,1.0,perjury touch treason,0,0,
273,Boogalooooo,0.0,0.0,0.0,0.0,0.0,0.0,Boogalooooo,"[('Boogalooooo', 'PROPN')]",{'PROPN': 1},boogalooooo,PROPN,1.0,Boogalooooo,0,0,boogalooooo
274,The one lady sounds like a bratty teen girl,1.0,1.0,0.0,0.0,0.0,0.0,The one lady sounds like a bratty teen girl,"[('the', 'DET'), ('one', 'NUM'), ('lady', 'NOUN'), ('sound', 'VERB'), ('like', 'ADP'), ('a', 'DET'), ('bratty', 'ADJ'), ('teen', 'NOUN'), ('girl', 'NOUN')]","{'DET': 2, 'NUM': 1, 'NOUN': 3, 'VERB': 1, 'ADP': 1, 'ADJ': 1}",one lady sound bratty teen girl,NUM NOUN VERB ADP ADJ NOUN NOUN,0.0,one lady sound like bratty teen girl,0,0,bratty
275,Freaking frauds,1.0,0.0,0.0,0.0,0.0,0.0,Freaking frauds,"[('freaking', 'NOUN'), ('fraud', 'NOUN')]",{'NOUN': 2},freaking fraud,NOUN NOUN,0.0,freaking fraud,0,0,
276,"this is a sham, I don't think it's legal, they can't do this while hearings are going on. Gonna get their asses reamed for this.",0.0,0.0,0.0,0.0,0.0,0.0,"this is a sham, I do not think it is legal, they can not do this while hearings are going on. going to get their asses reamed for this.","[('this', 'DET'), ('be', 'AUX'), ('a', 'DET'), ('sham', 'NOUN'), (',', 'PUNCT'), ('I', 'PRON'), ('do', 'AUX'), ('not', 'PART'), ('think', 'VERB'), ('it', 'PRON'), ('be', 'AUX'), ('legal', 'ADJ'), (',', 'PUNCT'), ('they', 'PRON'), ('can', 'AUX'), ('not', 'PART'), ('do', 'VERB'), ('this', 'DET'), ('while', 'SCONJ'), ('hearing', 'NOUN'), ('be', 'AUX'), ('go', 'VERB'), ('on', 'ADP'), ('.', 'PUNCT'), ('go', 'VERB'), ('to', 'PART'), ('get', 'VERB'), ('their', 'PRON'), ('ass', 'NOUN'), ('ream', 'VERB'), ('for', 'ADP'), ('this', 'DET'), ('.', 'PUNCT')]","{'DET': 4, 'AUX': 5, 'NOUN': 3, 'PUNCT': 4, 'PRON': 4, 'PART': 3, 'VERB': 6, 'ADJ': 1, 'SCONJ': 1, 'ADP': 2}",sham not think legal not do hearing go gon na get as ream,NOUN PRON VERB ADJ NOUN VERB VERB VERB NOUN VERB,1.0,sham think legal hearing go go get ream,1,4,
277,What did he just sign?,0.0,0.0,0.0,0.0,0.0,0.0,What did he just sign?,"[('what', 'PRON'), ('do', 'AUX'), ('he', 'PRON'), ('just', 'ADV'), ('sign', 'VERB'), ('?', 'PUNCT')]","{'PRON': 2, 'AUX': 1, 'ADV': 1, 'VERB': 1, 'PUNCT': 1}",just sign,VERB,1.0,sign,0,1,
278,This is the greatest crime in Arizona history,0.0,0.0,0.0,0.0,0.0,0.0,This is the greatest crime in Arizona history,"[('this', 'DET'), ('be', 'AUX'), ('the', 'DET'), ('great', 'ADJ'), ('crime', 'NOUN'), ('in', 'ADP'), ('Arizona', 'PROPN'), ('history', 'NOUN')]","{'DET': 2, 'AUX': 1, 'ADJ': 1, 'NOUN': 2, 'ADP': 1, 'PROPN': 1}",great crime arizona history,ADJ NOUN PROPN NOUN,1.0,great crime Arizona history,0,0,
279,I dont understand the hate for Trump supporters,0.0,0.0,0.0,0.0,0.0,0.0,I do not understand the hate for Trump supporters,"[('I', 'PRON'), ('do', 'AUX'), ('not', 'PART'), ('understand', 'VERB'), ('the', 'DET'), ('hate', 'NOUN'), ('for', 'ADP'), ('Trump', 'PROPN'), ('supporter', 'NOUN')]","{'PRON': 1, 'AUX': 1, 'PART': 1, 'VERB': 1, 'DET': 1, 'NOUN': 2, 'ADP': 1, 'PROPN': 1}",nt understand hate trump supporter,PRON VERB NOUN PROPN NOUN,1.0,understand hate Trump supporter,1,0,
280,Biden the Devil's spoil,0.0,0.0,0.0,0.0,0.0,1.0,Biden the Devil's spoil,"[('Biden', 'PROPN'), ('the', 'DET'), ('Devil', 'PROPN'), (""'s"", 'PART'), ('spoil', 'NOUN')]","{'PROPN': 2, 'DET': 1, 'PART': 1, 'NOUN': 1}",biden devils spoil,PROPN PROPN PART NOUN,0.0,Biden Devil 's spoil,0,0,
281,is this live right now?,0.0,0.0,0.0,0.0,0.0,0.0,is this live right now?,"[('be', 'AUX'), ('this', 'DET'), ('live', 'ADV'), ('right', 'ADV'), ('now', 'ADV'), ('?', 'PUNCT')]","{'AUX': 1, 'DET': 1, 'ADV': 3, 'PUNCT': 1}",live right now,ADV ADV,1.0,live right,0,1,
282,Broadcast Arizona hearing now,0.0,0.0,0.0,0.0,0.0,0.0,Broadcast Arizona hearing now,"[('Broadcast', 'PROPN'), ('Arizona', 'PROPN'), ('hearing', 'NOUN'), ('now', 'ADV')]","{'PROPN': 2, 'NOUN': 1, 'ADV': 1}",broadcast arizona hearing now,PROPN PROPN NOUN,1.0,Broadcast Arizona hearing,0,0,
283,I bet that signature is verified,0.0,0.0,0.0,0.0,0.0,0.0,I bet that signature is verified,"[('I', 'PRON'), ('bet', 'VERB'), ('that', 'SCONJ'), ('signature', 'NOUN'), ('be', 'AUX'), ('verify', 'VERB')]","{'PRON': 1, 'VERB': 2, 'SCONJ': 1, 'NOUN': 1, 'AUX': 1}",bet signature verify,PRON VERB NOUN VERB,1.0,bet signature verify,1,0,
