pron verb det verb,,,,,,,,,,,,
pron verb emoji,,,,,,,,,,,,
pron verb intj,,,,,,,,,,,,
pron verb intj aux,,,,,,,,,,,,
pron verb intj intj,,,,,,,,,,,,
pron verb intj pron,,,,,,,,,,,,
pron verb intj propn,,,,,,,,,,,,
pron verb noun,-0.3098386676965934,0.5501142545045465,-0.3098386676965934,0.5501142545045465,-0.3098386676965934,0.5501142545045465,-0.3098386676965934,0.5501142545045465,0.7745966692414834,0.07048399691021993,0.46475800154489,0.3530568618495133
pron verb noun adj,,,,,,,,,,,,
pron verb noun adp,,,,,,,,,,,,
pron verb noun adv,,,,,,,,,,,,
pron verb noun aux,,,,,,,,,,,,
pron verb noun cconj,,,,,,,,,,,,
pron verb noun det,,,,,,,,,,,,
pron verb noun emoji,,,,,,,,,,,,
pron verb noun intj,,,,,,,,,,,,
pron verb noun noun,-0.20000000000000007,0.704,-0.20000000000000007,0.704,-0.20000000000000007,0.704,-0.20000000000000007,0.704,1.0,0.0,-0.20000000000000007,0.704
pron verb noun num,,,,,,,,,,,,
pron verb noun pron,,,,,,,,,,,,
pron verb noun propn,,,,,,,,,,,,
pron verb noun punct,,,,,,,,,,,,
pron verb noun verb,,,,,,,,,,,,
pron verb num,,,,,,,,,,,,
pron verb num adp,,,,,,,,,,,,
pron verb num cconj,,,,,,,,,,,,
pron verb num noun,,,,,,,,,,,,
pron verb num num,,,,,,,,,,,,
pron verb num propn,,,,,,,,,,,,
pron verb num punct,,,,,,,,,,,,
pron verb num verb,,,,,,,,,,,,
pron verb pron,0.7745966692414834,0.07048399691021993,-0.3098386676965934,0.5501142545045465,-0.3098386676965934,0.5501142545045465,-0.3098386676965934,0.5501142545045465,-0.3098386676965934,0.5501142545045465,0.46475800154489,0.3530568618495133
pron verb pron adj,,,,,,,,,,,,
pron verb pron adp,,,,,,,,,,,,
pron verb pron adv,,,,,,,,,,,,
pron verb pron aux,,,,,,,,,,,,
pron verb pron cconj,,,,,,,,,,,,
pron verb pron det,,,,,,,,,,,,
pron verb pron intj,,,,,,,,,,,,
pron verb pron noun,,,,,,,,,,,,
pron verb pron num,,,,,,,,,,,,
pron verb pron pron,,,,,,,,,,,,
pron verb pron propn,,,,,,,,,,,,
pron verb pron punct,,,,,,,,,,,,
pron verb pron sconj,,,,,,,,,,,,
pron verb pron sym,-0.20000000000000007,0.704,-0.20000000000000007,0.704,-0.20000000000000007,0.704,-0.20000000000000007,0.704,-0.20000000000000007,0.704,1.0,0.0
pron verb pron verb,,,,,,,,,,,,
pron verb propn,-0.20000000000000007,0.704,-0.20000000000000007,0.704,-0.20000000000000007,0.704,-0.20000000000000007,0.704,1.0,0.0,-0.20000000000000007,0.704
pron verb propn adj,,,,,,,,,,,,
pron verb propn adp,,,,,,,,,,,,
pron verb propn adv,,,,,,,,,,,,
pron verb propn aux,,,,,,,,,,,,
pron verb propn cconj,,,,,,,,,,,,
pron verb propn det,,,,,,,,,,,,
pron verb propn noun,,,,,,,,,,,,
pron verb propn num,,,,,,,,,,,,
pron verb propn pron,,,,,,,,,,,,
pron verb propn propn,,,,,,,,,,,,
pron verb propn punct,,,,,,,,,,,,
pron verb propn verb,-0.20000000000000007,0.704,-0.20000000000000007,0.704,-0.20000000000000007,0.704,-0.20000000000000007,0.704,1.0,0.0,-0.20000000000000007,0.704
pron verb punct,,,,,,,,,,,,
pron verb punct adj,,,,,,,,,,,,
pron verb punct adv,,,,,,,,,,,,
pron verb punct aux,,,,,,,,,,,,
pron verb punct det,,,,,,,,,,,,
pron verb punct emoji,,,,,,,,,,,,
pron verb punct intj,,,,,,,,,,,,
pron verb punct noun,,,,,,,,,,,,
pron verb punct pron,,,,,,,,,,,,
pron verb punct propn,,,,,,,,,,,,
pron verb punct punct,,,,,,,,,,,,
pron verb punct sconj,,,,,,,,,,,,
pron verb sconj,,,,,,,,,,,,
pron verb sconj adj,,,,,,,,,,,,
pron verb sconj adv,,,,,,,,,,,,
pron verb sconj noun,,,,,,,,,,,,
pron verb sconj num,,,,,,,,,,,,
pron verb sconj pron,,,,,,,,,,,,
pron verb sconj propn,,,,,,,,,,,,
pron verb sconj verb,,,,,,,,,,,,
pron verb sym,,,,,,,,,,,,
pron verb sym num,,,,,,,,,,,,
pron verb verb,-0.20000000000000007,0.704,-0.20000000000000007,0.704,-0.20000000000000007,0.704,-0.20000000000000007,0.704,-0.20000000000000007,0.704,1.0,0.0
pron verb verb adj,,,,,,,,,,,,
pron verb verb adp,,,,,,,,,,,,
pron verb verb adv,,,,,,,,,,,,
pron verb verb cconj,,,,,,,,,,,,
pron verb verb det,,,,,,,,,,,,
pron verb verb emoji,,,,,,,,,,,,
pron verb verb intj,,,,,,,,,,,,
pron verb verb noun,-0.20000000000000007,0.704,-0.20000000000000007,0.704,-0.20000000000000007,0.704,-0.20000000000000007,0.704,-0.20000000000000007,0.704,1.0,0.0
pron verb verb pron,,,,,,,,,,,,
pron verb verb propn,,,,,,,,,,,,
pron verb verb punct,,,,,,,,,,,,
pron verb verb sconj,,,,,,,,,,,,
pron verb verb verb,,,,,,,,,,,,
propn,0.39279220242478635,0.4411128091213043,0.13093073414159545,0.8047261622231061,-0.13093073414159545,0.8047261622231061,-0.39279220242478635,0.4411128091213043,0.6546536707079772,0.15830242337545783,-0.6546536707079772,0.15830242337545783
propn adj,,,,,,,,,,,,
propn adj adv,,,,,,,,,,,,
propn adj adv verb,,,,,,,,,,,,
propn adj noun,,,,,,,,,,,,
propn adj noun adp,,,,,,,,,,,,
propn adj noun cconj,,,,,,,,,,,,
propn adj noun num,,,,,,,,,,,,
propn adj noun pron,,,,,,,,,,,,
propn adj noun propn,,,,,,,,,,,,
propn adj num,,,,,,,,,,,,
propn adj pron,,,,,,,,,,,,
propn adj pron aux,,,,,,,,,,,,
propn adj propn,,,,,,,,,,,,
propn adj propn punct,,,,,,,,,,,,
propn adj punct,,,,,,,,,,,,
propn adj punct det,,,,,,,,,,,,
propn adj punct pron,,,,,,,,,,,,
propn adj punct punct,,,,,,,,,,,,
propn adj punct verb,,,,,,,,,,,,
propn adp,,,,,,,,,,,,
propn adp adj,,,,,,,,,,,,
propn adp adp,,,,,,,,,,,,
propn adp adp adv,,,,,,,,,,,,
propn adp adv,,,,,,,,,,,,
propn adp adv adv,,,,,,,,,,,,
propn adp det,,,,,,,,,,,,
propn adp det adj,,,,,,,,,,,,
propn adp det noun,,,,,,,,,,,,
propn adp det propn,,,,,,,,,,,,
propn adp noun,,,,,,,,,,,,
propn adp noun adv,,,,,,,,,,,,
propn adp noun cconj,,,,,,,,,,,,
propn adp noun punct,,,,,,,,,,,,
propn adp num,,,,,,,,,,,,
propn adp num emoji,,,,,,,,,,,,
propn adp pron,,,,,,,,,,,,
propn adp pron det,,,,,,,,,,,,
propn adp pron noun,,,,,,,,,,,,
propn adp pron verb,,,,,,,,,,,,
propn adp propn,,,,,,,,,,,,
propn adp propn adj,,,,,,,,,,,,
propn adp propn cconj,,,,,,,,,,,,
propn adp propn emoji,,,,,,,,,,,,
propn adp propn pron,,,,,,,,,,,,
propn adp propn propn,,,,,,,,,,,,
propn adp propn punct,,,,,,,,,,,,
propn adp punct,,,,,,,,,,,,
propn adp verb,,,,,,,,,,,,
propn adp verb adp,,,,,,,,,,,,
propn adp verb pron,,,,,,,,,,,,
propn adv,,,,,,,,,,,,
propn adv adj,,,,,,,,,,,,
propn adv adj adp,,,,,,,,,,,,
propn adv adj noun,,,,,,,,,,,,
propn adv adj pron,,,,,,,,,,,,
propn adv adj propn,,,,,,,,,,,,
propn adv adp,,,,,,,,,,,,
propn adv adp noun,,,,,,,,,,,,
propn adv adp punct,,,,,,,,,,,,
propn adv adv,,,,,,,,,,,,
propn adv adv aux,,,,,,,,,,,,
propn adv adv noun,,,,,,,,,,,,
propn adv adv pron,,,,,,,,,,,,
propn adv adv punct,,,,,,,,,,,,
propn adv aux,,,,,,,,,,,,
propn adv aux adj,,,,,,,,,,,,
propn adv aux det,,,,,,,,,,,,
propn adv aux pron,,,,,,,,,,,,
propn adv aux verb,,,,,,,,,,,,
propn adv cconj,,,,,,,,,,,,
propn adv cconj sconj,,,,,,,,,,,,
propn adv det,,,,,,,,,,,,
propn adv det noun,,,,,,,,,,,,
propn adv emoji,,,,,,,,,,,,
propn adv emoji emoji,,,,,,,,,,,,
propn adv intj,,,,,,,,,,,,
propn adv noun,,,,,,,,,,,,
propn adv noun pron,,,,,,,,,,,,
propn adv pron,,,,,,,,,,,,
propn adv pron aux,,,,,,,,,,,,
propn adv pron det,,,,,,,,,,,,
propn adv pron pron,,,,,,,,,,,,
propn adv pron verb,,,,,,,,,,,,
propn adv propn,,,,,,,,,,,,
propn adv propn cconj,,,,,,,,,,,,
propn adv propn punct,,,,,,,,,,,,
propn adv propn verb,,,,,,,,,,,,
propn adv punct,,,,,,,,,,,,
propn adv punct pron,,,,,,,,,,,,
propn adv punct punct,,,,,,,,,,,,
propn adv sconj,,,,,,,,,,,,
propn adv sconj pron,,,,,,,,,,,,
propn adv verb,,,,,,,,,,,,
propn adv verb adj,,,,,,,,,,,,
propn adv verb adp,,,,,,,,,,,,
propn adv verb aux,,,,,,,,,,,,
propn adv verb det,,,,,,,,,,,,
propn adv verb intj,,,,,,,,,,,,
propn adv verb noun,,,,,,,,,,,,
propn adv verb pron,,,,,,,,,,,,
propn adv verb propn,,,,,,,,,,,,
propn adv verb punct,,,,,,,,,,,,
propn adv verb sconj,,,,,,,,,,,,
propn adv verb verb,,,,,,,,,,,,
propn aux,1.0,0.0,-0.20000000000000007,0.704,-0.20000000000000007,0.704,-0.20000000000000007,0.704,-0.20000000000000007,0.704,-0.20000000000000007,0.704
propn aux adj,,,,,,,,,,,,
propn aux adj adv,,,,,,,,,,,,
propn aux adj det,,,,,,,,,,,,
propn aux adj emoji,,,,,,,,,,,,
propn aux adj noun,,,,,,,,,,,,
propn aux adj pron,,,,,,,,,,,,
propn aux adj punct,,,,,,,,,,,,
propn aux adp,,,,,,,,,,,,
propn aux adp adj,,,,,,,,,,,,
propn aux adp noun,,,,,,,,,,,,
propn aux adp pron,,,,,,,,,,,,
propn aux adv,,,,,,,,,,,,
propn aux adv adj,,,,,,,,,,,,
propn aux adv adv,,,,,,,,,,,,
propn aux adv noun,,,,,,,,,,,,
propn aux adv propn,,,,,,,,,,,,
propn aux adv verb,,,,,,,,,,,,
propn aux aux,,,,,,,,,,,,
propn aux aux propn,,,,,,,,,,,,
propn aux aux verb,,,,,,,,,,,,
propn aux det,1.0,0.0,-0.20000000000000007,0.704,-0.20000000000000007,0.704,-0.20000000000000007,0.704,-0.20000000000000007,0.704,-0.20000000000000007,0.704
propn aux det adj,,,,,,,,,,,,
propn aux det det,1.0,0.0,-0.20000000000000007,0.704,-0.20000000000000007,0.704,-0.20000000000000007,0.704,-0.20000000000000007,0.704,-0.20000000000000007,0.704
propn aux det noun,,,,,,,,,,,,
propn aux det propn,,,,,,,,,,,,
propn aux noun,,,,,,,,,,,,
propn aux noun adj,,,,,,,,,,,,
propn aux noun noun,,,,,,,,,,,,
propn aux noun num,,,,,,,,,,,,
propn aux noun propn,,,,,,,,,,,,
propn aux noun punct,,,,,,,,,,,,
propn aux noun sconj,,,,,,,,,,,,
propn aux noun verb,,,,,,,,,,,,
propn aux num,,,,,,,,,,,,
propn aux num adp,,,,,,,,,,,,
propn aux num adv,,,,,,,,,,,,
propn aux num noun,,,,,,,,,,,,
propn aux pron,,,,,,,,,,,,
propn aux pron adj,,,,,,,,,,,,
propn aux pron adv,,,,,,,,,,,,
propn aux pron noun,,,,,,,,,,,,
propn aux pron propn,,,,,,,,,,,,
propn aux pron punct,,,,,,,,,,,,
propn aux pron verb,,,,,,,,,,,,
propn aux propn,,,,,,,,,,,,
propn aux propn adv,,,,,,,,,,,,
propn aux propn emoji,,,,,,,,,,,,
propn aux propn noun,,,,,,,,,,,,
propn aux propn propn,,,,,,,,,,,,
propn aux propn punct,,,,,,,,,,,,
propn aux propn verb,,,,,,,,,,,,
propn aux sconj,,,,,,,,,,,,
propn aux sconj adp,,,,,,,,,,,,
propn aux sconj pron,,,,,,,,,,,,
propn aux verb,,,,,,,,,,,,
propn aux verb adj,,,,,,,,,,,,
propn aux verb adp,,,,,,,,,,,,
propn aux verb adv,,,,,,,,,,,,
propn aux verb det,,,,,,,,,,,,
propn aux verb emoji,,,,,,,,,,,,
propn aux verb noun,,,,,,,,,,,,
propn aux verb pron,,,,,,,,,,,,
propn aux verb propn,,,,,,,,,,,,
propn aux verb punct,,,,,,,,,,,,
propn aux verb verb,,,,,,,,,,,,
propn cconj,,,,,,,,,,,,
propn cconj adj,,,,,,,,,,,,
propn cconj adj adp,,,,,,,,,,,,
propn cconj adj noun,,,,,,,,,,,,
propn cconj adj punct,,,,,,,,,,,,
propn cconj adp,,,,,,,,,,,,
propn cconj adp adj,,,,,,,,,,,,
propn cconj adv,,,,,,,,,,,,
propn cconj adv aux,,,,,,,,,,,,
propn cconj adv det,,,,,,,,,,,,
propn cconj adv verb,,,,,,,,,,,,
propn cconj aux,,,,,,,,,,,,
propn cconj aux pron,,,,,,,,,,,,
propn cconj intj,,,,,,,,,,,,
propn cconj intj pron,,,,,,,,,,,,
propn cconj noun,,,,,,,,,,,,
propn cconj noun aux,,,,,,,,,,,,
propn cconj noun cconj,,,,,,,,,,,,
propn cconj noun verb,,,,,,,,,,,,
propn cconj pron,,,,,,,,,,,,
propn cconj pron aux,,,,,,,,,,,,
propn cconj pron noun,,,,,,,,,,,,
propn cconj pron propn,,,,,,,,,,,,
propn cconj pron verb,,,,,,,,,,,,
propn cconj propn,,,,,,,,,,,,
propn cconj propn adp,,,,,,,,,,,,
propn cconj propn adv,,,,,,,,,,,,
propn cconj propn aux,,,,,,,,,,,,
propn cconj propn cconj,,,,,,,,,,,,
propn cconj propn det,,,,,,,,,,,,
propn cconj propn noun,,,,,,,,,,,,
propn cconj propn pron,,,,,,,,,,,,
propn cconj propn propn,,,,,,,,,,,,
propn cconj propn punct,,,,,,,,,,,,
propn cconj propn verb,,,,,,,,,,,,
propn cconj verb,,,,,,,,,,,,
propn cconj verb adp,,,,,,,,,,,,
propn cconj verb adv,,,,,,,,,,,,
propn cconj verb noun,,,,,,,,,,,,
propn cconj verb num,,,,,,,,,,,,
propn cconj verb pron,,,,,,,,,,,,
propn cconj verb punct,,,,,,,,,,,,
propn cconj verb verb,,,,,,,,,,,,
propn det,1.0,0.0,-0.20000000000000007,0.704,-0.20000000000000007,0.704,-0.20000000000000007,0.704,-0.20000000000000007,0.704,-0.20000000000000007,0.704
propn det adj,,,,,,,,,,,,
propn det adj adv,,,,,,,,,,,,
propn det adj noun,,,,,,,,,,,,
propn det adj num,,,,,,,,,,,,
propn det adj punct,,,,,,,,,,,,
propn det aux,,,,,,,,,,,,
propn det aux adj,,,,,,,,,,,,
propn det aux adv,,,,,,,,,,,,
propn det aux det,,,,,,,,,,,,
propn det aux noun,,,,,,,,,,,,
propn det aux verb,,,,,,,,,,,,
propn det noun,1.0,0.0,-0.20000000000000007,0.704,-0.20000000000000007,0.704,-0.20000000000000007,0.704,-0.20000000000000007,0.704,-0.20000000000000007,0.704
propn det noun adp,,,,,,,,,,,,
propn det noun aux,,,,,,,,,,,,
propn det noun noun,,,,,,,,,,,,
propn det noun pron,,,,,,,,,,,,
propn det noun propn,,,,,,,,,,,,
propn det noun punct,,,,,,,,,,,,
propn det noun verb,,,,,,,,,,,,
propn det propn,,,,,,,,,,,,
propn det propn pron,,,,,,,,,,,,
propn det propn propn,,,,,,,,,,,,
propn det propn verb,,,,,,,,,,,,
propn det verb,,,,,,,,,,,,
propn det verb adj,,,,,,,,,,,,
propn det verb adp,,,,,,,,,,,,
propn det verb det,,,,,,,,,,,,
propn det verb num,,,,,,,,,,,,
propn det verb pron,,,,,,,,,,,,
propn emoji,,,,,,,,,,,,
propn emoji emoji,,,,,,,,,,,,
propn emoji emoji emoji,,,,,,,,,,,,
propn emoji punct,,,,,,,,,,,,
propn emoji punct adv,,,,,,,,,,,,
propn intj,,,,,,,,,,,,
propn intj adj,,,,,,,,,,,,
propn intj adj noun,,,,,,,,,,,,
propn intj aux,,,,,,,,,,,,
propn intj aux aux,,,,,,,,,,,,
propn intj cconj,,,,,,,,,,,,
propn intj cconj punct,,,,,,,,,,,,
propn intj det,,,,,,,,,,,,
propn intj det aux,,,,,,,,,,,,
propn intj det noun,,,,,,,,,,,,
propn intj emoji,,,,,,,,,,,,
propn intj emoji emoji,,,,,,,,,,,,
propn intj intj,,,,,,,,,,,,
propn intj intj punct,,,,,,,,,,,,
propn intj noun,,,,,,,,,,,,
propn intj noun noun,,,,,,,,,,,,
propn intj pron,,,,,,,,,,,,
propn intj pron aux,,,,,,,,,,,,
propn intj pron noun,,,,,,,,,,,,
propn intj pron verb,,,,,,,,,,,,
propn intj propn,,,,,,,,,,,,
propn intj propn punct,,,,,,,,,,,,
propn intj punct,,,,,,,,,,,,
propn intj punct adv,,,,,,,,,,,,
propn intj punct pron,,,,,,,,,,,,
propn intj punct verb,,,,,,,,,,,,
propn intj verb,,,,,,,,,,,,
propn intj verb pron,,,,,,,,,,,,
propn noun,0.46475800154489,0.3530568618495133,-0.3098386676965934,0.5501142545045465,-0.3098386676965934,0.5501142545045465,-0.3098386676965934,0.5501142545045465,0.7745966692414834,0.07048399691021993,-0.3098386676965934,0.5501142545045465
propn noun adj,,,,,,,,,,,,
propn noun adj noun,,,,,,,,,,,,
propn noun adj propn,,,,,,,,,,,,
propn noun adp,,,,,,,,,,,,
propn noun adp adp,,,,,,,,,,,,
propn noun adp det,,,,,,,,,,,,
propn noun adp noun,,,,,,,,,,,,
propn noun adp pron,,,,,,,,,,,,
propn noun adp propn,,,,,,,,,,,,
propn noun adp punct,,,,,,,,,,,,
propn noun adv,,,,,,,,,,,,
propn noun adv pron,,,,,,,,,,,,
propn noun adv punct,,,,,,,,,,,,
propn noun aux,,,,,,,,,,,,
propn noun aux adj,,,,,,,,,,,,
propn noun aux aux,,,,,,,,,,,,
propn noun aux det,,,,,,,,,,,,
propn noun aux noun,,,,,,,,,,,,
propn noun aux pron,,,,,,,,,,,,
propn noun aux propn,,,,,,,,,,,,
propn noun aux verb,,,,,,,,,,,,
propn noun cconj,,,,,,,,,,,,
propn noun cconj noun,,,,,,,,,,,,
propn noun cconj pron,,,,,,,,,,,,
propn noun cconj propn,,,,,,,,,,,,
propn noun cconj verb,,,,,,,,,,,,
propn noun det,,,,,,,,,,,,
propn noun det adj,,,,,,,,,,,,
propn noun det aux,,,,,,,,,,,,
propn noun det noun,,,,,,,,,,,,
propn noun emoji,,,,,,,,,,,,
propn noun emoji emoji,,,,,,,,,,,,
propn noun noun,,,,,,,,,,,,
propn noun noun noun,,,,,,,,,,,,
propn noun noun pron,,,,,,,,,,,,
propn noun noun propn,,,,,,,,,,,,
propn noun noun punct,,,,,,,,,,,,
propn noun num,,,,,,,,,,,,
propn noun num noun,,,,,,,,,,,,
propn noun pron,,,,,,,,,,,,
propn noun pron aux,,,,,,,,,,,,
propn noun pron verb,,,,,,,,,,,,
propn noun propn,,,,,,,,,,,,
propn noun propn verb,,,,,,,,,,,,
propn noun punct,,,,,,,,,,,,
propn noun punct adp,,,,,,,,,,,,
propn noun punct adv,,,,,,,,,,,,
propn noun punct det,,,,,,,,,,,,
propn noun punct emoji,,,,,,,,,,,,
propn noun punct noun,,,,,,,,,,,,
propn noun punct pron,,,,,,,,,,,,
propn noun punct propn,,,,,,,,,,,,
propn noun punct punct,,,,,,,,,,,,
propn noun punct verb,,,,,,,,,,,,
propn noun sconj,,,,,,,,,,,,
propn noun sconj det,,,,,,,,,,,,
propn noun sconj pron,,,,,,,,,,,,
propn noun verb,,,,,,,,,,,,
propn noun verb adv,,,,,,,,,,,,
propn noun verb det,,,,,,,,,,,,
propn noun verb pron,,,,,,,,,,,,
propn noun verb propn,,,,,,,,,,,,
propn noun verb verb,,,,,,,,,,,,
propn num,-0.20000000000000007,0.704,1.0,0.0,-0.20000000000000007,0.704,-0.20000000000000007,0.704,-0.20000000000000007,0.704,-0.20000000000000007,0.704
propn num adv,,,,,,,,,,,,
propn num adv emoji,,,,,,,,,,,,
propn num adv punct,,,,,,,,,,,,
propn num aux,,,,,,,,,,,,
propn num aux adj,,,,,,,,,,,,
propn num aux pron,,,,,,,,,,,,
propn num det,,,,,,,,,,,,
propn num det adj,,,,,,,,,,,,
propn num emoji,,,,,,,,,,,,
propn num noun,,,,,,,,,,,,
propn num noun adv,,,,,,,,,,,,
propn num noun pron,,,,,,,,,,,,
propn num noun punct,,,,,,,,,,,,
propn num propn,,,,,,,,,,,,
propn num propn noun,,,,,,,,,,,,
propn num punct,,,,,,,,,,,,
propn num sconj,,,,,,,,,,,,
propn num sconj pron,,,,,,,,,,,,
propn pron,0.7745966692414834,0.07048399691021993,-0.3098386676965934,0.5501142545045465,-0.3098386676965934,0.5501142545045465,-0.3098386676965934,0.5501142545045465,0.46475800154489,0.3530568618495133,-0.3098386676965934,0.5501142545045465
propn pron adj,,,,,,,,,,,,
propn pron adj noun,,,,,,,,,,,,
propn pron adj pron,,,,,,,,,,,,
propn pron adp,,,,,,,,,,,,
propn pron adp punct,,,,,,,,,,,,
propn pron adv,,,,,,,,,,,,
propn pron adv verb,,,,,,,,,,,,
propn pron aux,0.632455532033676,0.1778078083562211,-0.316227766016838,0.5414697392755848,-0.316227766016838,0.5414697392755848,-0.316227766016838,0.5414697392755848,0.632455532033676,0.1778078083562211,-0.316227766016838,0.5414697392755848
propn pron aux adj,,,,,,,,,,,,
propn pron aux adp,,,,,,,,,,,,
propn pron aux adv,0.632455532033676,0.1778078083562211,-0.316227766016838,0.5414697392755848,-0.316227766016838,0.5414697392755848,-0.316227766016838,0.5414697392755848,0.632455532033676,0.1778078083562211,-0.316227766016838,0.5414697392755848
propn pron aux det,,,,,,,,,,,,
propn pron aux noun,,,,,,,,,,,,
propn pron aux num,,,,,,,,,,,,
propn pron aux pron,,,,,,,,,,,,
propn pron aux propn,,,,,,,,,,,,
propn pron aux verb,0.632455532033676,0.1778078083562211,-0.316227766016838,0.5414697392755848,-0.316227766016838,0.5414697392755848,-0.316227766016838,0.5414697392755848,0.632455532033676,0.1778078083562211,-0.316227766016838,0.5414697392755848
propn pron det,,,,,,,,,,,,
propn pron det noun,,,,,,,,,,,,
propn pron det pron,,,,,,,,,,,,
propn pron noun,,,,,,,,,,,,
propn pron noun adv,,,,,,,,,,,,
propn pron noun aux,,,,,,,,,,,,
propn pron noun cconj,,,,,,,,,,,,
propn pron noun pron,,,,,,,,,,,,
propn pron propn,,,,,,,,,,,,
propn pron propn cconj,,,,,,,,,,,,
propn pron propn noun,,,,,,,,,,,,
propn pron propn propn,,,,,,,,,,,,
propn pron propn verb,,,,,,,,,,,,
propn pron punct,,,,,,,,,,,,
propn pron punct punct,,,,,,,,,,,,
propn pron verb,1.0,0.0,-0.20000000000000007,0.704,-0.20000000000000007,0.704,-0.20000000000000007,0.704,-0.20000000000000007,0.704,-0.20000000000000007,0.704
propn pron verb adj,,,,,,,,,,,,
propn pron verb adp,1.0,0.0,-0.20000000000000007,0.704,-0.20000000000000007,0.704,-0.20000000000000007,0.704,-0.20000000000000007,0.704,-0.20000000000000007,0.704
propn pron verb adv,,,,,,,,,,,,
propn pron verb aux,,,,,,,,,,,,
propn pron verb det,1.0,0.0,-0.20000000000000007,0.704,-0.20000000000000007,0.704,-0.20000000000000007,0.704,-0.20000000000000007,0.704,-0.20000000000000007,0.704
propn pron verb noun,,,,,,,,,,,,
propn pron verb num,,,,,,,,,,,,
propn pron verb pron,,,,,,,,,,,,
propn pron verb propn,,,,,,,,,,,,
propn pron verb punct,,,,,,,,,,,,
propn pron verb sconj,,,,,,,,,,,,
propn pron verb verb,,,,,,,,,,,,
propn propn,0.674199862463242,0.14192744777405547,0.40451991747794525,0.42631720794036876,-0.5393598899705937,0.2694125126761958,-0.5393598899705937,0.2694125126761958,0.0,1.0,0.0,1.0
propn propn adj,,,,,,,,,,,,
propn propn adj noun,,,,,,,,,,,,
propn propn adj propn,,,,,,,,,,,,
propn propn adp,,,,,,,,,,,,
propn propn adp adv,,,,,,,,,,,,
propn propn adp det,,,,,,,,,,,,
propn propn adp noun,,,,,,,,,,,,
propn propn adp pron,,,,,,,,,,,,
propn propn adp propn,,,,,,,,,,,,
propn propn adv,,,,,,,,,,,,
propn propn adv adj,,,,,,,,,,,,
propn propn adv adp,,,,,,,,,,,,
propn propn adv det,,,,,,,,,,,,
propn propn adv emoji,,,,,,,,,,,,
propn propn adv pron,,,,,,,,,,,,
propn propn adv propn,,,,,,,,,,,,
propn propn adv punct,,,,,,,,,,,,
propn propn adv verb,,,,,,,,,,,,
propn propn aux,,,,,,,,,,,,
propn propn aux adj,,,,,,,,,,,,
propn propn aux adp,,,,,,,,,,,,
propn propn aux aux,,,,,,,,,,,,
propn propn aux det,,,,,,,,,,,,
propn propn aux num,,,,,,,,,,,,
propn propn aux pron,,,,,,,,,,,,
propn propn aux propn,,,,,,,,,,,,
propn propn aux sconj,,,,,,,,,,,,
propn propn aux verb,,,,,,,,,,,,
propn propn cconj,,,,,,,,,,,,
propn propn cconj adj,,,,,,,,,,,,
propn propn cconj adv,,,,,,,,,,,,
propn propn cconj aux,,,,,,,,,,,,
propn propn cconj pron,,,,,,,,,,,,
propn propn cconj propn,,,,,,,,,,,,
propn propn cconj verb,,,,,,,,,,,,
propn propn det,,,,,,,,,,,,
propn propn det adj,,,,,,,,,,,,
propn propn det noun,,,,,,,,,,,,
propn propn det propn,,,,,,,,,,,,
propn propn emoji,,,,,,,,,,,,
propn propn emoji emoji,,,,,,,,,,,,
propn propn intj,,,,,,,,,,,,
propn propn intj adj,,,,,,,,,,,,
propn propn intj aux,,,,,,,,,,,,
propn propn intj emoji,,,,,,,,,,,,
propn propn intj intj,,,,,,,,,,,,
propn propn intj pron,,,,,,,,,,,,
propn propn intj propn,,,,,,,,,,,,
propn propn intj punct,,,,,,,,,,,,
propn propn intj verb,,,,,,,,,,,,
propn propn noun,,,,,,,,,,,,
propn propn noun adp,,,,,,,,,,,,
propn propn noun adv,,,,,,,,,,,,
propn propn noun aux,,,,,,,,,,,,
propn propn noun emoji,,,,,,,,,,,,
propn propn noun noun,,,,,,,,,,,,
propn propn noun punct,,,,,,,,,,,,
propn propn noun verb,,,,,,,,,,,,
propn propn num,-0.20000000000000007,0.704,1.0,0.0,-0.20000000000000007,0.704,-0.20000000000000007,0.704,-0.20000000000000007,0.704,-0.20000000000000007,0.704
propn propn num aux,,,,,,,,,,,,
propn propn num noun,,,,,,,,,,,,
propn propn num punct,,,,,,,,,,,,
propn propn num sconj,,,,,,,,,,,,
propn propn pron,1.0,0.0,-0.20000000000000007,0.704,-0.20000000000000007,0.704,-0.20000000000000007,0.704,-0.20000000000000007,0.704,-0.20000000000000007,0.704
propn propn pron aux,,,,,,,,,,,,
propn propn pron det,,,,,,,,,,,,
propn propn pron propn,,,,,,,,,,,,
propn propn pron verb,1.0,0.0,-0.20000000000000007,0.704,-0.20000000000000007,0.704,-0.20000000000000007,0.704,-0.20000000000000007,0.704,-0.20000000000000007,0.704
propn propn propn,,,,,,,,,,,,
propn propn propn adp,,,,,,,,,,,,
propn propn propn adv,,,,,,,,,,,,
propn propn propn cconj,,,,,,,,,,,,
propn propn propn emoji,,,,,,,,,,,,
propn propn propn intj,,,,,,,,,,,,
propn propn propn noun,,,,,,,,,,,,
propn propn propn pron,,,,,,,,,,,,
propn propn propn propn,,,,,,,,,,,,
propn propn propn punct,,,,,,,,,,,,
propn propn propn verb,,,,,,,,,,,,
propn propn punct,-0.20000000000000007,0.704,1.0,0.0,-0.20000000000000007,0.704,-0.20000000000000007,0.704,-0.20000000000000007,0.704,-0.20000000000000007,0.704
propn propn punct adv,,,,,,,,,,,,
propn propn punct aux,,,,,,,,,,,,
propn propn punct cconj,,,,,,,,,,,,
propn propn punct det,,,,,,,,,,,,
propn propn punct emoji,,,,,,,,,,,,
propn propn punct intj,,,,,,,,,,,,
propn propn punct noun,,,,,,,,,,,,
propn propn punct num,,,,,,,,,,,,
propn propn punct pron,,,,,,,,,,,,
propn propn punct propn,-0.20000000000000007,0.704,1.0,0.0,-0.20000000000000007,0.704,-0.20000000000000007,0.704,-0.20000000000000007,0.704,-0.20000000000000007,0.704
propn propn punct punct,-0.20000000000000007,0.704,1.0,0.0,-0.20000000000000007,0.704,-0.20000000000000007,0.704,-0.20000000000000007,0.704,-0.20000000000000007,0.704
propn propn punct sconj,,,,,,,,,,,,
propn propn punct verb,,,,,,,,,,,,
propn propn sconj,,,,,,,,,,,,
propn propn sconj pron,,,,,,,,,,,,
propn propn sym,,,,,,,,,,,,
propn propn sym num,,,,,,,,,,,,
propn propn verb,0.4472135954999579,0.373900966300059,-0.4472135954999579,0.373900966300059,-0.4472135954999579,0.373900966300059,-0.4472135954999579,0.373900966300059,0.4472135954999579,0.373900966300059,0.4472135954999579,0.373900966300059
propn propn verb adj,,,,,,,,,,,,
propn propn verb adp,0.4472135954999579,0.373900966300059,-0.4472135954999579,0.373900966300059,-0.4472135954999579,0.373900966300059,-0.4472135954999579,0.373900966300059,0.4472135954999579,0.373900966300059,0.4472135954999579,0.373900966300059
propn propn verb adv,,,,,,,,,,,,
propn propn verb det,,,,,,,,,,,,
propn propn verb noun,,,,,,,,,,,,
propn propn verb num,,,,,,,,,,,,
propn propn verb pron,,,,,,,,,,,,
propn propn verb propn,,,,,,,,,,,,
propn propn verb punct,,,,,,,,,,,,
propn propn verb verb,,,,,,,,,,,,
propn punct,0.41736500618415145,0.4103036364236828,0.6956083436402525,0.12487982574290808,-0.41736500618415145,0.4103036364236828,-0.41736500618415145,0.4103036364236828,-0.41736500618415145,0.4103036364236828,0.1391216687280505,0.7926638356375505
propn punct adj,,,,,,,,,,,,
propn punct adj noun,,,,,,,,,,,,
propn punct adj punct,,,,,,,,,,,,
propn punct adv,,,,,,,,,,,,
propn punct adv adj,,,,,,,,,,,,
propn punct adv aux,,,,,,,,,,,,
propn punct adv emoji,,,,,,,,,,,,
propn punct adv pron,,,,,,,,,,,,
propn punct adv propn,,,,,,,,,,,,
propn punct adv punct,,,,,,,,,,,,
propn punct adv sconj,,,,,,,,,,,,
propn punct adv verb,,,,,,,,,,,,
propn punct aux,,,,,,,,,,,,
propn punct aux pron,,,,,,,,,,,,
propn punct aux verb,,,,,,,,,,,,
propn punct cconj,,,,,,,,,,,,
propn punct cconj det,,,,,,,,,,,,
propn punct cconj pron,,,,,,,,,,,,
propn punct det,,,,,,,,,,,,
propn punct det adp,,,,,,,,,,,,
propn punct det aux,,,,,,,,,,,,
propn punct det noun,,,,,,,,,,,,
propn punct det propn,,,,,,,,,,,,
propn punct emoji,,,,,,,,,,,,
propn punct emoji aux,,,,,,,,,,,,
propn punct emoji emoji,,,,,,,,,,,,
propn punct intj,,,,,,,,,,,,
propn punct intj punct,,,,,,,,,,,,
propn punct noun,,,,,,,,,,,,
propn punct noun adj,,,,,,,,,,,,
propn punct noun aux,,,,,,,,,,,,
propn punct noun punct,,,,,,,,,,,,
propn punct noun verb,,,,,,,,,,,,
propn punct num,,,,,,,,,,,,
propn punct num noun,,,,,,,,,,,,
propn punct pron,-0.20000000000000007,0.704,-0.20000000000000007,0.704,-0.20000000000000007,0.704,-0.20000000000000007,0.704,-0.20000000000000007,0.704,1.0,0.0
propn punct pron adj,,,,,,,,,,,,
propn punct pron adv,,,,,,,,,,,,
