noun pron noun adv,,,,,,,,,,,,
noun pron noun aux,,,,,,,,,,,,
noun pron noun emoji,,,,,,,,,,,,
noun pron noun noun,,,,,,,,,,,,
noun pron noun pron,,,,,,,,,,,,
noun pron noun punct,,,,,,,,,,,,
noun pron noun sconj,,,,,,,,,,,,
noun pron noun verb,,,,,,,,,,,,
noun pron num,,,,,,,,,,,,
noun pron num punct,,,,,,,,,,,,
noun pron propn,,,,,,,,,,,,
noun pron punct,,,,,,,,,,,,
noun pron punct det,,,,,,,,,,,,
noun pron punct punct,,,,,,,,,,,,
noun pron verb,,,,,,,,,,,,
noun pron verb adj,,,,,,,,,,,,
noun pron verb adp,,,,,,,,,,,,
noun pron verb adv,,,,,,,,,,,,
noun pron verb aux,,,,,,,,,,,,
noun pron verb det,,,,,,,,,,,,
noun pron verb noun,,,,,,,,,,,,
noun pron verb num,,,,,,,,,,,,
noun pron verb pron,,,,,,,,,,,,
noun pron verb propn,,,,,,,,,,,,
noun pron verb punct,,,,,,,,,,,,
noun pron verb verb,,,,,,,,,,,,
noun propn,0.13284223283101432,0.8019087881019875,-0.13284223283101432,0.8019087881019875,-0.5313689313240573,0.27796339331848685,0.3985266984930429,0.43385766067017734,0.6642111641550715,0.15020042233101136,-0.5313689313240573,0.27796339331848685
noun propn adj,,,,,,,,,,,,
noun propn adj propn,,,,,,,,,,,,
noun propn adp,,,,,,,,,,,,
noun propn adp det,,,,,,,,,,,,
noun propn adp pron,,,,,,,,,,,,
noun propn adp propn,,,,,,,,,,,,
noun propn adv,,,,,,,,,,,,
noun propn adv adv,,,,,,,,,,,,
noun propn adv aux,,,,,,,,,,,,
noun propn adv cconj,,,,,,,,,,,,
noun propn adv verb,,,,,,,,,,,,
noun propn aux,,,,,,,,,,,,
noun propn aux pron,,,,,,,,,,,,
noun propn emoji,,,,,,,,,,,,
noun propn emoji emoji,,,,,,,,,,,,
noun propn noun,1.0,0.0,-0.20000000000000007,0.704,-0.20000000000000007,0.704,-0.20000000000000007,0.704,-0.20000000000000007,0.704,-0.20000000000000007,0.704
noun propn noun noun,,,,,,,,,,,,
noun propn noun num,,,,,,,,,,,,
noun propn noun pron,,,,,,,,,,,,
noun propn noun punct,,,,,,,,,,,,
noun propn pron,,,,,,,,,,,,
noun propn pron aux,,,,,,,,,,,,
noun propn propn,-0.20000000000000007,0.704,1.0,0.0,-0.20000000000000007,0.704,-0.20000000000000007,0.704,-0.20000000000000007,0.704,-0.20000000000000007,0.704
noun propn propn adj,,,,,,,,,,,,
noun propn propn num,-0.20000000000000007,0.704,1.0,0.0,-0.20000000000000007,0.704,-0.20000000000000007,0.704,-0.20000000000000007,0.704,-0.20000000000000007,0.704
noun propn propn propn,,,,,,,,,,,,
noun propn propn punct,,,,,,,,,,,,
noun propn punct,,,,,,,,,,,,
noun propn punct adv,,,,,,,,,,,,
noun propn punct det,,,,,,,,,,,,
noun propn punct pron,,,,,,,,,,,,
noun propn punct punct,,,,,,,,,,,,
noun propn verb,,,,,,,,,,,,
noun propn verb adj,,,,,,,,,,,,
noun propn verb pron,,,,,,,,,,,,
noun propn verb punct,,,,,,,,,,,,
noun propn verb verb,,,,,,,,,,,,
noun punct,0.13284223283101432,0.8019087881019875,0.3985266984930429,0.43385766067017734,-0.5313689313240573,0.27796339331848685,-0.5313689313240573,0.27796339331848685,0.6642111641550715,0.15020042233101136,-0.13284223283101432,0.8019087881019875
noun punct adj,,,,,,,,,,,,
noun punct adj emoji,,,,,,,,,,,,
noun punct adj noun,,,,,,,,,,,,
noun punct adj punct,,,,,,,,,,,,
noun punct adj verb,,,,,,,,,,,,
noun punct adp,,,,,,,,,,,,
noun punct adp det,,,,,,,,,,,,
noun punct adp noun,,,,,,,,,,,,
noun punct adp propn,,,,,,,,,,,,
noun punct adv,,,,,,,,,,,,
noun punct adv adj,,,,,,,,,,,,
noun punct adv adv,,,,,,,,,,,,
noun punct adv det,,,,,,,,,,,,
noun punct adv noun,,,,,,,,,,,,
noun punct adv pron,,,,,,,,,,,,
noun punct adv propn,,,,,,,,,,,,
noun punct adv punct,,,,,,,,,,,,
noun punct adv sconj,,,,,,,,,,,,
noun punct adv verb,,,,,,,,,,,,
noun punct aux,,,,,,,,,,,,
noun punct aux noun,,,,,,,,,,,,
noun punct aux pron,,,,,,,,,,,,
noun punct aux propn,,,,,,,,,,,,
noun punct aux sconj,,,,,,,,,,,,
noun punct aux verb,,,,,,,,,,,,
noun punct cconj,,,,,,,,,,,,
noun punct cconj adv,,,,,,,,,,,,
noun punct cconj det,,,,,,,,,,,,
noun punct cconj pron,,,,,,,,,,,,
noun punct cconj verb,,,,,,,,,,,,
noun punct det,,,,,,,,,,,,
noun punct det adj,,,,,,,,,,,,
noun punct det adp,,,,,,,,,,,,
noun punct det aux,,,,,,,,,,,,
noun punct det noun,,,,,,,,,,,,
noun punct det propn,,,,,,,,,,,,
noun punct det verb,,,,,,,,,,,,
noun punct emoji,,,,,,,,,,,,
noun punct emoji adv,,,,,,,,,,,,
noun punct emoji pron,,,,,,,,,,,,
noun punct emoji propn,,,,,,,,,,,,
noun punct intj,,,,,,,,,,,,
noun punct intj pron,,,,,,,,,,,,
noun punct intj punct,,,,,,,,,,,,
noun punct intj verb,,,,,,,,,,,,
noun punct noun,,,,,,,,,,,,
noun punct noun adj,,,,,,,,,,,,
noun punct noun adp,,,,,,,,,,,,
noun punct noun aux,,,,,,,,,,,,
noun punct noun noun,,,,,,,,,,,,
noun punct noun pron,,,,,,,,,,,,
noun punct noun punct,,,,,,,,,,,,
noun punct noun sconj,,,,,,,,,,,,
noun punct noun verb,,,,,,,,,,,,
noun punct num,,,,,,,,,,,,
noun punct num noun,,,,,,,,,,,,
noun punct pron,0.1391216687280505,0.7926638356375505,0.6956083436402525,0.12487982574290808,-0.41736500618415145,0.4103036364236828,-0.41736500618415145,0.4103036364236828,-0.41736500618415145,0.4103036364236828,0.41736500618415145,0.4103036364236828
noun punct pron adj,,,,,,,,,,,,
noun punct pron adv,,,,,,,,,,,,
noun punct pron aux,0.46475800154489,0.3530568618495133,-0.3098386676965934,0.5501142545045465,-0.3098386676965934,0.5501142545045465,-0.3098386676965934,0.5501142545045465,-0.3098386676965934,0.5501142545045465,0.7745966692414834,0.07048399691021993
noun punct pron det,,,,,,,,,,,,
noun punct pron noun,,,,,,,,,,,,
noun punct pron num,,,,,,,,,,,,
noun punct pron punct,,,,,,,,,,,,
noun punct pron verb,-0.20000000000000007,0.704,1.0,0.0,-0.20000000000000007,0.704,-0.20000000000000007,0.704,-0.20000000000000007,0.704,-0.20000000000000007,0.704
noun punct propn,,,,,,,,,,,,
noun punct propn aux,,,,,,,,,,,,
noun punct propn noun,,,,,,,,,,,,
noun punct propn pron,,,,,,,,,,,,
noun punct propn propn,,,,,,,,,,,,
noun punct propn punct,,,,,,,,,,,,
noun punct propn verb,,,,,,,,,,,,
noun punct punct,,,,,,,,,,,,
noun punct punct det,,,,,,,,,,,,
noun punct punct emoji,,,,,,,,,,,,
noun punct punct noun,,,,,,,,,,,,
noun punct punct pron,,,,,,,,,,,,
noun punct punct propn,,,,,,,,,,,,
noun punct punct punct,,,,,,,,,,,,
noun punct sconj,,,,,,,,,,,,
noun punct sconj noun,,,,,,,,,,,,
noun punct sconj pron,,,,,,,,,,,,
noun punct sym,,,,,,,,,,,,
noun punct sym aux,,,,,,,,,,,,
noun punct sym verb,,,,,,,,,,,,
noun punct verb,-0.20000000000000007,0.704,-0.20000000000000007,0.704,-0.20000000000000007,0.704,-0.20000000000000007,0.704,1.0,0.0,-0.20000000000000007,0.704
noun punct verb adj,-0.20000000000000007,0.704,-0.20000000000000007,0.704,-0.20000000000000007,0.704,-0.20000000000000007,0.704,1.0,0.0,-0.20000000000000007,0.704
noun punct verb adp,,,,,,,,,,,,
noun punct verb adv,,,,,,,,,,,,
noun punct verb cconj,,,,,,,,,,,,
noun punct verb det,,,,,,,,,,,,
noun punct verb intj,,,,,,,,,,,,
noun punct verb noun,,,,,,,,,,,,
noun punct verb pron,,,,,,,,,,,,
noun punct verb verb,,,,,,,,,,,,
noun sconj,0.7745966692414834,0.07048399691021993,-0.3098386676965934,0.5501142545045465,-0.3098386676965934,0.5501142545045465,-0.3098386676965934,0.5501142545045465,-0.3098386676965934,0.5501142545045465,0.46475800154489,0.3530568618495133
noun sconj adp,,,,,,,,,,,,
noun sconj adp adv,,,,,,,,,,,,
noun sconj adp det,,,,,,,,,,,,
noun sconj adp noun,,,,,,,,,,,,
noun sconj adp pron,,,,,,,,,,,,
noun sconj cconj,,,,,,,,,,,,
noun sconj cconj pron,,,,,,,,,,,,
noun sconj det,,,,,,,,,,,,
noun sconj det adj,,,,,,,,,,,,
noun sconj det aux,,,,,,,,,,,,
noun sconj det noun,,,,,,,,,,,,
noun sconj intj,,,,,,,,,,,,
noun sconj intj noun,,,,,,,,,,,,
noun sconj noun,,,,,,,,,,,,
noun sconj noun adv,,,,,,,,,,,,
noun sconj noun verb,,,,,,,,,,,,
noun sconj num,1.0,0.0,-0.20000000000000007,0.704,-0.20000000000000007,0.704,-0.20000000000000007,0.704,-0.20000000000000007,0.704,-0.20000000000000007,0.704
noun sconj pron,0.7745966692414834,0.07048399691021993,-0.3098386676965934,0.5501142545045465,-0.3098386676965934,0.5501142545045465,-0.3098386676965934,0.5501142545045465,-0.3098386676965934,0.5501142545045465,0.46475800154489,0.3530568618495133
noun sconj pron adj,,,,,,,,,,,,
noun sconj pron adp,,,,,,,,,,,,
noun sconj pron aux,-0.20000000000000007,0.704,-0.20000000000000007,0.704,-0.20000000000000007,0.704,-0.20000000000000007,0.704,-0.20000000000000007,0.704,1.0,0.0
noun sconj pron det,,,,,,,,,,,,
noun sconj pron noun,,,,,,,,,,,,
noun sconj pron num,,,,,,,,,,,,
noun sconj pron verb,1.0,0.0,-0.20000000000000007,0.704,-0.20000000000000007,0.704,-0.20000000000000007,0.704,-0.20000000000000007,0.704,-0.20000000000000007,0.704
noun sconj propn,,,,,,,,,,,,
noun sconj propn adv,,,,,,,,,,,,
noun sconj propn aux,,,,,,,,,,,,
noun sconj propn cconj,,,,,,,,,,,,
noun sconj propn verb,,,,,,,,,,,,
noun sconj verb,,,,,,,,,,,,
noun sconj verb punct,,,,,,,,,,,,
noun sym,,,,,,,,,,,,
noun sym adj,,,,,,,,,,,,
noun sym adj emoji,,,,,,,,,,,,
noun sym propn,,,,,,,,,,,,
noun sym propn noun,,,,,,,,,,,,
noun verb,0.6642111641550715,0.15020042233101136,-0.5313689313240573,0.27796339331848685,-0.13284223283101432,0.8019087881019875,-0.5313689313240573,0.27796339331848685,0.3985266984930429,0.43385766067017734,0.13284223283101432,0.8019087881019875
noun verb adj,,,,,,,,,,,,
noun verb adj adp,,,,,,,,,,,,
noun verb adj adv,,,,,,,,,,,,
noun verb adj noun,,,,,,,,,,,,
noun verb adj pron,,,,,,,,,,,,
noun verb adj punct,,,,,,,,,,,,
noun verb adj verb,,,,,,,,,,,,
noun verb adp,-0.20000000000000007,0.704,-0.20000000000000007,0.704,1.0,0.0,-0.20000000000000007,0.704,-0.20000000000000007,0.704,-0.20000000000000007,0.704
noun verb adp adj,,,,,,,,,,,,
noun verb adp adp,,,,,,,,,,,,
noun verb adp adv,,,,,,,,,,,,
noun verb adp aux,,,,,,,,,,,,
noun verb adp det,-0.20000000000000007,0.704,-0.20000000000000007,0.704,1.0,0.0,-0.20000000000000007,0.704,-0.20000000000000007,0.704,-0.20000000000000007,0.704
noun verb adp noun,,,,,,,,,,,,
noun verb adp num,,,,,,,,,,,,
noun verb adp pron,,,,,,,,,,,,
noun verb adp propn,,,,,,,,,,,,
noun verb adp punct,,,,,,,,,,,,
noun verb adp verb,,,,,,,,,,,,
noun verb adv,,,,,,,,,,,,
noun verb adv adj,,,,,,,,,,,,
noun verb adv adp,,,,,,,,,,,,
noun verb adv adv,,,,,,,,,,,,
noun verb adv cconj,,,,,,,,,,,,
noun verb adv pron,,,,,,,,,,,,
noun verb adv propn,,,,,,,,,,,,
noun verb adv punct,,,,,,,,,,,,
noun verb adv sconj,,,,,,,,,,,,
noun verb adv verb,,,,,,,,,,,,
noun verb aux,,,,,,,,,,,,
noun verb aux adp,,,,,,,,,,,,
noun verb aux verb,,,,,,,,,,,,
noun verb cconj,,,,,,,,,,,,
noun verb cconj pron,,,,,,,,,,,,
noun verb cconj verb,,,,,,,,,,,,
noun verb det,-0.20000000000000007,0.704,-0.20000000000000007,0.704,-0.20000000000000007,0.704,-0.20000000000000007,0.704,1.0,0.0,-0.20000000000000007,0.704
noun verb det adj,,,,,,,,,,,,
noun verb det aux,,,,,,,,,,,,
noun verb det det,-0.20000000000000007,0.704,-0.20000000000000007,0.704,-0.20000000000000007,0.704,-0.20000000000000007,0.704,1.0,0.0,-0.20000000000000007,0.704
noun verb det noun,,,,,,,,,,,,
noun verb det punct,,,,,,,,,,,,
noun verb emoji,,,,,,,,,,,,
noun verb emoji emoji,,,,,,,,,,,,
noun verb intj,,,,,,,,,,,,
noun verb intj propn,,,,,,,,,,,,
noun verb noun,0.46475800154489,0.3530568618495133,-0.3098386676965934,0.5501142545045465,-0.3098386676965934,0.5501142545045465,-0.3098386676965934,0.5501142545045465,0.7745966692414834,0.07048399691021993,-0.3098386676965934,0.5501142545045465
noun verb noun adj,1.0,0.0,-0.20000000000000007,0.704,-0.20000000000000007,0.704,-0.20000000000000007,0.704,-0.20000000000000007,0.704,-0.20000000000000007,0.704
noun verb noun adp,,,,,,,,,,,,
noun verb noun adv,,,,,,,,,,,,
noun verb noun cconj,,,,,,,,,,,,
noun verb noun emoji,,,,,,,,,,,,
noun verb noun noun,,,,,,,,,,,,
noun verb noun pron,,,,,,,,,,,,
noun verb noun propn,-0.20000000000000007,0.704,-0.20000000000000007,0.704,-0.20000000000000007,0.704,-0.20000000000000007,0.704,1.0,0.0,-0.20000000000000007,0.704
noun verb noun punct,,,,,,,,,,,,
noun verb noun sconj,,,,,,,,,,,,
noun verb noun verb,,,,,,,,,,,,
noun verb num,,,,,,,,,,,,
noun verb num noun,,,,,,,,,,,,
noun verb pron,-0.20000000000000007,0.704,-0.20000000000000007,0.704,-0.20000000000000007,0.704,-0.20000000000000007,0.704,-0.20000000000000007,0.704,1.0,0.0
noun verb pron adj,,,,,,,,,,,,
noun verb pron adp,,,,,,,,,,,,
noun verb pron adv,,,,,,,,,,,,
noun verb pron aux,,,,,,,,,,,,
noun verb pron cconj,,,,,,,,,,,,
noun verb pron det,,,,,,,,,,,,
noun verb pron noun,,,,,,,,,,,,
noun verb pron pron,-0.20000000000000007,0.704,-0.20000000000000007,0.704,-0.20000000000000007,0.704,-0.20000000000000007,0.704,-0.20000000000000007,0.704,1.0,0.0
noun verb pron verb,-0.20000000000000007,0.704,-0.20000000000000007,0.704,-0.20000000000000007,0.704,-0.20000000000000007,0.704,-0.20000000000000007,0.704,1.0,0.0
noun verb propn,,,,,,,,,,,,
noun verb propn cconj,,,,,,,,,,,,
noun verb propn noun,,,,,,,,,,,,
noun verb propn pron,,,,,,,,,,,,
noun verb propn propn,,,,,,,,,,,,
noun verb propn punct,,,,,,,,,,,,
noun verb propn verb,,,,,,,,,,,,
noun verb punct,,,,,,,,,,,,
noun verb punct adj,,,,,,,,,,,,
noun verb punct adv,,,,,,,,,,,,
noun verb punct aux,,,,,,,,,,,,
noun verb punct noun,,,,,,,,,,,,
noun verb punct pron,,,,,,,,,,,,
noun verb punct propn,,,,,,,,,,,,
noun verb punct punct,,,,,,,,,,,,
noun verb punct verb,,,,,,,,,,,,
noun verb sconj,,,,,,,,,,,,
noun verb sconj pron,,,,,,,,,,,,
noun verb verb,,,,,,,,,,,,
noun verb verb adj,,,,,,,,,,,,
noun verb verb adp,,,,,,,,,,,,
noun verb verb adv,,,,,,,,,,,,
noun verb verb det,,,,,,,,,,,,
noun verb verb noun,,,,,,,,,,,,
noun verb verb num,,,,,,,,,,,,
noun verb verb propn,,,,,,,,,,,,
noun verb verb punct,,,,,,,,,,,,
noun verb verb verb,,,,,,,,,,,,
num,0.13284223283101432,0.8019087881019875,0.3985266984930429,0.43385766067017734,-0.5313689313240573,0.27796339331848685,-0.5313689313240573,0.27796339331848685,0.6642111641550715,0.15020042233101136,-0.13284223283101432,0.8019087881019875
num adj,,,,,,,,,,,,
num adj adp,,,,,,,,,,,,
num adj adp propn,,,,,,,,,,,,
num adj noun,,,,,,,,,,,,
num adj noun adp,,,,,,,,,,,,
num adj noun aux,,,,,,,,,,,,
num adj punct,,,,,,,,,,,,
num adj sconj,,,,,,,,,,,,
num adj sconj adj,,,,,,,,,,,,
num adp,-0.20000000000000007,0.704,1.0,0.0,-0.20000000000000007,0.704,-0.20000000000000007,0.704,-0.20000000000000007,0.704,-0.20000000000000007,0.704
num adp adv,,,,,,,,,,,,
num adp det,-0.20000000000000007,0.704,1.0,0.0,-0.20000000000000007,0.704,-0.20000000000000007,0.704,-0.20000000000000007,0.704,-0.20000000000000007,0.704
num adp det adj,-0.20000000000000007,0.704,1.0,0.0,-0.20000000000000007,0.704,-0.20000000000000007,0.704,-0.20000000000000007,0.704,-0.20000000000000007,0.704
num adp det adv,,,,,,,,,,,,
num adp det noun,,,,,,,,,,,,
num adp det num,,,,,,,,,,,,
num adp noun,,,,,,,,,,,,
num adp noun adp,,,,,,,,,,,,
num adp pron,,,,,,,,,,,,
num adp pron aux,,,,,,,,,,,,
num adp pron cconj,,,,,,,,,,,,
num adp pron emoji,,,,,,,,,,,,
num adp pron noun,,,,,,,,,,,,
num adp propn,,,,,,,,,,,,
num adp propn adj,,,,,,,,,,,,
num adp propn propn,,,,,,,,,,,,
num adp punct,,,,,,,,,,,,
num adv,,,,,,,,,,,,
num adv adp,,,,,,,,,,,,
num adv adp det,,,,,,,,,,,,
num adv adp num,,,,,,,,,,,,
num adv adp propn,,,,,,,,,,,,
num adv adv,,,,,,,,,,,,
num adv adv adv,,,,,,,,,,,,
num adv det,,,,,,,,,,,,
num adv det noun,,,,,,,,,,,,
num adv emoji,,,,,,,,,,,,
num adv emoji emoji,,,,,,,,,,,,
num adv pron,,,,,,,,,,,,
num adv pron verb,,,,,,,,,,,,
num adv punct,,,,,,,,,,,,
num adv punct punct,,,,,,,,,,,,
num aux,,,,,,,,,,,,
num aux adj,,,,,,,,,,,,
num aux adp,,,,,,,,,,,,
num aux adp det,,,,,,,,,,,,
num aux adv,,,,,,,,,,,,
num aux adv pron,,,,,,,,,,,,
num aux det,,,,,,,,,,,,
num aux det noun,,,,,,,,,,,,
num aux pron,,,,,,,,,,,,
num aux pron verb,,,,,,,,,,,,
num cconj,1.0,0.0,-0.20000000000000007,0.704,-0.20000000000000007,0.704,-0.20000000000000007,0.704,-0.20000000000000007,0.704,-0.20000000000000007,0.704
num cconj det,,,,,,,,,,,,
num cconj det adj,,,,,,,,,,,,
num cconj num,,,,,,,,,,,,
num cconj num noun,,,,,,,,,,,,
num cconj pron,1.0,0.0,-0.20000000000000007,0.704,-0.20000000000000007,0.704,-0.20000000000000007,0.704,-0.20000000000000007,0.704,-0.20000000000000007,0.704
num cconj pron verb,1.0,0.0,-0.20000000000000007,0.704,-0.20000000000000007,0.704,-0.20000000000000007,0.704,-0.20000000000000007,0.704,-0.20000000000000007,0.704
num det,,,,,,,,,,,,
num det adj,,,,,,,,,,,,
num det adj noun,,,,,,,,,,,,
num det aux,,,,,,,,,,,,
num det aux det,,,,,,,,,,,,
num det aux verb,,,,,,,,,,,,
num det noun,,,,,,,,,,,,
num det noun punct,,,,,,,,,,,,
num det verb,,,,,,,,,,,,
num det verb noun,,,,,,,,,,,,
num det verb pron,,,,,,,,,,,,
num emoji,,,,,,,,,,,,
num intj,,,,,,,,,,,,
num intj punct,,,,,,,,,,,,
num intj punct pron,,,,,,,,,,,,
num noun,-0.20000000000000007,0.704,-0.20000000000000007,0.704,-0.20000000000000007,0.704,-0.20000000000000007,0.704,1.0,0.0,-0.20000000000000007,0.704
num noun adj,,,,,,,,,,,,
num noun adj noun,,,,,,,,,,,,
num noun adj pron,,,,,,,,,,,,
num noun adj punct,,,,,,,,,,,,
num noun adj verb,,,,,,,,,,,,
num noun adp,,,,,,,,,,,,
num noun adp adp,,,,,,,,,,,,
num noun adp det,,,,,,,,,,,,
num noun adp intj,,,,,,,,,,,,
num noun adp noun,,,,,,,,,,,,
num noun adp pron,,,,,,,,,,,,
num noun adp verb,,,,,,,,,,,,
num noun adv,,,,,,,,,,,,
num noun adv adv,,,,,,,,,,,,
num noun adv aux,,,,,,,,,,,,
num noun adv cconj,,,,,,,,,,,,
num noun adv pron,,,,,,,,,,,,
num noun adv punct,,,,,,,,,,,,
num noun adv sconj,,,,,,,,,,,,
num noun cconj,,,,,,,,,,,,
num noun cconj adp,,,,,,,,,,,,
num noun cconj adv,,,,,,,,,,,,
num noun cconj det,,,,,,,,,,,,
num noun cconj num,,,,,,,,,,,,
num noun cconj pron,,,,,,,,,,,,
num noun cconj verb,,,,,,,,,,,,
num noun det,,,,,,,,,,,,
num noun det num,,,,,,,,,,,,
num noun det verb,,,,,,,,,,,,
num noun emoji,,,,,,,,,,,,
num noun emoji emoji,,,,,,,,,,,,
num noun noun,,,,,,,,,,,,
num noun noun adj,,,,,,,,,,,,
num noun noun cconj,,,,,,,,,,,,
num noun noun emoji,,,,,,,,,,,,
num noun noun noun,,,,,,,,,,,,
num noun noun pron,,,,,,,,,,,,
num noun noun punct,,,,,,,,,,,,
num noun noun verb,,,,,,,,,,,,
num noun pron,,,,,,,,,,,,
num noun pron aux,,,,,,,,,,,,
num noun pron noun,,,,,,,,,,,,
num noun pron verb,,,,,,,,,,,,
num noun propn,,,,,,,,,,,,
num noun punct,,,,,,,,,,,,
num noun punct adj,,,,,,,,,,,,
num noun punct adv,,,,,,,,,,,,
num noun punct noun,,,,,,,,,,,,
num noun punct pron,,,,,,,,,,,,
num noun punct propn,,,,,,,,,,,,
num noun punct punct,,,,,,,,,,,,
num noun punct sconj,,,,,,,,,,,,
num noun sconj,,,,,,,,,,,,
num noun sconj pron,,,,,,,,,,,,
num noun verb,,,,,,,,,,,,
num noun verb adp,,,,,,,,,,,,
num noun verb det,,,,,,,,,,,,
num noun verb punct,,,,,,,,,,,,
num num,,,,,,,,,,,,
num num noun,,,,,,,,,,,,
num num noun pron,,,,,,,,,,,,
num pron,0.632455532033676,0.1778078083562211,-0.316227766016838,0.5414697392755848,-0.316227766016838,0.5414697392755848,-0.316227766016838,0.5414697392755848,0.632455532033676,0.1778078083562211,-0.316227766016838,0.5414697392755848
num pron aux,,,,,,,,,,,,
num pron aux adp,,,,,,,,,,,,
num pron aux verb,,,,,,,,,,,,
num pron noun,,,,,,,,,,,,
num pron noun adv,,,,,,,,,,,,
num pron noun aux,,,,,,,,,,,,
num pron propn,0.632455532033676,0.1778078083562211,-0.316227766016838,0.5414697392755848,-0.316227766016838,0.5414697392755848,-0.316227766016838,0.5414697392755848,0.632455532033676,0.1778078083562211,-0.316227766016838,0.5414697392755848
num pron verb,,,,,,,,,,,,
num pron verb det,,,,,,,,,,,,
num propn,,,,,,,,,,,,
num propn noun,,,,,,,,,,,,
num propn noun aux,,,,,,,,,,,,
num propn noun noun,,,,,,,,,,,,
num propn noun punct,,,,,,,,,,,,
num propn propn,,,,,,,,,,,,
num propn propn noun,,,,,,,,,,,,
num punct,,,,,,,,,,,,
num punct adv,,,,,,,,,,,,
num punct adv adp,,,,,,,,,,,,
num punct adv aux,,,,,,,,,,,,
num punct adv pron,,,,,,,,,,,,
num punct emoji,,,,,,,,,,,,
num punct pron,,,,,,,,,,,,
num punct pron propn,,,,,,,,,,,,
num punct punct,,,,,,,,,,,,
num punct punct punct,,,,,,,,,,,,
num sconj,,,,,,,,,,,,
num sconj pron,,,,,,,,,,,,
num sconj pron noun,,,,,,,,,,,,
num sconj pron verb,,,,,,,,,,,,
num sym,,,,,,,,,,,,
num sym num,,,,,,,,,,,,
num sym num noun,,,,,,,,,,,,
num sym verb,,,,,,,,,,,,
num sym verb noun,,,,,,,,,,,,
num verb,,,,,,,,,,,,
num verb adv,,,,,,,,,,,,
num verb adv punct,,,,,,,,,,,,
num verb det,,,,,,,,,,,,
num verb det noun,,,,,,,,,,,,
num verb pron,,,,,,,,,,,,
num verb pron verb,,,,,,,,,,,,
pron,0.6546536707079772,0.15830242337545783,-0.13093073414159545,0.8047261622231061,-0.39279220242478635,0.4411128091213043,-0.6546536707079772,0.15830242337545783,0.39279220242478635,0.4411128091213043,0.13093073414159545,0.8047261622231061
pron adj,0.632455532033676,0.1778078083562211,-0.316227766016838,0.5414697392755848,-0.316227766016838,0.5414697392755848,-0.316227766016838,0.5414697392755848,0.632455532033676,0.1778078083562211,-0.316227766016838,0.5414697392755848
pron adj adj,,,,,,,,,,,,
pron adj adj noun,,,,,,,,,,,,
pron adj adp,,,,,,,,,,,,
pron adj adp det,,,,,,,,,,,,
pron adj adp noun,,,,,,,,,,,,
pron adj adp propn,,,,,,,,,,,,
pron adj adv,,,,,,,,,,,,
pron adj adv verb,,,,,,,,,,,,
pron adj cconj,,,,,,,,,,,,
pron adj cconj pron,,,,,,,,,,,,
pron adj cconj propn,,,,,,,,,,,,
pron adj cconj verb,,,,,,,,,,,,
pron adj det,,,,,,,,,,,,
pron adj det noun,,,,,,,,,,,,
pron adj noun,,,,,,,,,,,,
pron adj noun adp,,,,,,,,,,,,
pron adj noun aux,,,,,,,,,,,,
pron adj noun cconj,,,,,,,,,,,,
pron adj noun emoji,,,,,,,,,,,,
pron adj noun noun,,,,,,,,,,,,
pron adj noun pron,,,,,,,,,,,,
pron adj noun propn,,,,,,,,,,,,
pron adj noun punct,,,,,,,,,,,,
pron adj noun sconj,,,,,,,,,,,,
pron adj noun verb,,,,,,,,,,,,
pron adj num,,,,,,,,,,,,
pron adj num noun,,,,,,,,,,,,
pron adj pron,,,,,,,,,,,,
pron adj pron adv,,,,,,,,,,,,
pron adj pron noun,,,,,,,,,,,,
pron adj propn,,,,,,,,,,,,
pron adj propn punct,,,,,,,,,,,,
pron adj punct,,,,,,,,,,,,
pron adj punct noun,,,,,,,,,,,,
pron adj punct pron,,,,,,,,,,,,
pron adj punct punct,,,,,,,,,,,,
pron adj sconj,,,,,,,,,,,,
pron adj sconj adp,,,,,,,,,,,,
pron adj verb,,,,,,,,,,,,
pron adj verb adp,,,,,,,,,,,,
pron adj verb pron,,,,,,,,,,,,
pron adj verb propn,,,,,,,,,,,,
pron adp,0.6642111641550715,0.15020042233101136,-0.5313689313240573,0.27796339331848685,0.3985266984930429,0.43385766067017734,-0.5313689313240573,0.27796339331848685,0.13284223283101432,0.8019087881019875,-0.13284223283101432,0.8019087881019875
pron adp adj,,,,,,,,,,,,
pron adp adj det,,,,,,,,,,,,
pron adp adj noun,,,,,,,,,,,,
pron adp adj punct,,,,,,,,,,,,
pron adp adp,,,,,,,,,,,,
pron adp adp pron,,,,,,,,,,,,
pron adp adp propn,,,,,,,,,,,,
pron adp adv,0.632455532033676,0.1778078083562211,-0.316227766016838,0.5414697392755848,-0.316227766016838,0.5414697392755848,-0.316227766016838,0.5414697392755848,0.632455532033676,0.1778078083562211,-0.316227766016838,0.5414697392755848
pron adp adv adv,,,,,,,,,,,,
pron adp adv cconj,0.632455532033676,0.1778078083562211,-0.316227766016838,0.5414697392755848,-0.316227766016838,0.5414697392755848,-0.316227766016838,0.5414697392755848,0.632455532033676,0.1778078083562211,-0.316227766016838,0.5414697392755848
pron adp adv verb,,,,,,,,,,,,
pron adp cconj,,,,,,,,,,,,
pron adp cconj pron,,,,,,,,,,,,
pron adp cconj verb,,,,,,,,,,,,
pron adp det,-0.3098386676965934,0.5501142545045465,-0.3098386676965934,0.5501142545045465,0.7745966692414834,0.07048399691021993,-0.3098386676965934,0.5501142545045465,-0.3098386676965934,0.5501142545045465,0.46475800154489,0.3530568618495133
pron adp det adj,,,,,,,,,,,,
pron adp det det,,,,,,,,,,,,
pron adp det noun,-0.3098386676965934,0.5501142545045465,-0.3098386676965934,0.5501142545045465,0.7745966692414834,0.07048399691021993,-0.3098386676965934,0.5501142545045465,-0.3098386676965934,0.5501142545045465,0.46475800154489,0.3530568618495133
pron adp noun,,,,,,,,,,,,
pron adp noun adv,,,,,,,,,,,,
pron adp noun det,,,,,,,,,,,,
pron adp noun emoji,,,,,,,,,,,,
pron adp noun noun,,,,,,,,,,,,
pron adp noun num,,,,,,,,,,,,
pron adp noun verb,,,,,,,,,,,,
pron adp num,1.0,0.0,-0.20000000000000007,0.704,-0.20000000000000007,0.704,-0.20000000000000007,0.704,-0.20000000000000007,0.704,-0.20000000000000007,0.704
pron adp num adv,,,,,,,,,,,,
pron adp num cconj,1.0,0.0,-0.20000000000000007,0.704,-0.20000000000000007,0.704,-0.20000000000000007,0.704,-0.20000000000000007,0.704,-0.20000000000000007,0.704
pron adp num noun,,,,,,,,,,,,
pron adp pron,,,,,,,,,,,,
pron adp pron adj,,,,,,,,,,,,
pron adp pron adp,,,,,,,,,,,,
pron adp pron adv,,,,,,,,,,,,
pron adp pron noun,,,,,,,,,,,,
pron adp pron propn,,,,,,,,,,,,
pron adp pron punct,,,,,,,,,,,,
pron adp propn,,,,,,,,,,,,
pron adp propn noun,,,,,,,,,,,,
pron adp propn propn,,,,,,,,,,,,
pron adp punct,,,,,,,,,,,,
pron adp punct intj,,,,,,,,,,,,
pron adp punct pron,,,,,,,,,,,,
pron adp punct propn,,,,,,,,,,,,
pron adp punct punct,,,,,,,,,,,,
pron adp sconj,,,,,,,,,,,,
pron adp sconj pron,,,,,,,,,,,,
pron adp verb,,,,,,,,,,,,
pron adp verb adp,,,,,,,,,,,,
pron adp verb det,,,,,,,,,,,,
pron adp verb noun,,,,,,,,,,,,
pron adp verb pron,,,,,,,,,,,,
pron adv,0.7745966692414834,0.07048399691021993,-0.3098386676965934,0.5501142545045465,-0.3098386676965934,0.5501142545045465,-0.3098386676965934,0.5501142545045465,0.46475800154489,0.3530568618495133,-0.3098386676965934,0.5501142545045465
pron adv adj,,,,,,,,,,,,
pron adv adj adp,,,,,,,,,,,,
pron adv adj adv,,,,,,,,,,,,
pron adv adj cconj,,,,,,,,,,,,
pron adv adj noun,,,,,,,,,,,,
pron adv adj pron,,,,,,,,,,,,
pron adv adj sconj,,,,,,,,,,,,
pron adv adp,,,,,,,,,,,,
pron adv adp adj,,,,,,,,,,,,
pron adv adp adp,,,,,,,,,,,,
pron adv adp aux,,,,,,,,,,,,
pron adv adp det,,,,,,,,,,,,
pron adv adp noun,,,,,,,,,,,,
pron adv adp propn,,,,,,,,,,,,
pron adv adv,,,,,,,,,,,,
pron adv adv adj,,,,,,,,,,,,
pron adv adv adp,,,,,,,,,,,,
pron adv adv adv,,,,,,,,,,,,
pron adv adv noun,,,,,,,,,,,,
pron adv adv propn,,,,,,,,,,,,
pron adv adv punct,,,,,,,,,,,,
pron adv adv sconj,,,,,,,,,,,,
pron adv adv verb,,,,,,,,,,,,
pron adv aux,,,,,,,,,,,,
pron adv aux adj,,,,,,,,,,,,
pron adv aux pron,,,,,,,,,,,,
pron adv aux sconj,,,,,,,,,,,,
pron adv aux verb,,,,,,,,,,,,
pron adv cconj,,,,,,,,,,,,
pron adv cconj det,,,,,,,,,,,,
pron adv det,,,,,,,,,,,,
pron adv det adj,,,,,,,,,,,,
pron adv emoji,,,,,,,,,,,,
pron adv intj,,,,,,,,,,,,
pron adv noun,,,,,,,,,,,,
pron adv noun emoji,,,,,,,,,,,,
pron adv noun noun,,,,,,,,,,,,
pron adv noun punct,,,,,,,,,,,,
pron adv noun verb,,,,,,,,,,,,
pron adv pron,,,,,,,,,,,,
