aux noun verb pron,,,,,,,,,,,,
aux noun verb propn,,,,,,,,,,,,
aux noun verb punct,,,,,,,,,,,,
aux noun verb sconj,,,,,,,,,,,,
aux num,-0.20000000000000007,0.704,1.0,0.0,-0.20000000000000007,0.704,-0.20000000000000007,0.704,-0.20000000000000007,0.704,-0.20000000000000007,0.704
aux num adj,,,,,,,,,,,,
aux num adp,-0.20000000000000007,0.704,1.0,0.0,-0.20000000000000007,0.704,-0.20000000000000007,0.704,-0.20000000000000007,0.704,-0.20000000000000007,0.704
aux num adp det,-0.20000000000000007,0.704,1.0,0.0,-0.20000000000000007,0.704,-0.20000000000000007,0.704,-0.20000000000000007,0.704,-0.20000000000000007,0.704
aux num adp noun,,,,,,,,,,,,
aux num adp propn,,,,,,,,,,,,
aux num adv,,,,,,,,,,,,
aux num adv adp,,,,,,,,,,,,
aux num adv adv,,,,,,,,,,,,
aux num adv emoji,,,,,,,,,,,,
aux num adv punct,,,,,,,,,,,,
aux num noun,,,,,,,,,,,,
aux num noun adj,,,,,,,,,,,,
aux num noun adp,,,,,,,,,,,,
aux num noun adv,,,,,,,,,,,,
aux num noun cconj,,,,,,,,,,,,
aux num noun pron,,,,,,,,,,,,
aux num noun punct,,,,,,,,,,,,
aux num punct,,,,,,,,,,,,
aux num verb,,,,,,,,,,,,
aux pron,-0.3098386676965934,0.5501142545045465,-0.3098386676965934,0.5501142545045465,-0.3098386676965934,0.5501142545045465,-0.3098386676965934,0.5501142545045465,0.7745966692414834,0.07048399691021993,0.46475800154489,0.3530568618495133
aux pron adj,,,,,,,,,,,,
aux pron adj adv,,,,,,,,,,,,
aux pron adj noun,,,,,,,,,,,,
aux pron adj propn,,,,,,,,,,,,
aux pron adj punct,,,,,,,,,,,,
aux pron adj sconj,,,,,,,,,,,,
aux pron adj verb,,,,,,,,,,,,
aux pron adp,,,,,,,,,,,,
aux pron adp noun,,,,,,,,,,,,
aux pron adp num,,,,,,,,,,,,
aux pron adp pron,,,,,,,,,,,,
aux pron adp propn,,,,,,,,,,,,
aux pron adv,,,,,,,,,,,,
aux pron adv adj,,,,,,,,,,,,
aux pron adv punct,,,,,,,,,,,,
aux pron adv verb,,,,,,,,,,,,
aux pron aux,,,,,,,,,,,,
aux pron aux noun,,,,,,,,,,,,
aux pron aux verb,,,,,,,,,,,,
aux pron det,-0.20000000000000007,0.704,-0.20000000000000007,0.704,-0.20000000000000007,0.704,-0.20000000000000007,0.704,1.0,0.0,-0.20000000000000007,0.704
aux pron det adj,,,,,,,,,,,,
aux pron det aux,,,,,,,,,,,,
aux pron det num,,,,,,,,,,,,
aux pron det verb,-0.20000000000000007,0.704,-0.20000000000000007,0.704,-0.20000000000000007,0.704,-0.20000000000000007,0.704,1.0,0.0,-0.20000000000000007,0.704
aux pron noun,,,,,,,,,,,,
aux pron noun adj,,,,,,,,,,,,
aux pron noun adp,,,,,,,,,,,,
aux pron noun adv,,,,,,,,,,,,
aux pron noun det,,,,,,,,,,,,
aux pron noun emoji,,,,,,,,,,,,
aux pron noun intj,,,,,,,,,,,,
aux pron noun noun,,,,,,,,,,,,
aux pron noun pron,,,,,,,,,,,,
aux pron noun propn,,,,,,,,,,,,
aux pron noun punct,,,,,,,,,,,,
aux pron noun sconj,,,,,,,,,,,,
aux pron noun verb,,,,,,,,,,,,
aux pron num,,,,,,,,,,,,
aux pron num noun,,,,,,,,,,,,
aux pron pron,,,,,,,,,,,,
aux pron pron aux,,,,,,,,,,,,
aux pron pron verb,,,,,,,,,,,,
aux pron propn,,,,,,,,,,,,
aux pron propn cconj,,,,,,,,,,,,
aux pron propn propn,,,,,,,,,,,,
aux pron propn punct,,,,,,,,,,,,
aux pron punct,,,,,,,,,,,,
aux pron punct adv,,,,,,,,,,,,
aux pron punct aux,,,,,,,,,,,,
aux pron punct pron,,,,,,,,,,,,
aux pron punct punct,,,,,,,,,,,,
aux pron punct verb,,,,,,,,,,,,
aux pron verb,-0.3098386676965934,0.5501142545045465,-0.3098386676965934,0.5501142545045465,-0.3098386676965934,0.5501142545045465,-0.3098386676965934,0.5501142545045465,0.46475800154489,0.3530568618495133,0.7745966692414834,0.07048399691021993
aux pron verb adj,,,,,,,,,,,,
aux pron verb adp,,,,,,,,,,,,
aux pron verb adv,,,,,,,,,,,,
aux pron verb det,,,,,,,,,,,,
aux pron verb noun,-0.20000000000000007,0.704,-0.20000000000000007,0.704,-0.20000000000000007,0.704,-0.20000000000000007,0.704,-0.20000000000000007,0.704,1.0,0.0
aux pron verb num,,,,,,,,,,,,
aux pron verb pron,,,,,,,,,,,,
aux pron verb propn,-0.20000000000000007,0.704,-0.20000000000000007,0.704,-0.20000000000000007,0.704,-0.20000000000000007,0.704,1.0,0.0,-0.20000000000000007,0.704
aux pron verb punct,,,,,,,,,,,,
aux pron verb sconj,,,,,,,,,,,,
aux pron verb sym,,,,,,,,,,,,
aux pron verb verb,,,,,,,,,,,,
aux propn,-0.20000000000000007,0.704,-0.20000000000000007,0.704,-0.20000000000000007,0.704,1.0,0.0,-0.20000000000000007,0.704,-0.20000000000000007,0.704
aux propn adp,,,,,,,,,,,,
aux propn adp noun,,,,,,,,,,,,
aux propn adp propn,,,,,,,,,,,,
aux propn adv,,,,,,,,,,,,
aux propn adv adj,,,,,,,,,,,,
aux propn adv adv,,,,,,,,,,,,
aux propn adv propn,,,,,,,,,,,,
aux propn adv punct,,,,,,,,,,,,
aux propn adv sconj,,,,,,,,,,,,
aux propn adv verb,,,,,,,,,,,,
aux propn cconj,,,,,,,,,,,,
aux propn cconj adj,,,,,,,,,,,,
aux propn cconj pron,,,,,,,,,,,,
aux propn cconj propn,,,,,,,,,,,,
aux propn det,,,,,,,,,,,,
aux propn det noun,,,,,,,,,,,,
aux propn det propn,,,,,,,,,,,,
aux propn det verb,,,,,,,,,,,,
aux propn emoji,,,,,,,,,,,,
aux propn noun,,,,,,,,,,,,
aux propn noun adj,,,,,,,,,,,,
aux propn noun adv,,,,,,,,,,,,
aux propn noun cconj,,,,,,,,,,,,
aux propn noun verb,,,,,,,,,,,,
aux propn pron,,,,,,,,,,,,
aux propn pron propn,,,,,,,,,,,,
aux propn pron verb,,,,,,,,,,,,
aux propn propn,,,,,,,,,,,,
aux propn propn adp,,,,,,,,,,,,
aux propn propn aux,,,,,,,,,,,,
aux propn propn cconj,,,,,,,,,,,,
aux propn propn emoji,,,,,,,,,,,,
aux propn propn noun,,,,,,,,,,,,
aux propn propn propn,,,,,,,,,,,,
aux propn propn punct,,,,,,,,,,,,
aux propn propn verb,,,,,,,,,,,,
aux propn punct,,,,,,,,,,,,
aux propn punct adv,,,,,,,,,,,,
aux propn punct emoji,,,,,,,,,,,,
aux propn punct pron,,,,,,,,,,,,
aux propn punct punct,,,,,,,,,,,,
aux propn punct verb,,,,,,,,,,,,
aux propn sconj,,,,,,,,,,,,
aux propn sconj pron,,,,,,,,,,,,
aux propn verb,-0.20000000000000007,0.704,-0.20000000000000007,0.704,-0.20000000000000007,0.704,1.0,0.0,-0.20000000000000007,0.704,-0.20000000000000007,0.704
aux propn verb adj,,,,,,,,,,,,
aux propn verb adp,,,,,,,,,,,,
aux propn verb adv,,,,,,,,,,,,
aux propn verb det,-0.20000000000000007,0.704,-0.20000000000000007,0.704,-0.20000000000000007,0.704,1.0,0.0,-0.20000000000000007,0.704,-0.20000000000000007,0.704
aux propn verb noun,,,,,,,,,,,,
aux propn verb propn,,,,,,,,,,,,
aux propn verb punct,,,,,,,,,,,,
aux propn verb verb,,,,,,,,,,,,
aux punct,,,,,,,,,,,,
aux punct adv,,,,,,,,,,,,
aux punct adv adv,,,,,,,,,,,,
aux punct det,,,,,,,,,,,,
aux punct det adj,,,,,,,,,,,,
aux punct det noun,,,,,,,,,,,,
aux punct intj,,,,,,,,,,,,
aux punct intj punct,,,,,,,,,,,,
aux punct noun,,,,,,,,,,,,
aux punct noun noun,,,,,,,,,,,,
aux punct pron,,,,,,,,,,,,
aux punct pron aux,,,,,,,,,,,,
aux punct pron verb,,,,,,,,,,,,
aux punct punct,,,,,,,,,,,,
aux punct punct punct,,,,,,,,,,,,
aux punct sconj,,,,,,,,,,,,
aux punct sconj pron,,,,,,,,,,,,
aux punct verb,,,,,,,,,,,,
aux punct verb propn,,,,,,,,,,,,
aux sconj,,,,,,,,,,,,
aux sconj adp,,,,,,,,,,,,
aux sconj adp pron,,,,,,,,,,,,
aux sconj det,,,,,,,,,,,,
aux sconj det adj,,,,,,,,,,,,
aux sconj det noun,,,,,,,,,,,,
aux sconj pron,,,,,,,,,,,,
aux sconj pron adv,,,,,,,,,,,,
aux sconj pron aux,,,,,,,,,,,,
aux sconj pron noun,,,,,,,,,,,,
aux sconj pron verb,,,,,,,,,,,,
aux sconj propn,,,,,,,,,,,,
aux sconj propn aux,,,,,,,,,,,,
aux sconj propn verb,,,,,,,,,,,,
aux verb,0.3985266984930429,0.43385766067017734,-0.5313689313240573,0.27796339331848685,-0.13284223283101432,0.8019087881019875,-0.5313689313240573,0.27796339331848685,0.6642111641550715,0.15020042233101136,0.13284223283101432,0.8019087881019875
aux verb adj,1.0,0.0,-0.20000000000000007,0.704,-0.20000000000000007,0.704,-0.20000000000000007,0.704,-0.20000000000000007,0.704,-0.20000000000000007,0.704
aux verb adj adp,,,,,,,,,,,,
aux verb adj adv,,,,,,,,,,,,
aux verb adj aux,,,,,,,,,,,,
aux verb adj cconj,,,,,,,,,,,,
aux verb adj det,,,,,,,,,,,,
aux verb adj emoji,,,,,,,,,,,,
aux verb adj noun,,,,,,,,,,,,
aux verb adj pron,,,,,,,,,,,,
aux verb adj propn,,,,,,,,,,,,
aux verb adj punct,,,,,,,,,,,,
aux verb adj sconj,,,,,,,,,,,,
aux verb adj verb,,,,,,,,,,,,
aux verb adp,-0.20000000000000007,0.704,-0.20000000000000007,0.704,-0.20000000000000007,0.704,-0.20000000000000007,0.704,-0.20000000000000007,0.704,1.0,0.0
aux verb adp adj,,,,,,,,,,,,
aux verb adp adp,,,,,,,,,,,,
aux verb adp adv,,,,,,,,,,,,
aux verb adp cconj,,,,,,,,,,,,
aux verb adp det,,,,,,,,,,,,
aux verb adp intj,,,,,,,,,,,,
aux verb adp noun,,,,,,,,,,,,
aux verb adp num,,,,,,,,,,,,
aux verb adp pron,-0.20000000000000007,0.704,-0.20000000000000007,0.704,-0.20000000000000007,0.704,-0.20000000000000007,0.704,-0.20000000000000007,0.704,1.0,0.0
aux verb adp propn,,,,,,,,,,,,
aux verb adp punct,,,,,,,,,,,,
aux verb adp sconj,,,,,,,,,,,,
aux verb adp verb,,,,,,,,,,,,
aux verb adv,0.632455532033676,0.1778078083562211,-0.316227766016838,0.5414697392755848,-0.316227766016838,0.5414697392755848,-0.316227766016838,0.5414697392755848,0.632455532033676,0.1778078083562211,-0.316227766016838,0.5414697392755848
aux verb adv adj,,,,,,,,,,,,
aux verb adv adp,,,,,,,,,,,,
aux verb adv adv,,,,,,,,,,,,
aux verb adv det,,,,,,,,,,,,
aux verb adv emoji,,,,,,,,,,,,
aux verb adv noun,,,,,,,,,,,,
aux verb adv pron,,,,,,,,,,,,
aux verb adv propn,,,,,,,,,,,,
aux verb adv punct,,,,,,,,,,,,
aux verb adv sconj,,,,,,,,,,,,
aux verb adv verb,,,,,,,,,,,,
aux verb aux,,,,,,,,,,,,
aux verb aux adv,,,,,,,,,,,,
aux verb aux verb,,,,,,,,,,,,
aux verb cconj,,,,,,,,,,,,
aux verb cconj adv,,,,,,,,,,,,
aux verb cconj det,,,,,,,,,,,,
aux verb cconj pron,,,,,,,,,,,,
aux verb cconj propn,,,,,,,,,,,,
aux verb cconj sconj,,,,,,,,,,,,
aux verb cconj verb,,,,,,,,,,,,
aux verb det,0.5656854249492381,0.24198153056802077,-0.4242640687119286,0.40178766311618047,-0.4242640687119286,0.40178766311618047,-0.4242640687119286,0.40178766311618047,0.5656854249492381,0.24198153056802077,0.14142135623730953,0.7892821792064089
aux verb det adj,-0.20000000000000007,0.704,-0.20000000000000007,0.704,-0.20000000000000007,0.704,-0.20000000000000007,0.704,-0.20000000000000007,0.704,1.0,0.0
aux verb det adp,,,,,,,,,,,,
aux verb det aux,,,,,,,,,,,,
aux verb det det,,,,,,,,,,,,
aux verb det emoji,,,,,,,,,,,,
aux verb det noun,0.632455532033676,0.1778078083562211,-0.316227766016838,0.5414697392755848,-0.316227766016838,0.5414697392755848,-0.316227766016838,0.5414697392755848,0.632455532033676,0.1778078083562211,-0.316227766016838,0.5414697392755848
aux verb det propn,,,,,,,,,,,,
aux verb det punct,,,,,,,,,,,,
aux verb det verb,,,,,,,,,,,,
aux verb emoji,,,,,,,,,,,,
aux verb emoji emoji,,,,,,,,,,,,
aux verb intj,,,,,,,,,,,,
aux verb noun,0.632455532033676,0.1778078083562211,-0.316227766016838,0.5414697392755848,-0.316227766016838,0.5414697392755848,-0.316227766016838,0.5414697392755848,0.632455532033676,0.1778078083562211,-0.316227766016838,0.5414697392755848
aux verb noun adp,0.632455532033676,0.1778078083562211,-0.316227766016838,0.5414697392755848,-0.316227766016838,0.5414697392755848,-0.316227766016838,0.5414697392755848,0.632455532033676,0.1778078083562211,-0.316227766016838,0.5414697392755848
aux verb noun adv,,,,,,,,,,,,
aux verb noun cconj,,,,,,,,,,,,
aux verb noun emoji,,,,,,,,,,,,
aux verb noun noun,,,,,,,,,,,,
aux verb noun pron,,,,,,,,,,,,
aux verb noun punct,,,,,,,,,,,,
aux verb noun sconj,,,,,,,,,,,,
aux verb noun verb,,,,,,,,,,,,
aux verb num,,,,,,,,,,,,
aux verb num det,,,,,,,,,,,,
aux verb num noun,,,,,,,,,,,,
aux verb num sconj,,,,,,,,,,,,
aux verb pron,0.28284271247461906,0.5870496397870562,-0.4242640687119286,0.40178766311618047,-0.4242640687119286,0.40178766311618047,-0.4242640687119286,0.40178766311618047,0.28284271247461906,0.5870496397870562,0.7071067811865477,0.11611652351681541
aux verb pron adj,,,,,,,,,,,,
aux verb pron adp,0.5656854249492381,0.24198153056802077,-0.4242640687119286,0.40178766311618047,-0.4242640687119286,0.40178766311618047,-0.4242640687119286,0.40178766311618047,0.5656854249492381,0.24198153056802077,0.14142135623730953,0.7892821792064089
aux verb pron adv,,,,,,,,,,,,
aux verb pron aux,,,,,,,,,,,,
aux verb pron cconj,,,,,,,,,,,,
aux verb pron det,,,,,,,,,,,,
aux verb pron emoji,,,,,,,,,,,,
aux verb pron noun,-0.20000000000000007,0.704,-0.20000000000000007,0.704,-0.20000000000000007,0.704,-0.20000000000000007,0.704,-0.20000000000000007,0.704,1.0,0.0
aux verb pron pron,,,,,,,,,,,,
aux verb pron propn,,,,,,,,,,,,
aux verb pron punct,-0.20000000000000007,0.704,-0.20000000000000007,0.704,-0.20000000000000007,0.704,-0.20000000000000007,0.704,-0.20000000000000007,0.704,1.0,0.0
aux verb pron sconj,,,,,,,,,,,,
aux verb pron sym,,,,,,,,,,,,
aux verb pron verb,,,,,,,,,,,,
aux verb propn,,,,,,,,,,,,
aux verb propn adv,,,,,,,,,,,,
aux verb propn aux,,,,,,,,,,,,
aux verb propn cconj,,,,,,,,,,,,
aux verb propn noun,,,,,,,,,,,,
aux verb propn propn,,,,,,,,,,,,
aux verb propn punct,,,,,,,,,,,,
aux verb punct,,,,,,,,,,,,
aux verb punct adj,,,,,,,,,,,,
aux verb punct adv,,,,,,,,,,,,
aux verb punct aux,,,,,,,,,,,,
aux verb punct cconj,,,,,,,,,,,,
aux verb punct det,,,,,,,,,,,,
aux verb punct pron,,,,,,,,,,,,
aux verb punct punct,,,,,,,,,,,,
aux verb punct verb,,,,,,,,,,,,
aux verb sconj,,,,,,,,,,,,
aux verb sconj adj,,,,,,,,,,,,
aux verb sconj det,,,,,,,,,,,,
aux verb sconj noun,,,,,,,,,,,,
aux verb sconj pron,,,,,,,,,,,,
aux verb sconj propn,,,,,,,,,,,,
aux verb sym,,,,,,,,,,,,
aux verb sym noun,,,,,,,,,,,,
aux verb verb,-0.316227766016838,0.5414697392755848,-0.316227766016838,0.5414697392755848,0.632455532033676,0.1778078083562211,-0.316227766016838,0.5414697392755848,0.632455532033676,0.1778078083562211,-0.316227766016838,0.5414697392755848
aux verb verb adj,,,,,,,,,,,,
aux verb verb adp,-0.316227766016838,0.5414697392755848,-0.316227766016838,0.5414697392755848,0.632455532033676,0.1778078083562211,-0.316227766016838,0.5414697392755848,0.632455532033676,0.1778078083562211,-0.316227766016838,0.5414697392755848
aux verb verb adv,,,,,,,,,,,,
aux verb verb cconj,,,,,,,,,,,,
aux verb verb det,,,,,,,,,,,,
aux verb verb noun,,,,,,,,,,,,
aux verb verb num,,,,,,,,,,,,
aux verb verb pron,,,,,,,,,,,,
aux verb verb propn,,,,,,,,,,,,
aux verb verb punct,,,,,,,,,,,,
aux verb verb sconj,,,,,,,,,,,,
aux verb verb verb,,,,,,,,,,,,
cconj,0.7745966692414834,0.07048399691021993,-0.3098386676965934,0.5501142545045465,-0.3098386676965934,0.5501142545045465,-0.3098386676965934,0.5501142545045465,0.46475800154489,0.3530568618495133,-0.3098386676965934,0.5501142545045465
cconj adj,,,,,,,,,,,,
cconj adj adj,,,,,,,,,,,,
cconj adj adp,,,,,,,,,,,,
cconj adj adp det,,,,,,,,,,,,
cconj adj adp noun,,,,,,,,,,,,
cconj adj adp propn,,,,,,,,,,,,
cconj adj aux,,,,,,,,,,,,
cconj adj aux adv,,,,,,,,,,,,
cconj adj aux verb,,,,,,,,,,,,
cconj adj cconj,,,,,,,,,,,,
cconj adj cconj adj,,,,,,,,,,,,
cconj adj cconj propn,,,,,,,,,,,,
cconj adj det,,,,,,,,,,,,
cconj adj det det,,,,,,,,,,,,
cconj adj noun,,,,,,,,,,,,
cconj adj noun adp,,,,,,,,,,,,
cconj adj noun aux,,,,,,,,,,,,
cconj adj noun noun,,,,,,,,,,,,
cconj adj pron,,,,,,,,,,,,
cconj adj pron verb,,,,,,,,,,,,
cconj adj punct,,,,,,,,,,,,
cconj adj punct aux,,,,,,,,,,,,
cconj adj punct det,,,,,,,,,,,,
cconj adj sconj,,,,,,,,,,,,
cconj adj sconj emoji,,,,,,,,,,,,
cconj adj verb,,,,,,,,,,,,
cconj adj verb adv,,,,,,,,,,,,
cconj adp,,,,,,,,,,,,
cconj adp adj,,,,,,,,,,,,
cconj adp adj noun,,,,,,,,,,,,
cconj adp noun,,,,,,,,,,,,
cconj adp noun cconj,,,,,,,,,,,,
cconj adp num,,,,,,,,,,,,
cconj adp num noun,,,,,,,,,,,,
cconj adp pron,,,,,,,,,,,,
cconj adp pron noun,,,,,,,,,,,,
cconj adp verb,,,,,,,,,,,,
cconj adp verb det,,,,,,,,,,,,
cconj adv,,,,,,,,,,,,
cconj adv adj,,,,,,,,,,,,
cconj adv adj noun,,,,,,,,,,,,
cconj adv adp,,,,,,,,,,,,
cconj adv adp propn,,,,,,,,,,,,
cconj adv adv,,,,,,,,,,,,
cconj adv adv punct,,,,,,,,,,,,
cconj adv aux,,,,,,,,,,,,
cconj adv aux det,,,,,,,,,,,,
cconj adv aux verb,,,,,,,,,,,,
cconj adv det,,,,,,,,,,,,
cconj adv det noun,,,,,,,,,,,,
cconj adv noun,,,,,,,,,,,,
cconj adv noun pron,,,,,,,,,,,,
cconj adv noun punct,,,,,,,,,,,,
cconj adv pron,,,,,,,,,,,,
cconj adv pron aux,,,,,,,,,,,,
cconj adv pron verb,,,,,,,,,,,,
cconj adv punct,,,,,,,,,,,,
cconj adv punct verb,,,,,,,,,,,,
cconj adv sconj,,,,,,,,,,,,
cconj adv sconj pron,,,,,,,,,,,,
cconj adv verb,,,,,,,,,,,,
cconj adv verb adj,,,,,,,,,,,,
cconj adv verb adp,,,,,,,,,,,,
cconj adv verb det,,,,,,,,,,,,
cconj adv verb pron,,,,,,,,,,,,
cconj adv verb punct,,,,,,,,,,,,
cconj adv verb verb,,,,,,,,,,,,
cconj aux,,,,,,,,,,,,
cconj aux adv,,,,,,,,,,,,
cconj aux adv adv,,,,,,,,,,,,
cconj aux adv verb,,,,,,,,,,,,
cconj aux det,,,,,,,,,,,,
cconj aux det noun,,,,,,,,,,,,
cconj aux pron,,,,,,,,,,,,
cconj aux pron noun,,,,,,,,,,,,
cconj aux pron verb,,,,,,,,,,,,
cconj aux verb,,,,,,,,,,,,
cconj aux verb adv,,,,,,,,,,,,
cconj aux verb det,,,,,,,,,,,,
cconj aux verb noun,,,,,,,,,,,,
cconj aux verb pron,,,,,,,,,,,,
cconj aux verb punct,,,,,,,,,,,,
cconj cconj,,,,,,,,,,,,
cconj cconj pron,,,,,,,,,,,,
cconj cconj pron noun,,,,,,,,,,,,
cconj det,,,,,,,,,,,,
cconj det adj,,,,,,,,,,,,
cconj det adj noun,,,,,,,,,,,,
cconj det adp,,,,,,,,,,,,
cconj det adp det,,,,,,,,,,,,
cconj det aux,,,,,,,,,,,,
cconj det aux adj,,,,,,,,,,,,
cconj det cconj,,,,,,,,,,,,
cconj det cconj pron,,,,,,,,,,,,
cconj det noun,,,,,,,,,,,,
cconj det noun adj,,,,,,,,,,,,
cconj det noun adp,,,,,,,,,,,,
cconj det noun adv,,,,,,,,,,,,
cconj det noun aux,,,,,,,,,,,,
cconj det noun cconj,,,,,,,,,,,,
cconj det noun det,,,,,,,,,,,,
cconj det noun noun,,,,,,,,,,,,
cconj det noun pron,,,,,,,,,,,,
cconj det noun verb,,,,,,,,,,,,
cconj det num,,,,,,,,,,,,
cconj det num noun,,,,,,,,,,,,
cconj det pron,,,,,,,,,,,,
cconj det pron aux,,,,,,,,,,,,
cconj det propn,,,,,,,,,,,,
cconj det propn adj,,,,,,,,,,,,
cconj det propn noun,,,,,,,,,,,,
cconj det verb,,,,,,,,,,,,
cconj det verb adj,,,,,,,,,,,,
cconj emoji,,,,,,,,,,,,
cconj intj,,,,,,,,,,,,
cconj intj pron,,,,,,,,,,,,
cconj intj pron aux,,,,,,,,,,,,
cconj noun,,,,,,,,,,,,
cconj noun adp,,,,,,,,,,,,
cconj noun adp adv,,,,,,,,,,,,
cconj noun adp propn,,,,,,,,,,,,
cconj noun adv,,,,,,,,,,,,
cconj noun adv aux,,,,,,,,,,,,
cconj noun adv pron,,,,,,,,,,,,
cconj noun aux,,,,,,,,,,,,
cconj noun aux adj,,,,,,,,,,,,
cconj noun aux verb,,,,,,,,,,,,
cconj noun cconj,,,,,,,,,,,,
cconj noun cconj noun,,,,,,,,,,,,
cconj noun cconj propn,,,,,,,,,,,,
cconj noun emoji,,,,,,,,,,,,
cconj noun noun,,,,,,,,,,,,
cconj noun noun noun,,,,,,,,,,,,
cconj noun noun punct,,,,,,,,,,,,
cconj noun pron,,,,,,,,,,,,
cconj noun pron aux,,,,,,,,,,,,
cconj noun pron verb,,,,,,,,,,,,
cconj noun sconj,,,,,,,,,,,,
cconj noun sconj pron,,,,,,,,,,,,
cconj noun verb,,,,,,,,,,,,
cconj noun verb adj,,,,,,,,,,,,
cconj noun verb adp,,,,,,,,,,,,
cconj noun verb adv,,,,,,,,,,,,
cconj noun verb det,,,,,,,,,,,,
cconj noun verb emoji,,,,,,,,,,,,
cconj noun verb intj,,,,,,,,,,,,
cconj noun verb pron,,,,,,,,,,,,
cconj num,,,,,,,,,,,,
cconj num noun,,,,,,,,,,,,
cconj num noun adv,,,,,,,,,,,,
cconj num noun cconj,,,,,,,,,,,,
cconj num noun punct,,,,,,,,,,,,
cconj num punct,,,,,,,,,,,,
cconj num punct adv,,,,,,,,,,,,
cconj pron,0.7745966692414834,0.07048399691021993,-0.3098386676965934,0.5501142545045465,-0.3098386676965934,0.5501142545045465,-0.3098386676965934,0.5501142545045465,0.46475800154489,0.3530568618495133,-0.3098386676965934,0.5501142545045465
cconj pron adj,0.632455532033676,0.1778078083562211,-0.316227766016838,0.5414697392755848,-0.316227766016838,0.5414697392755848,-0.316227766016838,0.5414697392755848,0.632455532033676,0.1778078083562211,-0.316227766016838,0.5414697392755848
cconj pron adp,,,,,,,,,,,,
cconj pron adp det,,,,,,,,,,,,
cconj pron adp pron,,,,,,,,,,,,
cconj pron adv,,,,,,,,,,,,
cconj pron adv verb,,,,,,,,,,,,
cconj pron aux,,,,,,,,,,,,
cconj pron aux adj,,,,,,,,,,,,
cconj pron aux adv,,,,,,,,,,,,
cconj pron aux det,,,,,,,,,,,,
cconj pron aux num,,,,,,,,,,,,
cconj pron aux pron,,,,,,,,,,,,
cconj pron aux verb,,,,,,,,,,,,
cconj pron cconj,,,,,,,,,,,,
cconj pron cconj pron,,,,,,,,,,,,
cconj pron cconj verb,,,,,,,,,,,,
cconj pron det,,,,,,,,,,,,
cconj pron det aux,,,,,,,,,,,,
cconj pron emoji,,,,,,,,,,,,
cconj pron noun,,,,,,,,,,,,
cconj pron noun adp,,,,,,,,,,,,
cconj pron noun aux,,,,,,,,,,,,
cconj pron noun noun,,,,,,,,,,,,
cconj pron noun verb,,,,,,,,,,,,
cconj pron propn,,,,,,,,,,,,
cconj pron propn aux,,,,,,,,,,,,
cconj pron propn pron,,,,,,,,,,,,
cconj pron punct,,,,,,,,,,,,
cconj pron punct emoji,,,,,,,,,,,,
cconj pron punct verb,,,,,,,,,,,,
cconj pron verb,1.0,0.0,-0.20000000000000007,0.704,-0.20000000000000007,0.704,-0.20000000000000007,0.704,-0.20000000000000007,0.704,-0.20000000000000007,0.704
cconj pron verb adj,1.0,0.0,-0.20000000000000007,0.704,-0.20000000000000007,0.704,-0.20000000000000007,0.704,-0.20000000000000007,0.704,-0.20000000000000007,0.704
cconj pron verb adp,,,,,,,,,,,,
cconj pron verb adv,,,,,,,,,,,,
cconj pron verb det,1.0,0.0,-0.20000000000000007,0.704,-0.20000000000000007,0.704,-0.20000000000000007,0.704,-0.20000000000000007,0.704,-0.20000000000000007,0.704
cconj pron verb noun,,,,,,,,,,,,
cconj pron verb pron,,,,,,,,,,,,
cconj pron verb propn,,,,,,,,,,,,
cconj pron verb punct,,,,,,,,,,,,
cconj pron verb sconj,,,,,,,,,,,,
cconj pron verb verb,,,,,,,,,,,,
cconj propn,,,,,,,,,,,,
cconj propn adp,,,,,,,,,,,,
cconj propn adp det,,,,,,,,,,,,
cconj propn adp propn,,,,,,,,,,,,
cconj propn adv,,,,,,,,,,,,
cconj propn adv adj,,,,,,,,,,,,
cconj propn adv verb,,,,,,,,,,,,
cconj propn aux,,,,,,,,,,,,
cconj propn aux adj,,,,,,,,,,,,
cconj propn aux adv,,,,,,,,,,,,
cconj propn aux noun,,,,,,,,,,,,
cconj propn aux verb,,,,,,,,,,,,
cconj propn cconj,,,,,,,,,,,,
cconj propn cconj propn,,,,,,,,,,,,
cconj propn det,,,,,,,,,,,,
cconj propn det noun,,,,,,,,,,,,
cconj propn noun,,,,,,,,,,,,
cconj propn noun aux,,,,,,,,,,,,
cconj propn noun punct,,,,,,,,,,,,
cconj propn noun verb,,,,,,,,,,,,
cconj propn pron,,,,,,,,,,,,
cconj propn pron adv,,,,,,,,,,,,
cconj propn pron aux,,,,,,,,,,,,
cconj propn pron verb,,,,,,,,,,,,
cconj propn propn,,,,,,,,,,,,
cconj propn propn adv,,,,,,,,,,,,
cconj propn propn noun,,,,,,,,,,,,
cconj propn propn punct,,,,,,,,,,,,
cconj propn punct,,,,,,,,,,,,
cconj propn punct pron,,,,,,,,,,,,
cconj propn punct punct,,,,,,,,,,,,
cconj propn punct verb,,,,,,,,,,,,
cconj propn verb,,,,,,,,,,,,
cconj propn verb adp,,,,,,,,,,,,
cconj propn verb noun,,,,,,,,,,,,
cconj propn verb pron,,,,,,,,,,,,
cconj punct,,,,,,,,,,,,
cconj punct pron,,,,,,,,,,,,
cconj punct pron aux,,,,,,,,,,,,
cconj punct propn,,,,,,,,,,,,
cconj punct sconj,,,,,,,,,,,,
cconj punct sconj adj,,,,,,,,,,,,
cconj sconj,,,,,,,,,,,,
cconj sconj adj,,,,,,,,,,,,
cconj sconj adj noun,,,,,,,,,,,,
cconj sconj adp,,,,,,,,,,,,
cconj sconj adp adv,,,,,,,,,,,,
cconj sconj adp noun,,,,,,,,,,,,
cconj sconj det,,,,,,,,,,,,
cconj sconj det noun,,,,,,,,,,,,
cconj sconj pron,,,,,,,,,,,,
cconj sconj pron adj,,,,,,,,,,,,
cconj sconj pron adv,,,,,,,,,,,,
cconj sconj pron aux,,,,,,,,,,,,
cconj sconj pron cconj,,,,,,,,,,,,
cconj sconj pron det,,,,,,,,,,,,
cconj sconj pron noun,,,,,,,,,,,,
cconj sconj pron verb,,,,,,,,,,,,
cconj sconj propn,,,,,,,,,,,,
cconj sconj propn verb,,,,,,,,,,,,
cconj verb,,,,,,,,,,,,
cconj verb adj,,,,,,,,,,,,
cconj verb adj adp,,,,,,,,,,,,
cconj verb adj noun,,,,,,,,,,,,
cconj verb adj punct,,,,,,,,,,,,
cconj verb adp,,,,,,,,,,,,
cconj verb adp adj,,,,,,,,,,,,
cconj verb adp adp,,,,,,,,,,,,
cconj verb adp adv,,,,,,,,,,,,
cconj verb adp det,,,,,,,,,,,,
cconj verb adp noun,,,,,,,,,,,,
cconj verb adp pron,,,,,,,,,,,,
cconj verb adp propn,,,,,,,,,,,,
cconj verb adp punct,,,,,,,,,,,,
cconj verb adv,,,,,,,,,,,,
cconj verb adv adp,,,,,,,,,,,,
cconj verb adv cconj,,,,,,,,,,,,
cconj verb adv noun,,,,,,,,,,,,
cconj verb adv punct,,,,,,,,,,,,
cconj verb adv sconj,,,,,,,,,,,,
cconj verb adv verb,,,,,,,,,,,,
cconj verb aux,,,,,,,,,,,,
cconj verb aux adj,,,,,,,,,,,,
cconj verb aux verb,,,,,,,,,,,,
cconj verb cconj,,,,,,,,,,,,
cconj verb cconj propn,,,,,,,,,,,,
cconj verb det,,,,,,,,,,,,
cconj verb det noun,,,,,,,,,,,,
cconj verb intj,,,,,,,,,,,,
cconj verb intj verb,,,,,,,,,,,,
cconj verb noun,,,,,,,,,,,,
cconj verb noun adp,,,,,,,,,,,,
cconj verb noun adv,,,,,,,,,,,,
cconj verb noun verb,,,,,,,,,,,,
cconj verb num,,,,,,,,,,,,
cconj verb pron,,,,,,,,,,,,
cconj verb pron adp,,,,,,,,,,,,
cconj verb pron det,,,,,,,,,,,,
cconj verb pron noun,,,,,,,,,,,,
cconj verb pron propn,,,,,,,,,,,,
cconj verb pron verb,,,,,,,,,,,,
cconj verb punct,,,,,,,,,,,,
cconj verb punct adj,,,,,,,,,,,,
cconj verb punct noun,,,,,,,,,,,,
cconj verb verb,,,,,,,,,,,,
cconj verb verb adj,,,,,,,,,,,,
cconj verb verb det,,,,,,,,,,,,
cconj verb verb noun,,,,,,,,,,,,
cconj verb verb pron,,,,,,,,,,,,
cconj verb verb punct,,,,,,,,,,,,
det,0.6546536707079772,0.15830242337545783,-0.13093073414159545,0.8047261622231061,0.13093073414159545,0.8047261622231061,-0.6546536707079772,0.15830242337545783,0.39279220242478635,0.4411128091213043,-0.39279220242478635,0.4411128091213043
det adj,0.6546536707079772,0.15830242337545783,-0.13093073414159545,0.8047261622231061,-0.6546536707079772,0.15830242337545783,0.13093073414159545,0.8047261622231061,0.39279220242478635,0.4411128091213043,-0.39279220242478635,0.4411128091213043
det adj adj,,,,,,,,,,,,
det adj adj adj,,,,,,,,,,,,
det adj adj noun,,,,,,,,,,,,
det adj adj propn,,,,,,,,,,,,
det adj adp,,,,,,,,,,,,
det adj adp adj,,,,,,,,,,,,
det adj adp det,,,,,,,,,,,,
det adj adp noun,,,,,,,,,,,,
det adj adp propn,,,,,,,,,,,,
det adj adv,,,,,,,,,,,,
det adj aux,,,,,,,,,,,,
det adj aux adj,,,,,,,,,,,,
det adj cconj,,,,,,,,,,,,
det adj cconj adj,,,,,,,,,,,,
det adj cconj det,,,,,,,,,,,,
det adj emoji,,,,,,,,,,,,
det adj noun,0.6546536707079772,0.15830242337545783,-0.13093073414159545,0.8047261622231061,-0.6546536707079772,0.15830242337545783,0.13093073414159545,0.8047261622231061,0.39279220242478635,0.4411128091213043,-0.39279220242478635,0.4411128091213043
det adj noun adj,1.0,0.0,-0.20000000000000007,0.704,-0.20000000000000007,0.704,-0.20000000000000007,0.704,-0.20000000000000007,0.704,-0.20000000000000007,0.704
det adj noun adp,1.0,0.0,-0.20000000000000007,0.704,-0.20000000000000007,0.704,-0.20000000000000007,0.704,-0.20000000000000007,0.704,-0.20000000000000007,0.704
det adj noun adv,,,,,,,,,,,,
